Timestamp,Reporting_Month,Supplier_Name,Hydrologic_Region,Population_Served,Mandatory_Restrictions,Water_Days_Allowed/Week,Complaints_Received,Follow_up_Actions,Warnings_Issued,Penalties_Assessed,Enforcement_Comments03/01/15 00:00,15-Mar,East Bay Municipal Utilities District,San Francisco Bay,1390000,Yes,2,,,,,"EBMUD’s Board adopted Section 28 of the District’s Regulations Governing Service to Customers on August 12, 2014 to specify outdoor water uses that are prohibited until further notice and provide guidelines on effective water use practices to help customers conserve. Section 28 also defines the exceptions and enforcement provisions should customers fail to comply with the prohibitions.  "03/01/15 00:00,15-Mar,Morro Bay  City of,Central Coast,10234,Yes,2,3,3,2,0,03/01/15 00:00,15-Mar,Yorba Linda Water District,South Coast,73990,Yes,3,23,23,23,0,"On the first violation, YLWD will hand deliver a door hanger to the location of the violation and mail a notice to the current billing address. A second violation within 12 calendar months is punishable by a penalty of $100. A third violation within 12 calendar months of the first or second violations is punishable by a penalty of $250. A fourth and any subsequent violations within 12 calendar months of the first violation are punishable by a fine of $500. In addition, the District may opt to install a water flow restrictor device. "03/01/15 00:00,15-Mar,Long Beach  City of,South Coast,473050,Yes,2,493,397,13,4,03/01/15 00:00,15-Mar,"Los Banos, City of",San Joaquin River,37168,Yes,2,,,,,03/01/15 00:00,15-Mar,Turlock  City of,San Joaquin River,71181,Yes,2,88,88,88,0,03/01/15 00:00,15-Mar,Jurupa Community Service District,South Coast,118731,Yes,4,40,40,6,0,03/01/15 00:00,15-Mar,Coastside County Water District,San Francisco Bay,16668,Yes,7,0,0,0,0,03/01/15 00:00,15-Mar,Citrus Heights Water District,Sacramento River,67333,Yes,,,,,,03/01/15 00:00,15-Mar,Burlingame  City of,San Francisco Bay,30282,Yes,7,6,5,5,0,03/01/15 00:00,15-Mar,Orange Vale Water Company,Sacramento River,14283,Yes,7,9,9,9,0,03/01/15 00:00,15-Mar,Dublin San Ramon Services District,San Francisco Bay,78164,Yes,0,7,na,1,0,03/01/15 00:00,15-Mar,Los Angeles Department of Water and Power,South Coast,3935257,Yes,3,1215,1669,1364,13,"Our Water Conservation Response Unit (WCRU), a.k.a. “Water Cops”, actively patrol Los Angeles communities and enforce the City’s Emergency Water Conservation Ordinance. The WCRU investigates reports of wasteful water use and educates violators on the importance of complying with the Water Conservation Ordinance. The WCRU also catches additional violations that were not reported while patrolling neighborhoods. The first official penalty is a citation (warning) letter. Repeat violators are issued monetary fines ranging from $100-$600. Because LADWP has had an emergency water conservation ordinance with outdoor watering restrictions in effect since 2009, LADWP’s customers have been well educated for some time now on ordinance requirements. Therefore, most customers who receive a contact from the WCRU and/or a warning letter respond very well and change their habits immediately. This explains why LADWP has not issued many fines in recent years."03/01/15 00:00,15-Mar,Camrosa Water District,South Coast,27037,Yes,7,0,0,0,0,03/01/15 00:00,15-Mar,El Dorado Irrigation District,Sacramento River,128500,Yes,,,,,,03/01/15 00:00,15-Mar,El Centro  City of,Colorado River,44311,Yes,,,,,,03/01/15 00:00,15-Mar,Milpitas  City of,San Francisco Bay,70817,Yes,,,,,,03/01/15 00:00,15-Mar,Santa Rosa  City of,North Coast,170093,Yes,7,32,32,35,0,03/01/15 00:00,15-Mar,Westminster  City of,South Coast,93322,Yes,2,15,15,15,0,03/01/15 00:00,15-Mar,Mid-Peninsula Water District,San Francisco Bay,26030,Yes,2,5,5,5,0,03/01/15 00:00,15-Mar,Olivenhain Municipal Water District,South Coast,69175,Yes,3,15,15,12,0,03/01/15 00:00,15-Mar,Daly City  City of,San Francisco Bay,105076,No,,2,2,2,0,03/01/15 00:00,15-Mar,Delano  City of,Tulare Lake,48957,Yes,3,11,28,28,0,The city will adjust to accommodate the required regulations. The city will install meters on any unmetered customers that do not follow these regulations.03/01/15 00:00,15-Mar,Anaheim  City of,South Coast,358549,Yes,7,89,54,32,,03/01/15 00:00,15-Mar,Elsinore Valley Municipal Water District,South Coast,148587,Yes,3,3,3,0,0,03/01/15 00:00,15-Mar,Coachella Valley Water District,Colorado River,213802,Yes,7,69,69,70,1,03/01/15 00:00,15-Mar,Lake Hemet Municipal Water District,South Coast,52914,Yes,,,,,,03/01/15 00:00,15-Mar,Carmichael Water District,Sacramento River,38354,Yes,2,49,49,49,0,03/01/15 00:00,15-Mar,Monte Vista Water District,South Coast,54460,Yes,,,,,,03/01/15 00:00,15-Mar,Pleasanton  City of,San Francisco Bay,73067,Yes,2,31,31,0,0,03/01/15 00:00,15-Mar,Santa Monica  City of,South Coast,92185,Yes,7,52,52,52,1,Complaint figure includes 15 cases related to urban runoff. Written warnings were delivered to violators by hand or mail for all 52 violations.03/01/15 00:00,15-Mar,Riverside  City of,South Coast,298669,Yes,4,,,,,03/01/15 00:00,15-Mar,Contra Costa Water District,San Francisco Bay,197536,Yes,2,35,35,35,0,"CCWD has increased its outreach to customers to improve water use efficiency, including:  • Contacting customers regarding water waste through visits, phone calls, or door hangers. • Providing prominent information about the drought requirements on CCWD’s website.  • Providing a means for customers to report water waste through the website or phone. • Outreach to restaurants, hotels, cafes, cafeterias, bars, or other public places to prohibit serving of drinking water other than upon request. • Outreach to hotels and motels to provide guests with the option of choosing not to have towels and linens laundered daily, and prominently display a notice of this in each bathroom. "03/01/15 00:00,15-Mar,"Imperial, City of",Colorado River,18022,Yes,3,1,5,0,0,03/01/15 00:00,15-Mar,California Water Service Company Antelope Valley,South Lahontan,3387,Yes,7,0,0,0,0,03/01/15 00:00,15-Mar,Irvine Ranch Water District,South Coast,385056,No,,2,56,,,"Prohibitions in effect at all times regardless of whether shortage declared: Gutter flooding, leaks, washing down hard surface areas, waste, and run-off. Water waste is considered as above allocation use as determined by the allocation based conservation rate structure. Customers whose use exceeds their allocation are sent a strong price signal based on increasingly costly tiers."03/01/15 00:00,15-Mar,Watsonville  City of,Central Coast,65739,Yes,2,4,4,0,0,"City staff will follow up once a problem of water waste has been reported. We offer information about how to reduce water waste and schedule a free, one-time Water Conservation Consultation to help fix the problem. If water waste continues beyond the educational warning and Water Conservation Consultation, the City will begin fines to address further ongoing water waste violations."03/01/15 00:00,15-Mar,San Jose  City of,San Francisco Bay,117576,Yes,7,18,18,,0,"Muni Water has also continued all enforcement efforts described in previous months. Enforcement data is estimated and based on data from the Access Valley Water database managed by Santa Clara Valley Water District, which receives, validates and dispatches the water waste service requests from the public in Santa Clara County. The number of formal warning actions is currently unavailable, and we are working to obtain this data for our service area."03/01/15 00:00,15-Mar,Casitas Municipal Water District,South Coast,3478,Yes,,,,,,03/01/15 00:00,15-Mar,Sacramento Suburban Water District,Sacramento River,174304,Yes,2,97,78,51,0,03/01/15 00:00,15-Mar,San Jose Water Company,San Francisco Bay,990000,Yes,3,100,96,96,0,Note: We received 100 complaints in March.  We responded to 96.  The difference refers to those completed in early April.  All 96 received door hangers and 3 received formal letters.03/01/15 00:00,15-Mar,Rowland Water District,South Coast,62106,Yes,2,7,0,0,0,03/01/15 00:00,15-Mar,Folsom  City of,Sacramento River,61877,Yes,2,80,64,11,0,03/01/15 00:00,15-Mar,Chino  City of,South Coast,78073,Yes,,,,,,03/01/15 00:00,15-Mar,South Tahoe Public Utilities District,North Lahontan,33124,Yes,3,,,,,"Water conservation efforts during winter months, when there is no irrigation water use, consist of conducting indoor water efficiency measures to include leak audits, water efficiency audits and rebates on the purchase and installation of water savings appliances and devices."03/01/15 00:00,15-Mar,"Soledad, City of",Central Coast,16729,Yes,2,0,0,0,0,03/01/15 00:00,15-Mar,North Marin Water District,San Francisco Bay,61294,Yes,,,,,,03/01/15 00:00,15-Mar,Marin Municipal Water District,San Francisco Bay,188200,Yes,,,,,,03/01/15 00:00,15-Mar,Shafter  City of,Tulare Lake,18488,Yes,,,,,,03/01/15 00:00,15-Mar,"Windsor, Town of",North Coast,27391,Yes,3,51,42,1,0,03/01/15 00:00,15-Mar,Indian Wells Valley Water District,South Lahontan,31120,Yes,,,,,,Ordinance 93 restricts landscape watering to between the hours of 8:00 PM and 8:00 AM from May 1st to October 31st and requires leaks to be repaired in a timely manner.  There is a four-step penalty process for repeated violations.  The initial violation is a warning along with educational materials provided.  A second violation can result in a fine of up to $50 added to the bill for the account.  A third violation can result in a fine of up to $200 added to the bill and issuing a warning that service may be terminated within 30 days if the issue is not addressed.  A fourth violation can result in a 48 hour notice of termination of service.  The Board of Directors will be considering an Emergency Conservation Ordinance at the April 13th meeting.  The Ordinance will include an even-odd watering schedule whereby houses with an address ending in an even number may irrigate landscaping on even numbered days and those with an address ending in an odd number may irrigate landscaping on odd numbered days.  The time of day restrictions in Ordinance 93 would remain in effect.03/01/15 00:00,15-Mar,San Francisco Public Utilities Commission,San Francisco Bay,846601,Yes,,113,113,83,0,"The San Francisco Public Utilities Commission is scheduled to take action at their April 28th meeting to adopt various conservation measures, including limiting outdoor watering to two days per week."03/01/15 00:00,15-Mar,Brawley  City of,Colorado River,27743,Yes,,,,,,03/01/15 00:00,15-Mar,Ontario  City of,South Coast,166866,Yes,7,7,7,0,0,03/01/15 00:00,15-Mar,Huntington Beach  City of,South Coast,196041,Yes,2,132,236,215,0,03/01/15 00:00,15-Mar,Calaveras County Water District,San Joaquin River,31750,Yes,3,10,10,3,0,"Enforcement Actions •CCWD will strive to educate and inform customers of conservation measures before taking enforcement action. •If customers violate the conservation order, they will first receive a written warning letter. •If the problem persists, those in violation could have their water governed by a flow-restricting device for a period of 30 days, or until the CCWD Board of Directors repeals the state of emergency. •Those in violation could be fined up to $500/day. •The district may also pursue a misdemeanor violation of California Water Code Section 31029. If convicted of this crime, a person could be put in jail for up to 30 days, fined up to $600 or both.  "03/01/15 00:00,15-Mar,Humboldt Bay Municipal Water District,North Coast,422,Yes,2,0,0,0,0,03/01/15 00:00,15-Mar,Santa Maria  City of,Central Coast,101103,Yes,7,0,0,0,0,03/01/15 00:00,15-Mar,Yuba City  City of,Sacramento River,65372,Yes,,,,,,"August 8, 2014  Name Address City, State, Zip  Dear Water Customer,  With the third consecutive year of drought, the City of Yuba City implemented emergency water restrictions in accordance with the City’s Water Shortage Contingency Plan per the Governor’s request in January.  On July 15, 2014, the State Water Resources Control Board approved an emergency regulation to ensure that water suppliers, their customers and state residents increase water conservation in urban settings.  The emergency regulations require that all Californians stop the following activities immediately:     • Washing down driveways and sidewalks • Watering of outdoor landscapes that cause excess runoff • Using a hose to wash a motor vehicle unless the hose is fitted with a shut-off nozzle  • Using potable water in a non-circulating fountain or decorative water feature  In addition, the emergency regulations specifically require that urban water suppliers implement water shortage contingency plans to a level where restrictions on outdoor watering are mandatory.  For Yuba City, that is Stage 3 of the City’s Water Shortage Contingency Plan.    Stage 3 of the City’s Water Shortage Contingency Plan and Municipal Code Section 6-6.19, “Emergency Water Restrictions”, permit lawn watering only as follows:  • EVEN numbered addresses: Wednesdays and Saturdays  • ODD numbered addresses: Thursdays and Sundays  • New lawns may be watered three (3) times each day for the first three (3) weeks after planting provided that notification is given to the City Public Works Department of the new planting either at the time of planting or as soon thereafter as is practicable. • Public agencies and/or commercial/industrial companies using City water to irrigate large turf areas greater than 0.5 acres, shall submit an irrigation schedule for approval by the Public Works Director. This schedule shall provide for a reduction of water use based on a percentage of previous usage. The actual percentage and base year of usage shall be established by the Public Works Director as approved by the City Council and will be in accordance with the severity of the water shortage declared by the City Council. It is recommended that watering take place during the coolest parts of the day in the evening and early morning hours. As part of the City’s continued effort to help water customers comply with these water restrictions, the City has started water patrols which are designed to provide residents with conservation education.  The City’s goal is to raise awareness to the mandatory restrictions, and issue penalties as a last resort.  For those that choose not to comply with the mandatory restrictions, the following penalty schedule will apply:  1st violation: Written warning 2nd violation:  $ 50.00 surcharge* 3rd violation:  $100.00 surcharge* 4+ violations: $250.00 surcharge* per violation *Surcharges shall appear on the next monthly water billing  The Public Works Department provides complimentary water audits and will assist with adjusting sprinkler timers upon request.  If you would like to schedule a water audit or need assistance adjusting a sprinkler timer, please call John Westhouse, Water Treatment Plant Supervisor, at 530-822-4637.  Also, the City has a rebate program for the installation of smart irrigation timers.  Information on the rebate program can be found at www.yubacityh2o.com.       The City appreciates the conservation efforts of our water customers.  If you have any questions, please do not hesitate to contact Public Works.    Sincerely,      Diana Langley City of Yuba City  Public Works Director "03/01/15 00:00,15-Mar,Escondido  City of,South Coast,134053,Yes,3,10,10,10,0,03/01/15 00:00,15-Mar,Los Angeles County Public Works Waterworks District 29,South Coast,31064,Yes,2,1,0,0,0,A general email complaint was sent to the District calling out a particular neighborhood regarding water waste. The area is being patrolled on a regular basis to ensure compliance with water use rules.03/01/15 00:00,15-Mar,Placer County Water Agency,Sacramento River,95717,No,2,62,8,1,0,"Water Efficiency program, water wise house calls, online waste reporting system, customer phone calls, and general public outreach."03/01/15 00:00,15-Mar,Burbank  City of,South Coast,105543,Yes,1,140,140,12,0,"We followed up every complaint with a letter. The 12 warning actions are complaints that received a third notice, which mentions the fines."03/01/15 00:00,15-Mar,Camarillo  City of,South Coast,46809,Yes,,,,,,"Continued enforcement of Stage 2 Ordinance including 12 first violation citations and delivery of over 30 ""friendly reminder"" conservation door tags, as well as over 25 miscellaneous conservation tasks. "03/01/15 00:00,15-Mar,Blythe  City of,Colorado River,13839,Yes,7,0,0,0,0,"The City of Blythe posted on its webpage at http://www.cityofblythe.ca.gov tips for water conservation from the statewide program Save Our Water, a partnership between the Association of California Water Agencies and the California Department of Water Resources."03/01/15 00:00,15-Mar,Roseville  City of,Sacramento River,122946,Yes,7,219,219,219,0,"Staff performed regular water waste patrol and left notices for customers found to have water waste. We also respond to online reports as well as posts to social media sites. The City conducts night patrols for water waste. The City has an online reporting tool where people can report water waste and upload photos. Staff responded to 219 reports of water waste and left 219 1st notices. Of those, 107 needed a 2nd notice as they didn't comply with the 1st notice. Of those, 5 were sent to citation and are in process of receiving a fine.  "03/01/15 00:00,15-Mar,Vista Irrigation District,South Coast,124746,Yes,3,6,6,5,1,03/01/15 00:00,15-Mar,West Valley Water District,South Coast,73016,Yes,7,7,7,1,0,03/01/15 00:00,15-Mar,Napa  City of,San Francisco Bay,85679,Yes,7,11,11,6,0,"The City of Napa continued its formalized Water Waste Reporting procedures, encouraging customers to report violations via phone or email (link on the City's web site).  Water Division field staff are tasked with reporting violations and educating customers in the course of their normal duties.  Two of the 11 complaints received in March were for actions other than the officially prohibited water waste items."03/01/15 00:00,15-Mar,Mission Springs Water District,Colorado River,34766,Yes,7,5,5,5,0,"Special ""water waste"" door hangers were issued upon confirmation of infraction. A note was placed in the customer file. Generally, customers were simply unaware of the infraction notwithstanding public information tot he contrary. No repeat offenses have occurred."03/01/15 00:00,15-Mar,Los Angeles County Public Works Waterworks District 40,South Lahontan,206454,Yes,2,0,0,0,0,03/01/15 00:00,15-Mar,Nevada Irrigation District,Sacramento River,44761,Yes,,,,,,03/01/15 00:00,15-Mar,Alameda County Water District,San Francisco Bay,340000,Yes,1,46,37,0,0,Information provided with July 2014 report - no updates at this time.03/01/15 00:00,15-Mar,Hawthorne  City of,South Coast,44507,Yes,7,0,0,0,0,03/01/15 00:00,15-Mar,Nipomo Community Services District,Central Coast,12512,Yes,2,8,8,2,0,"Last billing cycle a $3,000 bill was issued to a customer who had a serious leak (a.k.a. wasted water) - tiered rate structures create significant fines and deterrent to water waste. "03/01/15 00:00,15-Mar,Rancho California Water District,South Coast,140603,Yes,7,14,14,14,0,"RCWD maintains a Water Conservation Policy that includes fines of up to $300 per violation for water wasting. From July 2014 through March 2015, the District sent out 148 violation written notices, which includes 135 first notices, 11 second notices and 1 third notice. The District continues to inform its customers, personnel, and local agencies on reporting and responding to water waste, and plans to increase awareness in the spring when hotter months begin.  "03/01/15 00:00,15-Mar,Rainbow Municipal Water District,South Coast,19611,Yes,3,0,0,0,0,"Enforcement of water waste violations has begun in April, 2015. "03/01/15 00:00,15-Mar,Oceanside  City of,South Coast,171183,Yes,3,,,,,03/01/15 00:00,15-Mar,Western Municipal Water District of Riverside,South Coast,96139,Yes,7,2,2,2,0,Western Municipal Water District partners with local code enforcement teams to monitor water saving progress in the community we serve. In partnership with 311 dispatch we reach out to residential or business customers that may have a problem with water waste. The first warning letter offers assistance through free efficiency evaluations for all customers. The second letter for the same issue reminds them of assistance and warns of monetary penalties. The third notice imposes daily penalties.03/01/15 00:00,15-Mar,Tahoe City Public Utilities District,North Lahontan,5346,Yes,3,0,0,0,0,03/01/15 00:00,15-Mar,Calexico  City of,Colorado River,40516,Yes,,,,,,03/01/15 00:00,15-Mar,Lompoc  City of,Central Coast,39846,Yes,,,,,,03/01/15 00:00,15-Mar,California Water Service Company Bakersfield,Tulare Lake,277947,Yes,7,20,20,20,0,03/01/15 00:00,15-Mar,Amador Water Agency,San Joaquin River,23347,Yes,2,,,,0,03/01/15 00:00,15-Mar,California Water Service Company Oroville,Sacramento River,10626,Yes,7,3,3,3,0,03/01/15 00:00,15-Mar,Trabuco Canyon Water District,South Coast,12700,Yes,,,,,,03/01/15 00:00,15-Mar,Otay Water District,South Coast,217600,Yes,3,14,13,,,03/01/15 00:00,15-Mar,San Diego  City of,South Coast,1292496,Yes,3,372,372,2,0,San Diego hired additional field staff and initiated drive-by and proactive enforcement in the community (rather than complaint driven enforcement.)03/01/15 00:00,15-Mar,Truckee-Donner Public Utilities District,North Lahontan,32776,Yes,4,2,2,,0,03/01/15 00:00,15-Mar,"Modesto, City of",San Joaquin River,217269,Yes,3,390,390,390,5,03/01/15 00:00,15-Mar,Joshua Basin Water District,Colorado River,9514,Yes,7,2,1,1,0,03/01/15 00:00,15-Mar,Santa Barbara  City of,Central Coast,93091,Yes,7,23,16,0,0,"The City of Santa Barbara is preparing to declare a Stage 3 Drought Emergency in early May 2015. At that time, the City's mandatory water use regulations will be updated to meet the new requirements of the State. "03/01/15 00:00,15-Mar,Tuolumne Utilities District,San Joaquin River,28997,Yes,,,,,,03/01/15 00:00,15-Mar,Sacramento County Water Agency,Sacramento River,163449,Yes,3,184,184,184,0,03/01/15 00:00,15-Mar,San Buenaventura  City of,South Coast,113478,Yes,2,88,89,92,1,03/01/15 00:00,15-Mar,Elk Grove Water Service,Sacramento River,44099,Yes,,,,,,03/01/15 00:00,15-Mar,Newhall County Water District,South Coast,45036,Yes,2,3,3,0,0,03/01/15 00:00,15-Mar,Valencia Water Company,South Coast,118224,Yes,,,,,,03/01/15 00:00,15-Mar,Castaic Lake Water Agency Santa Clarita Water Division,South Coast,119650,Yes,2,47,47,47,0,"In March 2015, we issued 47 warning/violation notices for the prohibited activities stated in the SWRCB Resolution 2014-0038."03/01/15 00:00,15-Mar,California Water Service Company East Los Angeles,South Coast,154125,Yes,7,8,8,8,0,03/01/15 00:00,15-Mar,Exeter  City of,Tulare Lake,10334,Yes,,,,,,03/01/15 00:00,15-Mar,"Rio Vista, city of",Sacramento River,8324,Yes,,,,,,03/01/15 00:00,15-Mar,Sweetwater Springs Water District,North Coast,7703,Yes,7,1,1,0,0,The one complaint (which was followed up) was found to not be a waste of water. 03/01/15 00:00,15-Mar,California Water Service Company Visalia,Tulare Lake,137626,Yes,7,10,10,10,0,03/01/15 00:00,15-Mar,California Water Service Company Selma,Tulare Lake,24596,Yes,7,2,2,2,0,03/01/15 00:00,15-Mar,California Water Service Company Chico District,Sacramento River,101358,Yes,7,29,29,29,0,03/01/15 00:00,15-Mar,Soquel Creek Water District,Central Coast,37720,Yes,7,19,31,31,0,"In March, we were in a Stage 3 Emergency Water Shortage with a curtailment target of 25%.  In this Stage, we are actively enforcing compliance with our Water Waste Ordinance which is always in effect. We respond to customer and staff reports of water waste and have a water waste patrol staff member who actively patrols the service area on a daily basis."03/01/15 00:00,15-Mar,East Valley Water District,South Coast,97318,Yes,7,5,5,0,0,We will begin to enforce a three day watering schedule per week in addition to watering times by next month. 03/01/15 00:00,15-Mar,California Water Service Company Bear Gulch,San Francisco Bay,58720,Yes,7,6,6,6,0,03/01/15 00:00,15-Mar,Buena Park  City of,South Coast,82364,Yes,1,,,,,03/01/15 00:00,15-Mar,South Gate  City of,South Coast,96057,Yes,7,0,0,0,0,03/01/15 00:00,15-Mar,Hillsborough  Town of,San Francisco Bay,10850,No,2,10,115,103,0,The Town adopted in April 2015 new water waste prohibitions in the Water Board's March 2015 Resolution. The Town issued approximately ten verbal warnings and 103 written warnings in March 2015. Written warnings were mailed to the residence where water waste prohibition is discovered. Code enforcement officials have conducted several follow up visits to the properties receiving the warnings. The properties will receive followup letters and visual inspections in the month of April. 03/01/15 00:00,15-Mar,"California Water Service Company Dixon, City of",Sacramento River,9826,Yes,7,0,0,0,0,03/01/15 00:00,15-Mar,Redlands  City of,South Coast,77852,Yes,3,20,5,0,0,03/01/15 00:00,15-Mar,San Juan Water District,Sacramento River,39020,Yes,7,,,,,03/01/15 00:00,15-Mar,California Water Service Company Dominguez,South Coast,142196,Yes,7,5,5,5,0,03/01/15 00:00,15-Mar,Hayward  City of,San Francisco Bay,151037,Yes,2,9,8,8,0,03/01/15 00:00,15-Mar,California Water Service Company Hermosa/Redondo,South Coast,95730,Yes,7,2,2,2,0,03/01/15 00:00,15-Mar,California Water Service Company King City,Central Coast,14726,Yes,7,2,2,2,0,03/01/15 00:00,15-Mar,Yucaipa Valley Water District,South Coast,44007,Yes,3,5,5,5,0,The Yucaipa Valley Water District provides an update on the water conservation activities to the Board of Directors and members of the public twice per month.  An additional public meeting will be scheduled to further educate the public about the water conservation requirements enforced by the SWRCB and the District.