Timestamp,Reporting_Month,Supplier_Name,Hydrologic_Region,Population_Served,Mandatory_Restrictions,Water_Days_Allowed/Week,Complaints_Received,Follow_up_Actions,Warnings_Issued,Penalties_Assessed,Enforcement_Comments03/01/15 00:00,15-Mar,San Bernardino  City of,South Coast,187690,Yes,,,,,,03/01/15 00:00,15-Mar,Sacramento  City of,Sacramento River,475122,Yes,2,1552,910,450,51,Ongoing patrols continue to enforce outdoor water restrictions.03/01/15 00:00,15-Mar,California Water Service Company Kern River Valley,Tulare Lake,5586,Yes,7,1,1,1,0,03/01/15 00:00,15-Mar,California Water Service Company Los Altos/Suburban,San Francisco Bay,68109,Yes,7,13,13,13,0,03/01/15 00:00,15-Mar,Hanford  City of,Tulare Lake,57050,Yes,,,,,,03/01/15 00:00,15-Mar,California Water Service Company Livermore,San Francisco Bay,57410,Yes,7,10,10,10,0,03/01/15 00:00,15-Mar,West Kern Water District,Tulare Lake,23511,Yes,,,,,,03/01/15 00:00,15-Mar,Paso Robles  City of,Central Coast,30450,Yes,,,,,,03/01/15 00:00,15-Mar,Pismo Beach  City of,Central Coast,7705,Yes,2,6,6,5,1,"Certified letter for first time offenders, $100 fine for second time offenders."03/01/15 00:00,15-Mar,California Water Service Company Marysville,Sacramento River,12131,Yes,7,20,20,20,0,03/01/15 00:00,15-Mar,Madera  City of,San Joaquin River,63008,Yes,2,35,308,78,22,03/01/15 00:00,15-Mar,Hemet  City of,South Coast,23537,Yes,,,,,,03/01/15 00:00,15-Mar,California Water Service Company Mid Peninsula,San Francisco Bay,132554,Yes,7,20,20,20,0,03/01/15 00:00,15-Mar,California Water Service Company Palos Verdes,South Coast,69867,Yes,7,4,4,4,0,03/01/15 00:00,15-Mar,"Colton, City of",South Coast,47429,Yes,,,,,,03/01/15 00:00,15-Mar,California Water Service Company Redwood Valley,North Coast,3604,Yes,7,0,0,0,0,03/01/15 00:00,15-Mar,Brea  City of,South Coast,42397,Yes,3,13,13,13,0,03/01/15 00:00,15-Mar,California Water Service Company Salinas District,Central Coast,120770,Yes,7,4,4,4,0,03/01/15 00:00,15-Mar,Wasco  City of,Tulare Lake,26159,Yes,4,,,,,03/01/15 00:00,15-Mar,California Water Service Company South San Francisco,San Francisco Bay,60924,Yes,7,5,5,5,0,03/01/15 00:00,15-Mar,"Tulare, City of",Tulare Lake,61170,Yes,3,66,108,108,21,03/01/15 00:00,15-Mar,California Water Service Company Stockton,San Joaquin River,170257,Yes,7,19,19,19,0,03/01/15 00:00,15-Mar,California Water Service Company Willows,Sacramento River,7079,Yes,7,5,5,5,0,03/01/15 00:00,15-Mar,California Water Service Company Westlake,South Coast,19459,Yes,7,0,0,0,0,03/01/15 00:00,15-Mar,Banning  City of,Colorado River,30325,Yes,7,1,1,0,0,03/01/15 00:00,15-Mar,Benicia  City of,San Francisco Bay,28086,Yes,,,,,,"In March 2015, the following enforcement actions took place:  10 door hangers  4 residential watering complaints received - courtesy calls made to all locations notifying them of water restrictions.  2 commercial watering complaints received - courtesy calls made to property managers notifying them of water restrictions.  1 warning letter sent"03/01/15 00:00,15-Mar,Westborough Water District,San Francisco Bay,14050,Yes,2,1,1,0,0,03/01/15 00:00,15-Mar,Woodland  City of,Sacramento River,57223,Yes,,,,,,03/01/15 00:00,15-Mar,Mountain View  City of,San Francisco Bay,75077,Yes,3,139,139,52,0,03/01/15 00:00,15-Mar,Mammoth Community Water District,South Lahontan,16739,Yes,4,0,0,0,0,03/01/15 00:00,15-Mar,Antioch  City of,San Joaquin River,106455,Yes,,9,10,9,0,03/01/15 00:00,15-Mar,Estero Municipal Improvement District,San Francisco Bay,37165,Yes,2,4,4,3,0,03/01/15 00:00,15-Mar,East Orange County Water District,South Coast,3247,Yes,3,1,1,0,0,"First instance of non-compliance - through personal contact, 1) issue a written warning 2) provide a copy of the conservation ordinance 3) provide education such as reviewing behavior or water use inefficiency that caused the warning to be issued and suggest specific behavior or water use changes to correct it.  Second instance of non-compliance within preceding 12 month period - $50 fine.  Third instance of non-compliance within preceding 12 month period - $100 fine.  Fourth instance of non-compliance  - $250 fine and referral to the District Attorney's office for prosecution."03/01/15 00:00,15-Mar,Triunfo Sanitation District / Oak Park Water Service,South Coast,12200,Yes,3,4,7,2,0,Counts do not include field responses and follow-up by field personnel.03/01/15 00:00,15-Mar,Vallecitos Water District,South Coast,94283,Yes,,,,,,03/01/15 00:00,15-Mar,Indio  City of,Colorado River,81393,Yes,7,26,26,26,0,03/01/15 00:00,15-Mar,Sunnyvale  City of,San Francisco Bay,147055,Yes,,,,,,Installing flow restricters for any repeat violaters. 03/01/15 00:00,15-Mar,Santa Cruz  City of,Central Coast,94887,Yes,,,,,,03/01/15 00:00,15-Mar,Fortuna  City of,North Coast,11926,Yes,,0,0,0,0,03/01/15 00:00,15-Mar,Clovis  City of,Tulare Lake,106076,Yes,3,19,19,19,0,03/01/15 00:00,15-Mar,East Niles Community Service District,Tulare Lake,26000,Yes,,,,,,03/01/15 00:00,15-Mar,Loma Linda  City of *,South Coast,23614,Yes,7,4,1,0,0,03/01/15 00:00,15-Mar,Eastern Municipal Water District,South Coast,535600,Yes,7,44,40,40,3,EMWD relies on an allocation based tiered rate as our main tool to discourage water waste and encourage efficiency.  Outdoor demand has decreased 30% since the allocation based rate structure was implemented.  Higher rainfall and lower ET reduced customer allocations and demand in April of 2015 compared to last year. EMWD also imposes fines for runoff.  Residential fines start at $25 and commercial start at $100.   03/01/15 00:00,15-Mar,Martinez  City of,San Francisco Bay,35375,Yes,,3,3,0,0,03/01/15 00:00,15-Mar,Marina Coast Water District,Central Coast,31405,Yes,,,,,,03/01/15 00:00,15-Mar,Pittsburg  City of,San Francisco Bay,66183,Yes,,,,,,03/01/15 00:00,15-Mar,San Bruno  City of,San Francisco Bay,43798,Yes,2,2,0,2,0,03/01/15 00:00,15-Mar,"American Canyon, City of",San Francisco Bay,20080,Yes,7,0,0,0,0,03/01/15 00:00,15-Mar,Oildale Mutual Water Company,Tulare Lake,33163,Yes,3,9,9,0,0,03/01/15 00:00,15-Mar,Livermore  City of Division of Water Resources,San Francisco Bay,27033,Yes,2,6,6,5,0,03/01/15 00:00,15-Mar,Gilroy  City of,Central Coast,52413,Yes,,,,,,03/01/15 00:00,15-Mar,Crescenta Valley Water District,South Coast,31966,Yes,3,6,6,6,0,03/01/15 00:00,15-Mar,Downey  City of,South Coast,111931,Yes,,,,,,03/01/15 00:00,15-Mar,San Gabriel Valley Water Company,South Coast,271817,Yes,,8,6,8,0,03/01/15 00:00,15-Mar,Santa Clara  City of,San Francisco Bay,118459,Yes,,49,49,49,0,03/01/15 00:00,15-Mar,Paradise Irrigation District,Sacramento River,26032,Yes,3,2,2,1,0,03/01/15 00:00,15-Mar,Scotts Valley Water District,Central Coast,10509,Yes,7,,,,,N/A03/01/15 00:00,15-Mar,Lincoln  City of,Sacramento River,45206,Yes,3,,,,0,03/01/15 00:00,15-Mar,Vaughn Water Company,Tulare Lake,30422,Yes,3,22,22,2,0,"many of the (22) complaints consisted of possible broken lawn sprinklers, broken couplings, broken meters, and  customer wasting water complaints. all (22) complaints were investigated and corrected within the same day. The (2) customer wasting water complaints were investigated by our technicians and left notices for the homeowner. "03/01/15 00:00,15-Mar,McKinleyville Community Service District,North Coast,16900,Yes,4,0,0,0,0,03/01/15 00:00,15-Mar,Montebello Land and Water Company,South Coast,32219,Yes,3,0,0,0,0,03/01/15 00:00,15-Mar,Humboldt Community Service District,North Coast,20032,Yes,7,2,2,0,0,03/01/15 00:00,15-Mar,Rohnert Park  City of,North Coast,43398,No,7,8,7,3,0,03/01/15 00:00,15-Mar,Valley of the Moon Water District,San Francisco Bay,23478,Yes,,,,,,03/01/15 00:00,15-Mar,Bellflower-Somerset Mutual Water Company,South Coast,46300,Yes,,,,,,03/01/15 00:00,15-Mar,Port Hueneme  City of,South Coast,21555,Yes,,,,,,03/01/15 00:00,15-Mar,Petaluma  City of,San Francisco Bay,61258,Yes,7,6,6,0,0,03/01/15 00:00,15-Mar,Eureka  City of,North Coast,26066,No,,,,,,03/01/15 00:00,15-Mar,Diablo Water District,San Joaquin River,38194,Yes,7,5,107,58,0,We had a few services that our technicians witnessed had severe leaks and turned the water off at the meter. We left messages and doorhangers telling customers that the leak needed to be repaired. Once the leak was repaired we turned the water back on.  We have not received many complaints from neighbors. It is mostly the District staff who notices violations while driving around town or during meter readings and daily leak reporting from our smart meter reading system. 03/01/15 00:00,15-Mar,El Toro Water District,South Coast,48628,Yes,,,,,,03/01/15 00:00,15-Mar,Brentwood  City of,San Joaquin River,54741,Yes,7,5,5,0,0,03/01/15 00:00,15-Mar,Fountain Valley  City of,South Coast,56916,Yes,7,3,3,2,0,03/01/15 00:00,15-Mar,Tracy  City of,San Joaquin River,85146,Yes,7,24,11,10,0,03/01/15 00:00,15-Mar,Menlo Park  City of,San Francisco Bay,16066,Yes,7,2,0,0,0,03/01/15 00:00,15-Mar,Patterson  City of,San Joaquin River,20922,Yes,,,,,,03/01/15 00:00,15-Mar,Garden Grove  City of,South Coast,177020,Yes,7,8,8,8,0,The City of Garden Grove received 8 complaints of water wasting activities during the month of March 2015. Written notifications were mailed to the 8 addresses where the water wasting activities took place. 03/01/15 00:00,15-Mar,Merced  City of,San Joaquin River,83400,Yes,,,,,,03/01/15 00:00,15-Mar,San Gabriel Valley Fontana Water Company,South Coast,209035,Yes,,1,1,1,0,03/01/15 00:00,15-Mar,Hesperia Water District City of,South Lahontan,91627,Yes,7,6,6,6,0,03/01/15 00:00,15-Mar,Moulton Niguel Water District,South Coast,172068,Yes,7,1042,1042,1042,0,"The District uses its water budget rate structure to signal customers of potential water waste. The customer service department actively calls customers who are over their water budget. In addition, the inclining tiered rate structure provides increasing price disincentive for the wasteful use of water. The numbers reported are for customers in Tier 5 in March 2015 who are notified both through their bill and the Customer Service Departments phone calls. The District fines customers when the Water Shortage Contingency Plan is activated but the rates provide active conservation funding for turf removal and other water efficiency programs."03/01/15 00:00,15-Mar,Oxnard  City of,South Coast,203645,Yes,2,60,48,43,0,03/01/15 00:00,15-Mar,"Tehachapi, City of",Tulare Lake,8923,Yes,3,12,12,12,0,03/01/15 00:00,15-Mar,La Habra  City of Public Works,South Coast,63118,Yes,2,5,5,5,0,03/01/15 00:00,15-Mar,Lake Arrowhead Community Services District,South Lahontan,28066,Yes,0,2,103,2,0,"The District has AMR on 100% of its meters and monitors and responds to all meters with high or constant usage.  Ordinances provide specific warning and penalty levels:  1st violation receives a written warning.  2nd violation in a calendar year receives a 25% penalty, 3rd violation 50%, 4th violation 100%.  After that a water flow restricting device is installed.  In 2014 the District started issuing $250 per day for violations."03/01/15 00:00,15-Mar,"City of Big Bear Lake, Dept of Water & Power",South Coast,25596,Yes,,,,,,03/01/15 00:00,15-Mar,Cerritos  City of,South Coast,49041,Yes,,,,,,03/01/15 00:00,15-Mar,Fresno  City of,Tulare Lake,515609,Yes,2,1097,1221,1221,250,03/01/15 00:00,15-Mar,Hollister  City of,Central Coast,23021,No,,,,,,03/01/15 00:00,15-Mar,Sunnyslope County Water District,Central Coast,19189,Yes,,,,,,03/01/15 00:00,15-Mar,Laguna Beach County Water District,South Coast,19121,Yes,3,,,,,03/01/15 00:00,15-Mar,California-American Water Company Los Angeles District,South Coast,102889,Yes,7,3,3,3,0,03/01/15 00:00,15-Mar,California-American Water Company San Diego District,South Coast,95358,Yes,7,12,11,11,0,03/01/15 00:00,15-Mar,California-American Water Ventura District,South Coast,62144,Yes,7,11,10,10,0,03/01/15 00:00,15-Mar,Stockton  City of,San Joaquin River,177808,Yes,7,66,8,22,0,03/01/15 00:00,15-Mar,Lincoln Avenue Water Company,South Coast,16126,Yes,,,,,,03/01/15 00:00,15-Mar,Whittier  City of,South Coast,49954,No,,,,,,03/01/15 00:00,15-Mar,San Luis Obispo  City of,Central Coast,45541,Yes,3,34,34,9,0,03/01/15 00:00,15-Mar,La Palma  City of,South Coast,15544,Yes,3,5,14,14,0,03/01/15 00:00,15-Mar,Santa Margarita Water District,South Coast,157015,Yes,3,,24,24,," In March 2015, twenty customers requested site surveys and the District worked with twenty-four customers where leaks were noticed.  Twenty-four ordinance violations were observed and reported to the customer via a door-hanger and/or direct mail.  "03/01/15 00:00,15-Mar,Mesa Water District,South Coast,108000,Yes,7,23,23,23,0,03/01/15 00:00,15-Mar,California-American Water Company Monterey District,Central Coast,109817,Yes,2,16,16,7,0,"All water waste complaints and enforcement of violations in the Monterey Service Area are handled by the Monterey Peninsula Water Management District (MPWMD).  Water waste complaints received, or violations observed by California American Water are immediately forwarded to MPWMD."03/01/15 00:00,15-Mar,Arroyo Grande  City of,Central Coast,17003,Yes,,,,,,03/01/15 00:00,15-Mar,Suisun-Solano Water Authority,San Francisco Bay,28549,Yes,,,,,,03/01/15 00:00,15-Mar,Davis  City of,Sacramento River,65783,Yes,,,,,,03/01/15 00:00,15-Mar,Linda County Water District,Sacramento River,18808,Yes,,,,,,03/01/15 00:00,15-Mar,Ceres  City of,San Joaquin River,46463,Yes,3,14,16,103,2,"The City of Ceres has two full time employees that monitor and enforce the year around watering schedule. For the month of March 2015 these two employees handed out 103 courtesy notices, 16 warnings and two violations."03/01/15 00:00,15-Mar,Newport Beach  City of,South Coast,65551,Yes,4,11,19,13,4,Number of CE cases opened related to Water Conservation   17   March 1- March 30      Complaint 3 Officer Initiated 8 Site Investigation 12 Phone Calls 2 Written Letters 10 Verbal Warnings 0 Notice of Violation 3 Citation 4 Problem closed 1 03/01/15 00:00,15-Mar,Ventura County Waterworks District No. 8,South Coast,90687,Yes,3,31,31,20,0,03/01/15 00:00,15-Mar,Arcata  City of,North Coast,18464,Yes,7,0,0,0,0,03/01/15 00:00,15-Mar,Crescent City  City of,North Coast,18290,Yes,,,,,,03/01/15 00:00,15-Mar,Crestline Village Water District,South Lahontan,7446,Yes,,,,,,03/01/15 00:00,15-Mar,South Coast Water District,South Coast,34816,Yes,1,5,54,54,0,"The following applies to customers that fail to comply with any provision of District Ordinance 206 for Permanent, Level 1 or Level 2 Conservation Measures:  •    First Instance of Non-Compliance:  The District will issue a written warning and send it and a copy of the Ordinance by mail.  •    Second Instance of Non-Compliance:  A second instance of non-compliance with the Ordinance within the preceding twelve calendar months is punishable by a non-compliance charge not to exceed $100.  •    Third Instance of Non-Compliance:  A third instance of non-compliance with the Ordinance within the preceding twelve calendar months is punishable by a non-compliance charge not to exceed $250.  •    Fourth and Subsequent Instances of Non-Compliance:  A fourth, or any subsequent instance of non-compliance with the Ordinance, is punishable by a non-compliance charge not to exceed $500."03/01/15 00:00,15-Mar,Bakman Water Company,Tulare Lake,13960,Yes,,,,,,03/01/15 00:00,15-Mar,Orange  City of,South Coast,139463,Yes,7,,,,,03/01/15 00:00,15-Mar,Fair Oaks Water District,Sacramento River,36226,,,,,,,03/01/15 00:00,15-Mar,Tustin  City of,South Coast,67700,Yes,7,7,7,7,0,03/01/15 00:00,15-Mar,Goleta Water District,Central Coast,86946,Yes,2,25,25,1,1,03/01/15 00:00,15-Mar,Adelanto City of,South Lahontan,32543,No,,,,,,03/01/15 00:00,15-Mar,Seal Beach  City of,South Coast,24168,Yes,,,,,,same03/01/15 00:00,15-Mar,San Clemente  City of,South Coast,50960,Yes,7,20,20,20,0,03/01/15 00:00,15-Mar,Azusa  City of,South Coast,110000,Yes,,,,,,03/01/15 00:00,15-Mar,Alhambra  City of,South Coast,85068,Yes,2,20,20,20,0,03/01/15 00:00,15-Mar,Apple Valley Ranchos Water Company,South Lahontan,71184,Yes,3,1,1,0,0,03/01/15 00:00,15-Mar,Thousand Oaks  City of,South Coast,51609,Yes,,,,,,03/01/15 00:00,15-Mar,Beverly Hills  City of,South Coast,42157,Yes,3,39,39,39,0,Outdoor Water Schedule & Restrictions (Unenforced); Mandatory 10% Water Reduction 03/01/15 00:00,15-Mar,Golden State Water Company Cowan Heights,South Coast,7254,Yes,7,0,0,0,0,03/01/15 00:00,15-Mar,Victorville Water District,South Lahontan,116173,Yes,7,114,114,107,0,1525 homes surveyed for water waste/run off          10 hours of surveying the system for water run off/waste-leaks         1-site visit to assist with leak -         03/01/15 00:00,15-Mar,Pomona  City of,South Coast,151713,Yes,7,5,5,5,0,Will go to City Council in May 2015 to enforce water contingency plan to limit outdoor watering to 2 days per week.03/01/15 00:00,15-Mar,Walnut Valley Water District,South Coast,113236,Yes,7,,,,,03/01/15 00:00,15-Mar,California-American Water Company Sacramento District,Sacramento River,201418,Yes,7,63,63,63,0,03/01/15 00:00,15-Mar,Great Oaks Water Company Incorporated,San Francisco Bay,99199,Yes,,,,,,03/01/15 00:00,15-Mar,Carlsbad Municipal Water District,South Coast,84838,Yes,3,12,488,0,0,03/01/15 00:00,15-Mar,Golden State Water Company Placentia,South Coast,46543,Yes,,2,1,0,0,03/01/15 00:00,15-Mar,Huntington Park  City of,South Coast,64219,Yes,3,0,0,0,0,03/01/15 00:00,15-Mar,Helix Water District,South Coast,270375,Yes,3,53,45,36,0,03/01/15 00:00,15-Mar,Manhattan Beach  City of,South Coast,35726,Yes,,,,,,03/01/15 00:00,15-Mar,Lakeside Water District,South Coast,35500,Yes,3,,,,,03/01/15 00:00,15-Mar,Carpinteria Valley Water District,Central Coast,14616,Yes,2,10,10,6,1,03/01/15 00:00,15-Mar,Lakewood  City of,South Coast,59081,Yes,2,12,5,0,0,03/01/15 00:00,15-Mar,Lynwood  City of,South Coast,71297,Yes,7,0,0,0,0,03/01/15 00:00,15-Mar,Las Virgenes Municipal Water District,South Coast,75384,Yes,3,23,23,0,0,03/01/15 00:00,15-Mar,Chino Hills  City of,South Coast,74738,Yes,7,,,,,N/A03/01/15 00:00,15-Mar,Lodi  City of Public Works Department,San Joaquin River,63651,Yes,3,99,174,155,5,03/01/15 00:00,15-Mar,Golden State Water Company S Arcadia,South Coast,26827,Yes,7,0,0,0,0,03/01/15 00:00,15-Mar,Lomita  City of,South Coast,20463,Yes,,0,328,328,0,03/01/15 00:00,15-Mar,Golden State Water Company San Dimas,South Coast,54872,Yes,7,3,0,0,0,03/01/15 00:00,15-Mar,Ramona Municipal Water District,South Coast,35100,Yes,1,0,0,0,0,03/01/15 00:00,15-Mar,Monrovia  City of,South Coast,36590,Yes,2,1,1,0,0,03/01/15 00:00,15-Mar,North Coast County Water District,San Francisco Bay,39000,Yes,2,5,10,0,0,Letters were sent to the District's top 50 residential water users and top 20 commercial users03/01/15 00:00,15-Mar,North Tahoe Public Utility District,North Lahontan,7500,Yes,7,1,98,1,0,03/01/15 00:00,15-Mar,San Dieguito Water District,South Coast,37168,Yes,3,34,33,23,1,One $100 fine issued03/01/15 00:00,15-Mar,Palmdale Water District,South Lahontan,109395,Yes,4,9,8,7,0,03/01/15 00:00,15-Mar,Olivehurst Public Utility District,Sacramento River,19509,Yes,3,1,1,1,0,03/01/15 00:00,15-Mar,Twentynine Palms Water District,Colorado River,18795,Yes,,,,,,03/01/15 00:00,15-Mar,Orchard Dale Water District,South Coast,19894,Yes,2,4,4,4,0,03/01/15 00:00,15-Mar,Phelan Pinon Hills Community Services District,South Lahontan,25160,Yes,7,1,1,0,0,03/01/15 00:00,15-Mar,"Yreka, City of",North Coast,7840,Yes,3,0,0,0,0,03/01/15 00:00,15-Mar,Rubidoux Community Service District,South Coast,29900,Yes,2,5,5,0,0,03/01/15 00:00,15-Mar,Quartz Hill Water District,South Lahontan,20352,Yes,3,,,,,03/01/15 00:00,15-Mar,Pico Rivera  City of,South Coast,39002,Yes,1,4,4,0,0,03/01/15 00:00,15-Mar,Rincon Del Diablo Municipal Water District,South Coast,29955,Yes,2,15,15,15,1,03/01/15 00:00,15-Mar,San Fernando  City of,South Coast,23728,Yes,7,0,0,0,0,03/01/15 00:00,15-Mar,Riverside Highland Water Company,South Coast,14730,Yes,,,,,,"Notifying our customers through written notifications on bi-monthly bills, speaking at public events and news articles. "03/01/15 00:00,15-Mar,Rubio Canyon Land and Water Association,South Coast,9600,Yes,2,6,15,15,0,03/01/15 00:00,15-Mar,Santa Fe Springs  City of,South Coast,18199,Yes,7,1,0,0,0,Lawns and landscape areas shall not be watered between the hours of 10:00 a.m. and 4:00 p.m.03/01/15 00:00,15-Mar,San Bernardino County Service Area 64,South Lahontan,12514,Yes,3,0,0,0,0,03/01/15 00:00,15-Mar,Valley County Water District,South Lahontan,70271,Yes,7,27,27,17,6,"First Violation - Educate and provide information about water use practices and conservation measures. Second Violation - Written warning outlining the need for action to implement appropriate corrective measures. Additional Violations - Monetary penalties:  Third Violation - $25.00 penalty, Fourth Violation - $50.00 penalty, Fifth Violation - $100.00 penalty"03/01/15 00:00,15-Mar,San Jacinto  City of,South Coast,15200,Yes,,,,,,03/01/15 00:00,15-Mar,San Gabriel County Water District,South Coast,45000,Yes,,,,,,03/01/15 00:00,15-Mar,Santa Ana  City of,South Coast,332005,Yes,3,5,5,1,0,03/01/15 00:00,15-Mar,San Juan Capistrano  City of,South Coast,39047,Yes,7,16,52,35,0,"In March 2015, staff received and responded to 12 calls reporting leaks and water waste.  Additionally, staff has continued a cycle of patrols for overspray and runoff, and has contacted 4 additional sites this month where runoff occurred, or broken or stuck sprinklers were discovered.   38 customers were informed about leaks in their system discovered during the process of meter reading and high use investigation.  35 tags were hung notifying customers of problems observed."03/01/15 00:00,15-Mar,Serrano Water District,South Coast,6641,Yes,3,4,4,4,0,"Serrano Water District is one of very few districts that specifically serve ESTATE SIZED LOTS that are OVER 20,000 SQFT. Many of the properties are OVER 1 ACRE.  Many of the residents are older and are retired where one or only two people live in the house. Therefore per capita usage is grossly skewed when comparing to densely urban areas with small lots and apartments. The data does not tell the story. In response to the Governors sweeping Executive Order, on April 14, 2015 the Serrano Board of  Directors adopted a resolution stepping up to restriction level 2 which will limit watering to two days per week and no longer allowing residents to fill a new pool nor refill pools after emptying. There are also other restrictions.  "03/01/15 00:00,15-Mar,Sunny Slope Water Company,South Coast,30611,No,,,,,,Water Conservation Reminder door hangers ; message about water conservation on customer bills ; free toilet tank leak detecting tablets and water-efficient shower-heads available at office ; pamphlets about water conservation outside office door ; e-mail customers about upcoming water conservation workshops03/01/15 00:00,15-Mar,Sonoma  City of,San Francisco Bay,11579,Yes,2,10,6,6,0,03/01/15 00:00,15-Mar,Sweetwater Authority,South Coast,189970,Yes,7,,,,,03/01/15 00:00,15-Mar,Suburban Water Systems San Jose Hills,South Coast,178500,Yes,,,,,,03/01/15 00:00,15-Mar,Ukiah  City of,North Coast,16075,Yes,4,1,1,0,0,03/01/15 00:00,15-Mar,Arcadia  City of,South Coast,54705,Yes,7,5,5,5,0,03/01/15 00:00,15-Mar,Suburban Water Systems Whittier/La Mirada,South Coast,115000,Yes,,,,,,03/01/15 00:00,15-Mar,Golden State Water Company Artesia,South Coast,47978,Yes,7,0,0,0,0,03/01/15 00:00,15-Mar,Golden State Water Company Claremont,South Coast,37160,Yes,7,8,0,0,0,03/01/15 00:00,15-Mar,Golden State Water Company Bell-Bell Gardens,South Coast,57934,Yes,7,1,1,0,0,03/01/15 00:00,15-Mar,Golden State Water Company Florence Graham,South Coast,65492,Yes,7,3,1,0,0,03/01/15 00:00,15-Mar,Golden State Water Company Barstow,South Lahontan,31209,Yes,7,1,1,0,0,03/01/15 00:00,15-Mar,Golden State Water Company Norwalk,South Coast,44466,Yes,7,2,0,0,0,03/01/15 00:00,15-Mar,Upland  City of,South Coast,75670,Yes,,,,,,03/01/15 00:00,15-Mar,Golden State Water Company Ojai,South Coast,7188,Yes,7,4,1,0,0,03/01/15 00:00,15-Mar,Golden State Water Company Simi Valley,South Coast,43351,Yes,7,5,2,0,0,03/01/15 00:00,15-Mar,Golden State Water Company Southwest,South Coast,271677,Yes,7,6,2,0,0,03/01/15 00:00,15-Mar,Golden State Water Company West Orange,South Coast,111904,Yes,,6,5,0,0,03/01/15 00:00,15-Mar,Coachella  City of,Colorado River,45591,Yes,,,,,,03/01/15 00:00,15-Mar,Compton  City of,South Coast,81963,Yes,3,2,2,0,0,03/01/15 00:00,15-Mar,Valley Water Company,South Coast,9900,Yes,3,0,11,0,0,03/01/15 00:00,15-Mar,Cucamonga Valley Water District,South Coast,204297,Yes,7,6,78,4,0,03/01/15 00:00,15-Mar,Desert Water Agency,Colorado River,62140,Yes,7,61,58,41,0,03/01/15 00:00,15-Mar,La Verne  City of,South Coast,32228,Yes,,,,,,03/01/15 00:00,15-Mar,Fullerton  City of,South Coast,138000,Yes,7,56,50,38,0,the reason we did not follow up on every compliant is that we received incomplete information on the initial complaint.03/01/15 00:00,15-Mar,Sierra Madre  City of,South Coast,11094,Yes,2,,,,1,03/01/15 00:00,15-Mar,Georgetown Divide Public Utilities District,Sacramento River,9863,Yes,7,0,0,0,0,03/01/15 00:00,15-Mar,Norwalk City of,South Coast,18361,Yes,3,0,0,0,0,03/01/15 00:00,15-Mar,Glendora  City of,South Coast,50073,Yes,7,1,85,87,3,"The City of Glendora has been very proactive with our conservation efforts. In 2009 our Council adopted mandatory Stage-1 restrictions, which included 2.5 full time employees. The success of our program is measured against a 3 years base average of 2006, 2007 & 2008. "03/01/15 00:00,15-Mar,Santa Fe Irrigation District,South Coast,19839,Yes,3,26,26,26,0,