Reporting_Month,Timestamp,Supplier_Name,Stage_Invoked,Mandatory_Restrictions,Total_Monthly_Potable_Water_Production_2014_2015,Total_Monthly_Potable_Water_Production_2013,Units,Qualification,Total_Population_Served,REPORTED_Residential_Gallons_per_Capita_Day,Optional_Enforcement_Actions,Optional_Implementation,Optional_Recycled_Water,Recycled_Water_Units,CALCULATED_Production_Monthly_Gallons_Month_2014_2015,CALCULATED_R_GPCD_2014_2015,Percent_Residential_Use,Comments_Corrections,Hydrologic_Region,CALCULATED_R_GPCD_2013
15-Nov,11/01/2015  00:00:00,Golden State Water Company Cowan Heights,Stage 2 of the WSCP; Stage 1 of CPUC Schedule 14.1,Yes,175,206.3,AF,"Percent Residential Use based on 2013 billing data for the volume of water provided to residential customers for the same reporting month.  Total Population Served: Used simplified California Urban Water Service Area Population methodology  Indirect Potable Reuse (IPR) allocated to Golden State Water Company for October 2015 by OCWD is 636.3 AF of which 63.5 AF has been prorated to the Cowan Heights System. For November 2015, the Total Monthly production was 175.0 AF of which approximately 63.5 AF was from IPR. Therefore, the adjusted Total Monthly Water Production for November 2015 is 111.5 AF and the adjusted GPCD is 141 ",7254,229,"GSWC maintains a web based Water Waste Report Form on its website at gswater.com. GSWC has also developed a Water Waste Case flow chart that follows each reported water waste case from first incident to resolution of the same. Actions items include educational letter, door notice, verbal notice, corrective action, flow restrictor, and referral to local public agency to implement violations penalties.",NULL,,AF,"9,123,840", 229.0 ,87.4,No Correction,South Coast,
15-Nov,11/01/2015  00:00:00,Victorville Water District,Stage 2,Yes,1269,1531,AF,,126177,93,"Received and processed over 20 phone calls specifically related to water waste. 31 staff hours dedicated to canvassing 34,000 locations(Accts) for water waste violations. 55 locations were identified for a total of 121 specific violations. 55 NOV were delivered. 22 violations still pending at 13 locations(these will receive certified letters). ",,38.27,AF,"68,754,651", 92.9 ,85,No Correction,South Lahontan,
15-Nov,11/01/2015  00:00:00,Pomona  City of,2,Yes,1337.992,1711.353,AF,,152419,50.23,,,,AF,"66,727,529", 50.5 ,53,No Correction,South Coast,
15-Nov,11/01/2015  00:00:00,Walnut Valley Water District,Stage 3,Yes,1297.87,1569.13,AF,,113236,104.57,,,,AF,Null, 104.6 ,84,No Correction,South Coast,
15-Nov,11/01/2015  00:00:00,California-American Water Company Sacramento District,"CPUC Rule 14.1, Stage 2",Yes,1577,2300,AF,"CA American Water is rolling out its own new Waterwaste violation App for all its districts, providing its customers a new user-friendly and simple solution to document and report water waste observations from their smart phones to CA American Water",201418,65,,,,AF,"154,779,428", 64.6 ,76,No Correction,Sacramento River,
15-Nov,11/01/2015  00:00:00,Ventura County Waterworks District No 1,2,Yes,757.7,878.8,AF,,38703,116.5,The District conducted 2 enforcement campaigns in November 2015 resulting in 107 violation notices and offered 3 water conservation workshops. ,The District intends on submitting a request to exclude Agricultural water use and is in the process of developing its Agricultural Water Management Plan.,34,AF,"45,488,859", 116.5 ,54.8,No Correction,South Coast,
15-Nov,11/01/2015  00:00:00,Great Oaks Water Company Incorporated,3,Yes,581.907,877.758,AF,Great Oaks Water Company will not know the amount of water used exclusively for commercial irrigation until those using water for that purpose apply for and receive certification from the Santa Clara Valley Water District.,99199,49.698,"The Santa Clara Valley Water District provides response/enforcement for water waste complaints.  During the month of November, there were 12 new complaints and all 12 were handled and closed.","Great Oaks Water Company has coordinated its efforts with local government agencies, including the Santa Clara Valley Water District and the City of San Jose.",0,AF,"41,715,500", 49.7 ,78,No Correction,San Francisco Bay,
15-Nov,11/01/2015  00:00:00,Carlsbad Municipal Water District,Level 2,Yes,1100.7,1336.5,AF,"CMWD's 2015 UWMP consultant has estimated the 2015 CMWD service area population (based on the 2010 U.S. Census Data and SANDAG growth rate) at 86,595, slightly up from the 2010 UWMP plan population estimate previously used for this data submission (84,838). There is a 45 day reporting lag from the Hotels who report their estimated number of overnight guests for a given month.  In October, Carlsbad had approximately 155,614 overnight guests.",86596,88.76,,"Effective December 1, 2015, CMWD reduced the number of watering days to 1 day per week for the Winter season. ",340,AF,"133,240,649", 88.4 ,64,No Correction,South Coast,
15-Nov,11/01/2015  00:00:00,Golden State Water Company Placentia,Stage 2 of the WSCP; Stage 1 of CPUC Schedule 14.1,Yes,479,571.1,AF,"Percent Residential Use based on 2013 billing data for the volume of water provided to residential customers for the same reporting month.  Total Population Served: Used simplified California Urban Water Service Area Population methodology  Indirect Potable Reuse (IPR) allocated to Golden State Water Company for October 2015 by OCWD is 636.3 AF of which 173.9 AF has been prorated to the Placentia System. For November 2015, the Total Monthly production was 479.0 AF of which approximately 173.9 AF was from IPR. Therefore, the adjusted Total Monthly Water Production for November 2015 is 305.2 AF and the adjusted GPCD is 48 ",46543,79,"GSWC maintains a web based Water Waste Report Form on its website at gswater.com. GSWC has also developed a Water Waste Case flow chart that follows each reported water waste case from first incident to resolution of the same. Actions items include educational letter, door notice, verbal notice, corrective action, flow restrictor, and referral to local public agency to implement violations penalties.",NULL,,AF,"33,432,356", 78.7 ,70.4,No Correction,South Coast,
15-Nov,11/01/2015  00:00:00,Huntington Park  City of,Phase 3,Yes,332,381,AF,,64219,42,,,,AF,"29,652,480", 42.4 ,75.48,No Correction,South Coast,
15-Nov,11/01/2015  00:00:00,Helix Water District,Level 2 Drought Alert,Yes,2308,2566,AF,Percentage residential use and actual CII usage in AF for November 2015 were estimated based on three-year average water sales per month.  Helix reads water meters on rolling two-month billing cycles and production numbers by individual month by individual class are not available.,270375,74,"Reports of water waste outside of Helix's service area which were forwarded to the appropriate agency, duplicate reports, incomplete addresses, and reports of non-violations are included in the total complaints received but were not included as a direct customer contact.",,,AF,"150,543,359", 74.2 ,80,No Correction,South Coast,
15-Nov,11/01/2015  00:00:00,Manhattan Beach  City of,3,Yes,372.3,437.3,AF,,35996,79.2,,,,AF,"35,778,487", 79.2 ,70.5,No Correction,South Coast,
15-Nov,11/01/2015  00:00:00,Lakeside Water District,2,Yes,238.04,299.4,AF,,35500,65.54,,,0,AF,"7,755,264", 65.5 ,90,No Correction,South Coast,
15-Nov,11/01/2015  00:00:00,Carpinteria Valley Water District,Stage II,Yes,330.9,384.5,AF,Non-revenue Water based on Total Produced and Delivered less Monthly Metered Sales. Percentage Residential use based on Monthly Metered Sales,14616,69.1,,,,AF,"10,231,735", 68.9 ,28,No Correction,Central Coast,
15-Nov,11/01/2015  00:00:00,Lakewood  City of,PHASE 3,Yes,513.55,636.12,AF,"LIKE MANY WATER UTILITIES, THE CITY OF LAKEWOOD BILLS BI-MONTHLY. THEREFORE WATER PRODUCTION DOES NOT CORRESPOND WITH METERED WATER SALES. PER CAPITA DATA CALCULATED BASING PERCENTAGE OF RESIDENTIAL USE ON 2 MONTHS OF RESIDENTIAL WATER SALES DIVIDED BY 2.",59081,80,"LAKEWOOD STARTS WITH A FRIENDLY REMINDER (CONTACT FOLLOW-UPS) AND PLACEMENT OF A DOOR HANGER NOTICE ON WHAT NEEDS TO BE CORRECTED. FOR A FIRST VIOLATION (WARNING ACTION), THERE IS A WRITTEN WARNING FROM THE CITY WITH NO PENALTY. A SECOND VIOLATION (PENALTY) THERE IS A CITATION OF $100 WITH FURTHER CITATIONS BRINGING MORE FINES UP TO $500 AND THE POTENTIAL FOR FLOW RESTRICTOR BEING INSTALLED.",,33.58,AF,"15,885,257", 79.3 ,84,No Correction,South Coast,
15-Nov,11/01/2015  00:00:00,Las Virgenes Municipal Water District,3,Yes,1426,1655,AF,,75384,177,,"- LVMWD is on track for the implementation of (water) budget based rate structure in CY 2016.  - One-day per week watering limitation was approved by the LVMWD Board for implementation in December, 2015.",381.1,AF,"63,866,880", 176.7 ,86,No Correction,South Coast,
15-Nov,11/01/2015  00:00:00,Chino Hills  City of,3,Yes,394171,542713,CCF,,77596,101.34,,,38615,CCF,"70,393,184", 96.3 ,76,No Correction,South Coast,
15-Nov,11/01/2015  00:00:00,Lodi  City of Public Works Department,3,Yes,220.8,315.8,MG,"Revised residential calculation (by Reed Group, Inc.) based on 2014 metered residential use is 64.7%. Approved via email (E. Oppenheimer, SWRCB, 5/28/15) Non-revenue per 2010 Urban Water Management Plan, RMC, 2011 ",63651,74.8,,"Currently distributing door hangers with restrictions to all home within Lodi (English/Spanish) to promote awareness. Additionally, began distributing water conservation informational table tents to Lodi restaurants in November 2015. Revised ordinance adopted by Council on November 18, 2015 (effective 12/18/15) with increased restrictions and violation charges.  ",,MG,"68,800,000", 74.8 ,64.7,No Correction,San Joaquin River,
15-Nov,11/01/2015  00:00:00,Golden State Water Company S Arcadia,Stage 2 of the WSCP; Stage 1 of CPUC Schedule 14.1,Yes,227.3,279.1,AF,Percent Residential Use based on 2013 billing data for the volume of water provided to residential customers for the same reporting month.  Total Population Served: Used simplified California Urban Water Service Area Population methodology ,26827,78,"GSWC maintains a web based Water Waste Report Form on its website at gswater.com. GSWC has also developed a Water Waste Case flow chart that follows each reported water waste case from first incident to resolution of the same. Actions items include educational letter, door notice, verbal notice, corrective action, flow restrictor, and referral to local public agency to implement violations penalties.",NULL,,AF,"9,645,202", 78.4 ,85.2,No Correction,South Coast,
15-Nov,11/01/2015  00:00:00,Lomita  City of,1,Yes,166.67,192.22,AF,,20463,80,,,,AF,Null, 79.6 ,90,No Correction,South Coast,
15-Nov,11/01/2015  00:00:00,Golden State Water Company San Dimas,Stage 2 of the WSCP; Stage 1 of CPUC Schedule 14.1,Yes,699.4,854.4,AF,Percent Residential Use based on 2013 billing data for the volume of water provided to residential customers for the same reporting month.  Total Population Served: Used simplified California Urban Water Service Area Population methodology ,54872,91,"GSWC maintains a web based Water Waste Report Form on its website at gswater.com. GSWC has also developed a Water Waste Case flow chart that follows each reported water waste case from first incident to resolution of the same. Actions items include educational letter, door notice, verbal notice, corrective action, flow restrictor, and referral to local public agency to implement violations penalties.",NULL,,AF,"86,611,309", 91.0 ,65.7,No Correction,South Coast,
15-Nov,11/01/2015  00:00:00,Ramona Municipal Water District,2,Yes,280,354,AF,,36564,83,,,,AF,Null, 83.2 ,100,No Correction,South Coast,
15-Nov,11/01/2015  00:00:00,Monrovia  City of,4,Yes,155969000,199255000,G,,37406,107.02,,,0,G,"25,763,608", 107.0 ,77,No Correction,South Coast,
15-Nov,11/01/2015  00:00:00,North Coast County Water District,2,Yes,75084,84820,CCF,,39000,41,,,0,CCF,"8,756,696", 40.3 ,84,No Correction,San Francisco Bay,
15-Nov,11/01/2015  00:00:00,North Tahoe Public Utility District,2,Yes,19.17,23.909,MG,Commercial use is pulled form the Monthly Meter Read (10/14/15-11/12/15 29 days) of 3.267 MG and contractor usage from hydrant meters of 0 and water used to process the multiple chlorine analyzers throughout the District of 0.044 MG equally 3.311 MG.,7500,72.9,The District has added to our monitoring program by resigning a District employee to drive through the District three days a week for 3 hours a day (7:15 - 10:15 AM) checking for violations and reaching out to customers. The 8 contacted customers were for excessive use on the meter read for (Toilets running or leaks on the customer side.,"Reduced allowed outdoor irrigation days and restricted allowed outdoor times. Installed new prohibitions on specific water uses. Increased our conservation budget. Increased public outreach (landscaping events, outreach to elementary students and additional web info.",0,MG,"3,311,000", 70.5 ,82.7,No Correction,North Lahontan,
15-Nov,11/01/2015  00:00:00,San Dieguito Water District,Stage 3,Yes,427.2,470.3,AF,,37168,106.4,2 first violation fines and 2 second violation fines were issued in November.,,38,AF,"12,675,621", 106.4 ,85.2,No Correction,South Coast,
15-Nov,11/01/2015  00:00:00,Palmdale Water District,3,Yes,1074.1,1342.8,AF,,116258,80.28,,,,AF,"69,999,404", 80.3 ,80,No Correction,South Lahontan,
15-Nov,11/01/2015  00:00:00,Olivehurst Public Utility District,2,Yes,64.7,117,MG,,19509,105,We have gone from penalties to a tiered rate system with surcharges for use over baseline. ,,,MG,"3,200,000", 105.0 ,95,No Correction,Sacramento River,
15-Nov,11/01/2015  00:00:00,Twentynine Palms Water District,Stage 2,Yes,173.441,187.098,AF,,18795,85,,,,AF,Null, 85.2 ,85,No Correction,Colorado River,
15-Nov,11/01/2015  00:00:00,Orchard Dale Water District,state plan ,Yes,151.42,217.57,AF,,25605,55.06,,,,AF,"7,044,908", 55.1 ,85.73,No Correction,South Coast,
15-Nov,11/01/2015  00:00:00,Phelan Pinon Hills Community Services District,2,Yes,162.15,184.19,AF,,25160,52.91,,,0,AF,"4,073,143", 52.5 ,75,No Correction,South Lahontan,
15-Nov,11/01/2015  00:00:00,"Yreka, City of",2,Yes,29.82,33.5,MG,"For the month of November, a total of 0.36 MG of water was picked up at the local Magic Rain Fill Station by commercial water haulers and private individuals and delivered for use outside the water service area to provide emergency water assistance. The amount of 0.34 MG was deducted from the City's total water production of 30.18 MG for November.",7840,99.79,Customers have shut off (and/or drained to protect from freezing) outdoor irrigation systems for the winter season.,,,MG,"30,840,000", 54.5 ,43,No Correction,North Coast,
15-Nov,11/01/2015  00:00:00,Rubidoux Community Service District,Modified Stage 2,Yes,112.02,136.04,MG,,32000,88.16,,,0,MG,"26,880,000", 88.7 ,76,No Correction,South Coast,
15-Nov,11/01/2015  00:00:00,Quartz Hill Water District,Stage IV,Yes,234.53,330.87,AF,,20352,122.66,,,,AF,Null, 122.7 ,98,No Correction,South Lahontan,
15-Nov,11/01/2015  00:00:00,Pico Rivera  City of,Level 1,Yes,334,383,AF,,39002,65,,,,AF,"33,562,697", 60.5 ,65, DATA CORRECTION ,South Coast,
15-Nov,11/01/2015  00:00:00,Rincon Del Diablo Municipal Water District,Level 2,Yes,335,461,AF,"The District continues to reach out on conservation efforts, to include workshops and one-one efforts with customers.  This month saw increase in commercial activity, which relates to increased economic activity for the region, specifically based on one of Californias largest craft breweries ramping up production.  Note that residential GPCD remains well below SBx7-7 goals and is well below numbers as compared to last year.",29955,86,,,286,AF,"23,787,154", 81.4 ,67,No Correction,South Coast,
15-Nov,11/01/2015  00:00:00,San Fernando  City of,Stage II,Yes,222,255,AF,,23645,85,,,,AF,"11,730,651", 85.7 ,84,No Correction,South Coast,
15-Nov,11/01/2015  00:00:00,Riverside Highland Water Company,Stage 2,Yes,201.6,262.4,AF,1) RHWC is experiencing a large amount of construction. In 2015  we have already added 161 new services. In addition to the increased population there will be a large amount of construction water used as this development is scheduled for a total of about 1500 homes. 2) RHWC has a non potable water system which is separate from our distribution system. The water that supplies the system is double the MCL for nitrates. In the month of November 2015 we delivered 5.8 AF of water. ,15032,125.27,Verbal communication with the customers and door tagging the property if we can not speak to the customer directly.,Notifying our customers through a mailer sent to everyone in our service area. Articles in the local paper and speaking at public events.,,AF,"10,573,879", 125.3 ,86,No Correction,South Coast,
15-Nov,11/01/2015  00:00:00,Rubio Canyon Land and Water Association,4,Yes,127,173,AF,,9600,132,,,,AF,"2,606,811", 132.2 ,92,No Correction,South Coast,
15-Nov,11/01/2015  00:00:00,Santa Fe Springs  City of,Phase 1,Yes,419.51,483.93,AF,,18199,67.6,,,72.13,AF,"99,788,741", 67.6 ,27,No Correction,South Coast,
15-Nov,11/01/2015  00:00:00,San Bernardino County Service Area 64,2,Yes,157.52,201.3,AF,"Report is based on available data due to billing cycle periods, all data for this month not yet available. Will update report with actual numbers once data is available.",14097,129.01,"We conduct water patrols at a minimum of 2 days a week and as often as 5 days a week as staffing allows. We had 6 customer educational interactions re conservation, gave out 3 conservation Goody bags, processed 6 toilet rebates and 5 Cash for Grass applications and 1 Cash for Grass appt.",Loss of personnel has continued to result in a decrease in active enforcement. Current recruitment actions are underway. ,,AF,"8,791,472", 88.6 ,73.02,No Correction,South Lahontan,
15-Nov,11/01/2015  00:00:00,Valley County Water District,2,Yes,498.68,597.11,AF,,71003,61.03,"First Violation - Educate and provide information about water use practices and conservation measures. Second Violation - Written warning outlining the need for action to implement appropriate corrective measures. Additional Violations - Monetary penalties:  Third Violation - $25.00 penalty, Fourth Violation - $50.00 penalty, Fifth Violation - $100.00 penalty","May 2014:  Adopted Ordinance 04-14-126, which outlined our general water conservation and water use efficiency practices.  July 2014:  Adopted Resolution 07-14-752 declaring a Stage 1 Water Supply Emergency. Field employees were trained on the ordinance, the appropriate education and enforcement.  Tickets are actively being given to customers who are in violation of our ordinance.   July 13 2015: Revised ordinance and Stage 2 Water Supply Emergency declaired which includes further water restrictions. All field employees trained on ordinance, education and enforcement.  Tickets actively being issued by all field personnel for violations.",,AF,"43,152,504", 61.0 ,80,No Correction,South Coast,
15-Nov,11/01/2015  00:00:00,San Jacinto  City of,Level 2 Water Supply Shortage,Yes,76244,97250,CCF,,15582,98,Red Tagged,Issued a letter for Conservation Order to Valley Wide Park District and Alta Nursery for non-compliance of water conservation mandates.  ,0,CCF,"8,224,083", 97.6 ,80,No Correction,South Coast,
15-Nov,11/01/2015  00:00:00,San Gabriel County Water District,1,Yes,432.95,505.44,AF,,45000,78,,,,AF,"35,266,900", 78.4 ,75,No Correction,South Coast,
15-Nov,11/01/2015  00:00:00,Santa Ana  City of,Phase 2,Yes,2657.9,3046.2,AF,"Indirect Potable Reuse allocation for Monthly State Water Usage Report Groundwater Replenishment System (GWRS) Indirect Potable Reuse =   1,040.0 (November 2015) Adjusted Total Monthly Water Production-IPR (.67) =    1,617.9 AF Adjusted GPCD-IPR=   35.47 ",332005,58.27,,,,AF,Null, 58.3 ,67,No Correction,South Coast,
15-Nov,11/01/2015  00:00:00,San Juan Capistrano  City of,Stage 2,Yes,539.14,605.2,AF,The City has not yet submitted the new certification forms for Agricultural Water Use.  Agricultural accounts consumed 8.82 AF in November 2015. Construction consumed 9.99 AF.  ,39047,101,"Notification letters are being distributed to residents with 2nd offenses.  The Citys water billing system has been revised to implement excess water use penalties for customers exceeding their established Drought Limit after a cumulative 3 month period.  Preliminary results of customers penalized for exceeding their Drought Limit during the first quarter July/August/September is 2,166 accounts.  Actual penalties are anticipated to be assessed on customers water bills in January 2016.","Inserts are included in every water bill describing available water efficiency rebates and programs.  Customer invoices have been enhanced with additional drought information and information about achieved water savings.  Staff has updated the Water Conservation City webpage, created a simplified URL for drought information and added an online video explaining water conservation requirement.  Effective September, monthly newspaper advertisements have been placed in the local newspaper educating residents about water conservation.  Email e-news continues to be sent out educating the public regarding runoff restrictions and rain regulations. In October 2015, the City had 16 Turf removal site inspections totaling 36,113 sq ft approved for the Countys Turf Removal Rebate Program.  Staff conducted 15 audits for home and irrigation high usage. Staff issued 19 local toilet rebates for November 2015.  Our permanent Water Conservation Coordinator unexpectedly retired September 3, 2015.  Recruitment for a replacement is still active. ",39.08,AF,"17,563,392", 92.5 ,61.7,No Correction,South Coast,
15-Nov,11/01/2015  00:00:00,Serrano Water District,2,Yes,174.9,228.1,AF,,6641,241.72,,,0,AF,"4,108,986", 241.7 ,84.5,No Correction,South Coast,
15-Nov,11/01/2015  00:00:00,Sunny Slope Water Company,2,Yes,111256,141173,CCF,,30611,80.84,"A seasonal (May billing cycle to October billing cycle) rate increase was implemented.  Operators patrol and report water usage or leaks during peak hours, and leave water conservation door hangers.  Odd-numbered addresses may water Tuesdays and Fridays, and even-numbered addresses may water Mondays and Thursdays.  No watering in a manner that causes excess runoff.  No watering between the peak hours of 9 A.M. through 6 P.M.  ","Customer outreach regarding new water mandates & workshops (in multiple languages): emails, letters, message on bills, flyers posted in City Hall, & on company website ; free toilet tank leak detecting tablets & water-efficient shower-heads are available ; educational materials regarding water conservation are available ; synchronized outdoor watering schedule days with neighboring cities (Temple City, San Gabriel, and San Marino).  Any hangers or water waste reported are sent to the city for code enforcement.  Drafting letters to top commercial users.",,CCF,"7,757,299", 80.8 ,89.2,No Correction,South Coast,
15-Nov,11/01/2015  00:00:00,Sonoma  City of,Stage 2,Yes,114.452,150.4,AF,,11579,75.15,,,0,AF,"8,025,721", 75.2 ,70,No Correction,San Francisco Bay,
15-Nov,11/01/2015  00:00:00,Sweetwater Authority,Stage 2,Yes,1314.8,1616.4,AF,,191500,53.16,,,,AF,Null, 53.2 ,71.29,No Correction,South Coast,
15-Nov,11/01/2015  00:00:00,Suburban Water Systems San Jose Hills,CPUC Rule 14.1,Yes,1833.46,2207.08,AF,,178500,76.48,,,42.49,AF,"177,667,232", 78.3 ,70.18,No Correction,South Coast,
15-Nov,11/01/2015  00:00:00,Arcadia  City of,Phase I,Yes,974,1267,AF,,57639,157,,,0,AF,"75,597,531", 130.3 ,71,No Correction,South Coast,
15-Nov,11/01/2015  00:00:00,Suburban Water Systems Whittier/La Mirada,CPUC Rule 14.1,Yes,1420.37,1694.81,AF,,115000,94.71,,,,AF,"129,180,540", 94.7 ,70.6,No Correction,South Coast,
15-Nov,11/01/2015  00:00:00,Golden State Water Company Artesia,Stage 2 of the WSCP; Stage 1 of CPUC Schedule 14.1,Yes,405.1,447.8,AF,Percent Residential Use based on 2013 billing data for the volume of water provided to residential customers for the same reporting month.  Total Population Served: Used simplified California Urban Water Service Area Population methodology ,47978,66,"GSWC maintains a web based Water Waste Report Form on its website at gswater.com. GSWC has also developed a Water Waste Case flow chart that follows each reported water waste case from first incident to resolution of the same. Actions items include educational letter, door notice, verbal notice, corrective action, flow restrictor, and referral to local public agency to implement violations penalties.",NULL,8.7,AF,"33,725,623", 66.0 ,72,No Correction,South Coast,
15-Nov,11/01/2015  00:00:00,Golden State Water Company Claremont,Stage 2 of the WSCP; Stage 1 of CPUC Schedule 14.1,Yes,617.1,748.9,AF,Percent Residential Use based on 2013 billing data for the volume of water provided to residential customers for the same reporting month.  Total Population Served: Used simplified California Urban Water Service Area Population methodology ,37160,116,"GSWC maintains a web based Water Waste Report Form on its website at gswater.com. GSWC has also developed a Water Waste Case flow chart that follows each reported water waste case from first incident to resolution of the same. Actions items include educational letter, door notice, verbal notice, corrective action, flow restrictor, and referral to local public agency to implement violations penalties.",NULL,,AF,"75,434,605", 116.3 ,64.5,No Correction,South Coast,
