Reporting_Month,Timestamp,Supplier_Name,Stage_Invoked,Mandatory_Restrictions,Total_Monthly_Potable_Water_Production_2014_2015,Total_Monthly_Potable_Water_Production_2013,Units,Qualification,Total_Population_Served,REPORTED_Residential_Gallons_per_Capita_Day,Optional_Enforcement_Actions,Optional_Implementation,Optional_Recycled_Water,Recycled_Water_Units,CALCULATED_Production_Monthly_Gallons_Month_2014_2015,CALCULATED_R_GPCD_2014_2015,Percent_Residential_Use,Comments_Corrections,Hydrologic_Region,CALCULATED_R_GPCD_2013
15-Nov,11/01/2015  00:00:00,Calaveras County Water District,Stage 3.5,Yes,87.516,95.17,MG,"In accordance with guidance from the State Water Resources Control Board (SWRCB), the Calaveras County Water District has excluded water used by commercial accounts, non-revenue water and wholesale accounts from Percentage Residential Use. A detailed staff report substantiating these changes has been provided to SWRCB staff via hard copy and email. Please note that a peak population multiplier is no longer being applied, because the population influx consisting of tourists and large groups of vacationing second homeowners generally takes place between June and September in Calaveras County. CCWD is now using the population reported in its Urban Water Management Plan for the months of October through May.",31750,74.42,"CCWD will strive to educate and inform customers of conservation measures before taking enforcement action. If customers violate Ordinance 2015-01, which includes Stage 3.5 Mandatory Water Conservation Measures, they will first receive a written warning letter. If CCWD staff witnesses a second violation of the ordinance, the District may impose a $100 fine, install a flow-restricting device, or both. If CCWD staff witnesses a third violation, the District may impose a $200 fine. If CCWD staff witnesses any additional violations of the ordinance, a $500 fine may be imposed. The district may also pursue a misdemeanor violation of California Water Code Section 31029. If convicted of this crime, a person could be put in jail for up to 30 days, fined up to $600 or both.","CCWD will continue to expand its Water Conservation Program through public outreach, education, conservation rebates and partnering with local community groups and agencies; All outdoor watering is prohibited between 9 a.m. and 7 p.m.; Customers are limited to two days per week outdoor watering: Tuesdays & Saturdays for odd-numbered addresses and Wednesdays and Sundays for even-numbered addresses. Those who are growing gardens, orchards or have newly planted native or drought-tolerant landscaping are allowed one additional watering day; Excessive irrigation that allows runoff is prohibited; Customers must fix or stop leaks within 72 hours of being notified by CCWD; washing down of hardscape is prohibited; irrigating outdoors during, and with 48 hours of, measureable rain is prohibited; Watering of ornamental turf on public street medians is prohibited; Using a hose without an automatic shut-off valve to wash vehicles, boats or trailers is prohibited; Use of potable water in decorative fountains and recreational ponds is prohibited unless the water is recirculated; Filling of new or existing pools is prohibited; Restaurants and other food establishments shall only serve and refill water for patrons upon request. Restaurant owners are encouraged to use table cards to help convey the conservation message; Hotels and motels must offer their guests the option to not have their linens and towels laundered daily and must prominently display this option in each guest room; Water for irrigation of commercial landscapes, schools and parks shall be reduced by 35%; Raw and potable water deliveries to golf courses may only be used to irrigate tees and greens and will not be provided unless golf courses have maximized their use of available recycled water; If available, treated effluent will be used for dust control as per state regulations (if a dust control permit is issued by the State); No new irrigation meters will be approved; Line flushing will not be performed, except when necessary to comply with state and federal public health and safety requirements for operation of permitted potable water systems; CCWD customers must adhere to all other applicable water conservation requirements mandated by the State of California, including the Governor, the State Water Resources Control Board, and the State Legislature; CCWD staff are authorized to investigate alleged violations of this Ordinance, to make determinations as to whether a violation has occurred, and to issue warning notices and administrative fines under this Ordinance.",,MG,"3,501,000", 74.4 ,81,No Correction,San Joaquin River,
15-Nov,11/01/2015  00:00:00,Humboldt Bay Municipal Water District,2,Yes,18.74,15.581,MG,,422,47.614,,,0,MG,"17,630,000", 86.0 ,5.812,No Correction,North Coast,
15-Nov,11/01/2015  00:00:00,Santa Maria  City of,1,Yes,839,1054,AF,,102087,61,,,0,AF,"88,957,440", 60.7 ,68,No Correction,Central Coast,
15-Nov,11/01/2015  00:00:00,Yuba City  City of,3,Yes,265.54,359.05,MG,,68379,85.4,"August 8, 2014  Name Address City, State, Zip  Dear Water Customer,  With the third consecutive year of drought, the City of Yuba City implemented emergency water restrictions in accordance with the Citys Water Shortage Contingency Plan per the Governors request in January.  On July 15, 2014, the State Water Resources Control Board approved an emergency regulation to ensure that water suppliers, their customers and state residents increase water conservation in urban settings.  The emergency regulations require that all Californians stop the following activities immediately:      Washing down driveways and sidewalks  Watering of outdoor landscapes that cause excess runoff  Using a hose to wash a motor vehicle unless the hose is fitted with a shut-off nozzle   Using potable water in a non-circulating fountain or decorative water feature  In addition, the emergency regulations specifically require that urban water suppliers implement water shortage contingency plans to a level where restrictions on outdoor watering are mandatory.  For Yuba City, that is Stage 3 of the Citys Water Shortage Contingency Plan.    Stage 3 of the Citys Water Shortage Contingency Plan and Municipal Code Section 6-6.19, Emergency Water Restrictions, permit lawn watering only as follows:   EVEN numbered addresses: Wednesdays and Saturdays   ODD numbered addresses: Thursdays and Sundays   New lawns may be watered three (3) times each day for the first three (3) weeks after planting provided that notification is given to the City Public Works Department of the new planting either at the time of planting or as soon thereafter as is practicable.  Public agencies and/or commercial/industrial companies using City water to irrigate large turf areas greater than 0.5 acres, shall submit an irrigation schedule for approval by the Public Works Director. This schedule shall provide for a reduction of water use based on a percentage of previous usage. The actual percentage and base year of usage shall be established by the Public Works Director as approved by the City Council and will be in accordance with the severity of the water shortage declared by the City Council. It is recommended that watering take place during the coolest parts of the day in the evening and early morning hours. As part of the Citys continued effort to help water customers comply with these water restrictions, the City has started water patrols which are designed to provide residents with conservation education.  The Citys goal is to raise awareness to the mandatory restrictions, and issue penalties as a last resort.  For those that choose not to comply with the mandatory restrictions, the following penalty schedule will apply:  1st violation: Written warning 2nd violation:  $ 50.00 surcharge* 3rd violation:  $100.00 surcharge* 4+ violations: $250.00 surcharge* per violation *Surcharges shall appear on the next monthly water billing  The Public Works Department provides complimentary water audits and will assist with adjusting sprinkler timers upon request.  If you would like to schedule a water audit or need assistance adjusting a sprinkler timer, please call John Westhouse, Water Treatment Plant Supervisor, at 530-822-4637.  Also, the City has a rebate program for the installation of smart irrigation timers.  Information on the rebate program can be found at www.yubacityh2o.com.       The City appreciates the conservation efforts of our water customers.  If you have any questions, please do not hesitate to contact Public Works.    Sincerely,      Diana Langley City of Yuba City  Public Works Director ",,,MG,Null, 85.4 ,66,No Correction,Sacramento River,
15-Nov,11/01/2015  00:00:00,Escondido  City of,Stage 2,Yes,1480.7,1773.7,AF,,134053,64.7,,,34,AF,"99,710,537", 64.8 ,54,No Correction,South Coast,
15-Nov,11/01/2015  00:00:00,Los Angeles County Public Works Waterworks District 29,Equivalent mandated compliance ,Yes,580,659,AF,A portion of the water supply for District 29 is being transferred to another water supplier (Marina Del Rey Water System - i.e. small water system) outside of its service area. This transferred water is being removed from the previous reported total monthly potable water production. The population of this small water system is also being removed from the previous reported population figures.,22221,232,,"In order to achieve the level of reduction required by the State Board, per the Rules and Regulations for the Waterworks Districts, a Phase VIII Shortage was declared for District No. 29, which mandates water use reductions and Target Quantity (Allocations) that customers must meet to avoid surcharges. The Target Quantity (Allocation) is a 36% reduction from the average amount of water used in an area by all residential customers with similar sized meters in 2013. This averaging methodology is used to ensure that customers that are already conserving water are not unfairly required to reduce their water consumption. A conservation surcharge of 0.5 times the normal water rate is charged for the first 15% of water use above the Target Quantity. An additional conservation surcharge of 1.0 times the normal water rate is charged for all water used in excess of the first 15% above the Target Quantity. ",,AF,"18,899,383", 232.5 ,82,No Correction,South Coast,
15-Nov,11/01/2015  00:00:00,Placer County Water Agency,2,Yes,404841870,635721621,G,"PCWA reads most commercial, industrial, and institutional (CII) meters bi-monthly; therefore, data including all customers for a given month will not be available until two months after that month. An estimate of CII use based on estimated PRU and unaccounted-for water has been provided. This estimate will be replaced with actual data in March 2016 for all reporting months.",95717,96.78,,"Piloted the use of SmartMeters for future data tracking. Partnered with neighboring utilities and the Department of Water Resources to sponsor landscape efficiency workshops. PCWA participated in a regional effort to expand the regions public outreach program, which includes television, radio, online and social media water conservation messaging. The program, managed by the Regional Water Authority, represents a collaboration of 20 water agencies in the Sacramento region and will be active from September 2015 through February 2016. Reduced irrigation to one (1) day per week.",,G,"86,462,613", 97.3 ,69,No Correction,Sacramento River,
15-Nov,11/01/2015  00:00:00,Corona  City of,3,Yes,2147.368,2457.59,AF,"Overall water sales (direct customer consumption) decreased by 18% in November 2015 compared to 2013. Residential usage decreased by 16% and CII usage decreased by 23%. The current accumulated reduction in water sales (customer consumption) from June 2015 through November 2015 is 25%.  UC Riverside CIMIS Station 44 data showed the average temperature in 11/2015 was 1.6 degrees lower compared to 11/2013, however  the total evapotranspiration rate (ETo) was 0.01 higher in 11/2015 compared to 11/2013 and 0.92 less inches of rain fell in 11/2015 compared to 11/2013. Both these conditions are factors contributing to higher water usage to maintain the same landscape. ",168070,108.38,"In November 2015, a total of 1,058 customers had water usage charged in Tier 4 (Excessive Water Use) and 899 customers had water usage charged in Tier 5 (Wasteful Water Use). All customers with water usage falling into tier 4 and 5 are notified by postcard and a portion of these customers are contacted by phone to schedule an appointment to address the high water usage.","In November 2015, Corona's Water Resources Team received 333 calls relating to water conservation questions, rebate programs and water waste with 679 outgoing calls. A total of 145 residential landscape checkup (water audits) appointments, one large landscape audit, eight commercial/industrial landscape audits, three multi-family residential audits (mixed use meter accounts) and 28 follow up site visits were completed, as well as sprinkler and timer adjustments or leak repairs at 12 sites and the installation of water saving devices at one property were completed. In November 2015, there were five education events held and ten classroom presentations reaching 241 students. 132 bathroom aerators, 64 hose nozzles, 57 kitchen aerators, 124 showerheads, 128 toilet dye tablets, and 127 shower timers were delivered or provided to residential customers. 138 rebates were issued for residential customers and 562 commercial rebates were issued.",322.25,AF,"195,549,958", 108.4 ,78.1,No Correction,South Coast,
15-Nov,11/01/2015  00:00:00,Burbank  City of,3,Yes,1145.9,1507.1,AF,,106084,86.77,"Every complaint was followed up with a letter, and every letter mentions possible fines.","Still in Stage 3, but now on November through March 1-day-per-week watering schedule.  Used WaterSmart",,AF,"107,889,407", 86.8 ,73.95,No Correction,South Coast,
15-Nov,11/01/2015  00:00:00,Camarillo  City of,2,Yes,641.3,706.9,AF,,47026,86.45,"Ongoing patrolling by conservation contractor & City staff, delivering door tags, ordinance summaries and issuing citations.  In addition to enforcement, a free water conservation gardening workshop was held on 11/14/15 open to the public.","City Council approved additional measures to Stages 2 & 3 of the Municipal Code Chapters 2 & 3, affecting new development, along with a resolution to re-declare a Stage 2 water shortage to impose the new measures. Water rate increases were approved at 7% annually for the next 2 years as part of a Prop 218 process, effective 1/1/16 and 1/1/17.",49.7,AF,"29,098,532", 85.9 ,58,No Correction,South Coast,
15-Nov,11/01/2015  00:00:00,Blythe  City of,1,Yes,63.2,73.2,MG,"Residential water use is calculated using consumption data by comparing residential water uses (RESSIF: residential single family; RESMUF: residential multifamily) to the remaining accounts such as irrigation, commercial, and public entities.",13839,93.3,Per Ordinance No 871-15 First Violation  Written Notice; Second Violation (within 12 months of the first violation)  Final Written Notice; Third Violation (within 12 months of the first violation) - $100 surcharge in customer water bill; Fourth Violation (within 12 months of the first violation) - $150 surcharge in customer water bill; Fifth Violation or more violation (within 12 months of the first violation) - $200 surcharge in customer water bill.,"Ordinance No 871-15 was approved by Council on May 26, 2015. The Ordinance added Chapter 13.05 (Water Conservation) to Title 13 (Public Services) of the Blythe Municipal Code. The purpose and policy states that due to the water conditions prevailing in the State of California, it is necessary and appropriate to adopt a water conservation program to reduce the water used by persons in the City.  The City of Blythe posted on its webpage at http://www.cityofblythe.ca.gov tips for water conservation from the statewide program Save Our Water, a partnership between the Association of California Water Agencies and the California Department of Water Resources. ",0,MG,"18,800,000", 93.3 ,61.3,No Correction,Colorado River,
15-Nov,11/01/2015  00:00:00,Roseville  City of,3,Yes,1350,2144,AF,,122946,60.02,,,32.22,AF,Null, 69.8 ,58.53, DATA CORRECTION ,Sacramento River,
15-Nov,11/01/2015  00:00:00,Vista Irrigation District,2,Yes,1193,1361,AF,,124746,68,,,,AF,"116,654,811", 67.5 ,65,No Correction,South Coast,
15-Nov,11/01/2015  00:00:00,West Valley Water District,Stage 3A,Yes,1225,1540,AF,,74194,119,,"The Board is seeking to approve 2 day a week watering on December 17, 2015.",,AF,"111,115,337", 120.2 ,67,No Correction,South Coast,
15-Nov,11/01/2015  00:00:00,Napa  City of,Stage 2,Yes,741,1059,AF,"Because our utility billing system is comprised of staggered bimonthly meter read cycles, the City is not able to calculate exact amounts of Commercial, Industrial, Institutional and Residential usage on a calendar month basis.  The data reported here are estimated based on recent historical annual percentages by account type.",86051,61,"The City of Napa continued its formalized Water Waste Reporting procedures, encouraging customers to report violations via phone or email (link on the City's web site).  Water Division field staff are tasked with reporting violations and educating customers in the course of their normal duties.  No water waste complaints were received in November.","In May 2015, the City renewed its declaration of a Moderate Water Shortage and modified its Stage 2 regulations to include a prohibition on landscape irrigation on consecutive days (effectively a three-days-per-week allowance without prescribed days).  The modified regulations also include all statewide prohibitions in addition to mandatory restrictions on irrigation time of day (10am to 5pm prohibited) and pool draining and refilling (only allowed for repairs).  Also in May, a new Water Conservation Specialist was hired, filling a staff vacancy.  A new two-year budget was adopted in June, with increases in water conservation program funding.  An annual 4% rate increase took effect October 1.  Educational/awareness campaign on the drought, water-saving target (20% vs. 2013), and water waste prohibitions continues with bill messages and inserts, web site updates, newspaper articles, radio ads, magazine ads, and displays at public buildings and community events.",,AF,"65,170,285", 60.8 ,65,No Correction,San Francisco Bay,
15-Nov,11/01/2015  00:00:00,Mission Springs Water District,1-A,Yes,582,557,AF,"MSWD's per-capita usage is only 109 GPCD for November, and averaging 114 GPCD for the calendar year. Considering the climate of the region and basic water needs, it would have been nearly impossible to meet the prescribed goal of 76 GPCD.",37600,109,,,,AF,"66,473,691", 109.3 ,65,No Correction,Colorado River,
15-Nov,11/01/2015  00:00:00,Los Angeles County Public Works Waterworks District 40,Equivalent Mandated Compliance,Yes,2735,3598,AF,,207705,110.13,,"In order to achieve the level of reduction required by the State Board, per the Rules and Regulations for the Waterworks Districts, a Phase VII Shortage was declared for District No. 40, which mandates water use reductions and Target Quantity (Allocations) that customers must meet to avoid surcharges. The Target Quantity (Allocation) is a 32% reduction from the average amount of water used in their area by all residential customers with similar sized meters in 2013.   This averaging methodology is used to ensure that customers that are already conserving water are not unfairly required to reduce their water consumption. A conservation surcharge of 0.5 times the normal water rate is charged for the first 15% of water use above the Target Quantity. An additional conservation surcharge of 1.0 times the normal water rate is charged for all water used in excess of the first 15% above the Target Quantity ",,AF,"133,680,548", 110.1 ,77,No Correction,South Lahontan,
15-Nov,11/01/2015  00:00:00,Nevada Irrigation District,3,Yes,152.6,224.3,MG,,44761,94.02,,,,MG,"20,610,000", 94.0 ,82.73,No Correction,Sacramento River,
15-Nov,11/01/2015  00:00:00,Alameda County Water District,Stage 2,Yes,864,1161,MG,"Calculated % residential use per the recommendation by SWRCB  in their guidance for estimating residential GPCD - this % is based on the October 2014/November 2014 (previous year) consumption for residential (SFR and MFR, including MF dedicated landscape accounts), as listed in the water revenue and consumption report for FY 2014/15. ",346000,55.8,Enforcement information provided with July 2014 report - no updates at this time. Note: 5 of the 32 water waste reports listed above required no action (not violations or could not confirm information provided).,:  Information provided with July 2014 report - no updates at this time.,,MG,"316,000,000", 55.8 ,67,No Correction,San Francisco Bay,
15-Nov,11/01/2015  00:00:00,Hawthorne  City of,2,Yes,348.7,363.3,AF,CII quantity of water included all non-residential sales. ,44549,72.7,,,,AF,"13,327,323", 72.8 ,85.6,No Correction,South Coast,
15-Nov,11/01/2015  00:00:00,Nipomo Community Services District,3,Yes,131.7,198.4,AF,,12512,94.9,,,,AF,"7,299,072", 94.9 ,83,No Correction,Central Coast,
15-Nov,11/01/2015  00:00:00,Rancho California Water District,4a,Yes,3826,4480,AF,"Total monthly potable production for September 2015 was 73% groundwater; only 27% potable import water was produced, although raw import was taken for groundwater recharge. For non-revenue water, we are not currently tracking unaccounted-for water on a monthly basis; however, our 2010 UWMP shows that our historical average has been about 5% of potable water. ",169011,115.83,"RCWD maintains a Water Conservation Policy that includes fines of up to $500 per violation for water wasting. The District continues to inform its customers, personnel, and local agencies on reporting and responding to water waste. ","On May 14, 2014, the District's Board adopted a resolution of declaration of Stage 4a of its Water Shortage Contingency Plan (WSCP) and Water Conservation Policy. This stage reduces the amount of water available to customers in the Tier 2 portion of their water budgets by 30%. Additionally, RCWD revised its structure for the administration of fines for violations of the provisions of the WSCP. These revisions allow staff to send a stronger signal to customers who violate WSCP provisions. ",,AF,"77,878,491", 115.6 ,47,No Correction,South Coast,
15-Nov,11/01/2015  00:00:00,Rainbow Municipal Water District,Level 2,Yes,1230.4,1336.6,AF,,19495,117.8,,,,AF,"16,651,008", 117.9 ,17.2,No Correction,South Coast,
15-Nov,11/01/2015  00:00:00,Oceanside  City of,Level 2,Yes,1758.6,1980.3,AF,,174522,68,,,,AF,"81,788,708", 68.2 ,62.3,No Correction,South Coast,
15-Nov,11/01/2015  00:00:00,Western Municipal Water District of Riverside,Stage 4-B,Yes,1522,1710,AF,The average ETo for Western's retail service area for November 2013 was 3.32 inches. The ETo for the same period in 2015 was 3 percent lower measuring 3.22 inches.  Western is not able to calculate the percentage of residential use or CII deliveries until four weeks after the end of the month. The above reported percentage of residential use (61%) and CII deliveries (416.79) is for October 2015. Both numbers will be updated in January 2016 during the SWRCB's December reporting cycle.,96139,105.51,"Western has allocation based water rates for more than 95% of our urban water users, including residential, commercial, and landscape accounts. Via Western Resolution 2910, adopted May 20, 2015, we recommend just 3 watering days per week. However, if a customer is within their individualized water allocation and there is no run-off, daytime irrigation, or other identifiable waste of water, the three-day recommendation will not be strictly enforced.  Western partners with the public and local code enforcement teams to monitor prohibited water uses and water saving progress in the community we serve. Western encourages the public to use a smart phone application called iEfficient. The app allows the public to report water waste and an email is automatically delivered to Western's customer service team. Western's field crews are also using the app to report and track water waste. Also, in partnership with the City of Riverside's 311 dispatch, we reach out to residential or business customers that may have a problem with water waste. The first warning letter offers assistance through free efficiency evaluations for all customers. The second letter within a twelve month period reminds them of assistance and warns of monetary penalties. The third notice imposes daily penalties. ","On May 20, 2015, Western adopted Resolution 2910 which implemented Stage 4-B in the Water Supply Contingency Plan. This stage reduced all outdoor water allocations by 30 percent and CII allocations by 10 percent. In addition, Tiers 3 and 4 of Western's water rate structure were removed. All water use above a customer's adjusted water allocation will be charged the applicable Tier 5 water rate. Western has sent individualized letters to customers informing them of the changes in allocations and asking for an outdoor water use reduction of 50 percent. Western expects that through the combination of reduced water allocations, enhanced outreach and rebate programs, as well as the enforcement of prohibitions and restrictions, we will ultimately achieve the mandated 32 percent reduction. ",,AF,"135,811,616", 104.9 ,61,No Correction,South Coast,
