Reporting_Month,Timestamp,Supplier_Name,Stage_Invoked,Mandatory_Restrictions,Total_Monthly_Potable_Water_Production_2014_2015,Total_Monthly_Potable_Water_Production_2013,Units,Qualification,Total_Population_Served,REPORTED_Residential_Gallons_per_Capita_Day,Optional_Enforcement_Actions,Optional_Implementation,Optional_Recycled_Water,Recycled_Water_Units,CALCULATED_Production_Monthly_Gallons_Month_2014_2015,CALCULATED_Production_Monthly_Gallons_Month_2013,CALCULATED_R_GPCD_2014_2015,Percent_Residential_Use,Comments_Corrections,Hydrologic_Region,CALCULATED_R_GPCD_2013
14-Nov,11/01/2014 00:00,East Bay Municipal Utilities District,Moderate,Yes,4195.4,5148.6,MG,"1. To provide context as EBMUD continues to face the second drought period since 2007the average R-GPCD for November from 2005-2007 is 81 gpcd (using metered consumption data). The R-GPCD for November, 2013 is 77 gpcd. 2. For the PRU and R-GPCD, applied SWRCBs recommended methodology of using billing data for the volume of water provided to residential customers in November, 2013 as a percentage of Total Monthly Potable Production (TMPP) for November, 2013 and applying that ratio to TMPP of November, 2014 to get the approximate volume of residential water use for November, 2014. The population for 2014 was calculated using 2013 ABAG projections. 3. EBMUD has mandatory prohibitions restrictions on outdoor use and EBMUD continues to ask all customers to voluntarily cut back their total water use by 10 percent.  ",1379000,62.0,"EBMUDs Board adopted Section 28 of the Districts Regulations Governing Service to Customers on August 12, 2014 to specify outdoor water uses that are prohibited until further notice and provide guidelines on effective water use practices to help customers conserve. Section 28 also defines the exceptions and enforcement provisions should customers fail to comply with the prohibitions.  ","EBMUDs Board adopted a preliminary water shortage action plan on February 11, 2014 and updated it on May 13, 2014. The Board adopted a new water shortage emergency action plan on August 12, 2014 that includes initiatives to comply with the states emergency water conservation regulation (State Water Board Resolution 2014-0038). The Water Shortage Emergency Action Plan identifies the outreach efforts that EBMUD will make to educate and inform customers about the mandatory outdoor water use prohibitions and to provide guidance on how customers can conserve during the drought.",-99999,NULL,4195400000,5148600000,61.9,0.61,No Correction,San Francisco Bay,75.9
14-Nov,11/01/2014 00:00,Morro Bay  City of,Severely Restricted,Yes,27062107.0,33485435.0,G,,10234,59.0,,,-99999,NULL,27062107,33485435,59.1,0.67,No Correction,Central Coast,73.1
14-Nov,11/01/2014 00:00,Yorba Linda Water District,Stage 1,Yes,1520.3,1584.3,AF,"YLWD's Total Monthly Production for the month of October 2014 was 1,922.8 acre-feet. Approximately 264.8 acre-feet was from Indirect Potable Reuse. Therefore, our adjusted Total Monthly Water Production-IPR is 1658.0 acre-feet and our adjusted GCPD-IPR is 173.32. Unfortunately, we did not have access to this data prior to submitting October 2014's report. ",72399,168.78,"On the first violation, YLWD will hand deliver a door hanger to the location of the violation and mail a notice to the current billing address. A second violation within 12 calendar months is punishable by a penalty of $100. A third violation within 12 calendar months of the first or second violations is punishable by a penalty of $250. A fourth and any subsequent violations within 12 calendar months of the first violation are punishable by a fine of $500. In addition, the District may opt to install a water flow restrictor device. ","Watering is prohibited between the hours of 9am and 6pm. Watering is limited to 15 minutes per station per day. Water is prohibited when it is raining, or there is a forecasted chance of rain of 50 percent or higher. No runoff. No washing down of hard or paved surfaces. Re-circulation of water is required for water fountains. Washing of vehicles is limited to use of a hand-held house with an automatic shut-off nozzle. Stage 1 restrictions include irrigation limited to three times per week, with no irrigation on Sunday. Education and communication regarding these restrictions have been communicated to our customers in the following ways:  Direct Mailing of an informational tri-fold and Drought Explanation Letter to every customer (approx. 25,000)  Direct Mailing of a customer-specific usage letter to all Home Owners Associations (large irrigation users)   Establishment of a Water Waster Hotline and Website Application for customers to notify the District of water waste they observe in the community (55 website notices and 52 hotline calls)   Specialized training regarding Conservation and the Conservation Restrictions for Operations Field staff and Customer Service Staff.  Field staff now assigned to Conservation Education and Investigation of Water Waste in the Community.  Thus far, 5 Water Conservation Ordinance First Violations have been issued.   Participation in MWDOCs Turf Removal Rebate Program (105 customers/102,000 sq ft of turf removed) ",-99999,NULL,495391924,516246416,168.8,0.74,No Correction,South Coast,175.9
14-Nov,11/01/2014 00:00,Long Beach  City of,2nd level (Stage 1),Yes,4471.0,4715.0,AF,,472262,67.0,,"Initially, we included non-revenue water when determining the percent residential use; when we determined this was incorrect we resubmitted corrected PRU and R-GPCD without non-revenue water.  A spreadsheet detailing both sets of calculations is available upon request.",-99999,NULL,1456881730,1536389478,66.8,0.65,No Correction,South Coast,70.5
14-Nov,11/01/2014 00:00,"Los Banos, City of",3,Yes,148411000.0,180075000.0,G,,37168,118.5,,,-99999,NULL,148411000,180075000,118.5,0.89,No Correction,San Joaquin River,143.7
14-Nov,11/01/2014 00:00,Turlock  City of,1,Yes,413.0,521.9,MG,"The above percentage is based on billed residential accounts.  The remaining 48.67 percent of potable application is utilized for landscaping and CII (Commercial, Industrial, Institutional) accounts.",71181,99.28,Responded to a total of 4 water wasting incidences in the month of November.,,-99999,NULL,413000000,521900000,99.3,0.5133,No Correction,San Joaquin River,125.5
14-Nov,11/01/2014 00:00,Jurupa Community Service District,Level 2,Yes,1735.656,1849.761,AF,,118731,106.0,,,-99999,NULL,565565984,602747261,106.4,0.67,No Correction,South Coast,113.4
14-Nov,11/01/2014 00:00,Coastside County Water District,Stage 2-Water Shortage Emergency Warning,Yes,46.37,57.99,MG,Residential customers have their meters read every other month. Residential GPCD was calculated using SWRCB's guidance.,16652,39.0,,,-99999,NULL,46370000,57990000,41.8,0.45,No Correction,San Francisco Bay,52.2
14-Nov,11/01/2014 00:00,Citrus Heights Water District,3,Yes,682.0,912.0,AF,based on connection classification and monthly/historical use,67333,98.0,,,-99999,NULL,222230673,297176501,104.5,0.95,No Correction,Sacramento River,139.8
14-Nov,11/01/2014 00:00,Burlingame  City of,2,Yes,91220967.0,116065060.0,G,,30282,64.0,,Restating water production to correct for different billing periods in wholesale water purchases from SFPUC when comparing current month to 2013 Baseline month.,-99999,NULL,91220967,116065060,64.3,0.64,No Correction,San Francisco Bay,81.8
14-Nov,11/01/2014 00:00,Orange Vale Water Company,3,Yes,197.57,295.93,AF,,15200,132.0,,,-99999,NULL,64378466,96429213,122.8,0.87,No Correction,Sacramento River,184.0
14-Nov,11/01/2014 00:00,Dublin San Ramon Services District,3,Yes,180.349,266.545,MG,,79275,59.39,,,0.016,MG,180349000,266545000,59.4,0.7829999999999999,No Correction,San Francisco Bay,87.8
14-Nov,11/01/2014 00:00,Los Angeles Department of Water and Power,Phase 2,Yes,40582.0,43694.0,AF,Total water production was re-submitted to include final supply volume instead of preliminary supply volume. Population was re-submitted to account for monthly projected increases in population change. Temperature November 2014 was 2.1 degrees hotter than November 2013 and 3.8 degrees hotter than the long-term average temperature for November. Precipitation  November 2014 received 0.14 inches less precipitation than November 2013 and 0.78 inches less precipitation than the long-term average ,3967360,75.6,"Our Water Conservation Response Unit (WCRU), a.k.a. Water Cops, actively patrol Los Angeles communities and enforce the Citys Emergency Water Conservation Ordinance. The WCRU investigates reports of wasteful water use and educates violators on the importance of complying with the Water Conservation Ordinance. Repeat violators are issued monetary fines ranging from $100-$600. The WCRU has issued over 4,910 letters and citations this year. ","LAs residential GPCD for November 2014 was 75.6 gallons per person per day. This is noteworthy considering the size of Los Angeles and its 5 microclimates, and the varied socioeconomic sectors in the city. November 2014 compared to November 2013 has shown a decrease in water usage of 7.1%. ",749,AF,13223702611,14237752251,75.6,0.68,No Correction,South Coast,81.3
14-Nov,11/01/2014 00:00,Camrosa Water District,stage one,No,653.11,703.08,AF,NULL,35738,131.87,,,-99999,NULL,212816825,229099621,131.0,0.66,No Correction,South Coast,141.0
14-Nov,11/01/2014 00:00,El Dorado Irrigation District,2,Yes,1512.0,2372.0,AF,Monthly production includes estimated agricultural use of 26.2%. The estimated percentages for residential and agricultural use vary from month to month due to the Districts bi-monthly meter reading cycles. Monthly production includes wholesale deliveries to the City of Placerville because they are not an urban water supplier. Report does not include 96 acre-feet of recycled water produced for uses that would otherwise require potable water.,128500,77.0,,,-99999,NULL,492687358,772919585,76.9,0.602,No Correction,Sacramento River,120.7
14-Nov,11/01/2014 00:00,El Centro  City of,None,Yes,193720000.0,186629000.0,G,"we have adopted the state guidelines from the latest regulation. Residential use does not include commercial, landscaping or industry.",44311,87.0,,,-99999,NULL,193720000,186629000,87.4,0.6,No Correction,Colorado River,84.2
14-Nov,11/01/2014 00:00,Milpitas  City of,2,Yes,383983.0,417890.0,CCF,"based on current month, 2 month customer bill cycle",70817,51.0,,,-99999,NULL,287239231,312603429,60.8,0.45,No Correction,San Francisco Bay,66.2
14-Nov,11/01/2014 00:00,Santa Rosa  City of,1-Mandatory,Yes,343867098.0,486628234.0,G,"Due to the variation in the number of days in the billing cycle between Nov. 2013 (28) and Nov. 2014 (26), the daily average water production decreased 23.9% in November 2014 (compared to November 2013) as a result of Santa Rosa's conservation efforts.",170093,49.0,"The City has been conducting weekly water watch patrols three mornings per week, and also provides options for the community to report water waste and Stage 1 Mandatory violations through our website, hotline and MySantaRosa app. Water Use Efficiency staff and City field crews have been trained and can door tag any home or business for a violation. The City has a progressive enforcement program that starts with information and education and can ultimately lead to turning off the customers water. ","The City has implemented Stage 1 - Mandatory, which requires the following: -20% community-wide reduction in water use; -Compliance with the Citys water waste ordinance which prohibits runoff from irrigated areas and prohibits property side breaks and leaks; -Irrigation can only occur between the hours of 8 PM through 6 AM; -Prohibits washing down hardscapes unless required for public health and safety; -Prohibits using potable water for street washing; -Requires shut-off hose nozzles for all garden and utility hoses; and - Requires Water-on-request at all restaurants. The City is providing information to the community through bill inserts, bill face messages, social media, dedicated website, radio and newspaper ads. The City offers numerous rebates and incentive programs, including free home and commercial audits. The City continues to participate in the regional media campaign - ""There's a Drought On. Turn the Water Off."" The media campaign includes newspaper and radio ads, before the movie ads, dedicated website, and local cable channel video. Additional programs include a Green Exchange program where customers receive $1 per SF of turf removed, as well as a Recirculating Hot Water Pump Rebate.",-99999,NULL,343867098,486628234,48.5,0.72,No Correction,North Coast,68.7
14-Nov,11/01/2014 00:00,Westminster  City of,Level One Water Supply Shortage ,Yes,940.1,974.3,AF,"940.1 AF total production - 206.3 AF Indirect Potable Reuse (September) =  733.8 AF. 733.8 AF x 68% residential water use = 499 AF residential water use. 499 AF = 162,594,435 gallons. 162,594,435 gallons / 30 days / 93,322 capita = 58.1 R-GCPD",93322,58.1,,,-99999,NULL,306332927,317477045,74.4,0.68,No Correction,South Coast,77.1
14-Nov,11/01/2014 00:00,Mid-Peninsula Water District,2,No,86670.0,106535.0,CCF,,26030,70.57,,,-99999,NULL,64833662,79693714,70.6,0.85,No Correction,San Francisco Bay,86.7
14-Nov,11/01/2014 00:00,Olivenhain Municipal Water District,2,Yes,1523.9,1349.6,AF,No revenue will be collected for 2.83 AF of water usage reported by water treatment plant and system operators.    80%-Usage by code (customer sector) is not available at the time of reporting so a three-year average of water used by residential customers in November is used.   Population is based on figures calculated by California Department of Finance  Recycled water totals are not available at time of reporting.,83368,159.0,,,-99999,NULL,496564990,439769086,158.8,0.8,No Correction,South Coast,140.7
14-Nov,11/01/2014 00:00,Daly City  City of,II,Yes,220262.0,265484.0,CCF,,104462,44.0,,,-99999,NULL,164767418,198595823,49.9,0.95,No Correction,San Francisco Bay,60.2
14-Nov,11/01/2014 00:00,Delano  City of,Stage 2,Yes,185.3,199.9,MG,Used 2010 UWMP and 2013-14 history data. The City is not 100% metered.,48957,80.0,Will add as needed.,Will add as needed.,-99999,NULL,185300000,199900000,79.5,0.63,No Correction,Tulare Lake,85.7
14-Nov,11/01/2014 00:00,Anaheim  City of,N/A,Yes,4981.0,5191.0,AF,"The monthly production includes groundwater, imported water, and water from storage. The Residential Use Percentage excludes system water losses. Anaheims share of Indirect Potable Reuse (IPR) or GWRS water in October = 911.7 AF. Anaheims adjusted Total Potable Water Production (excluding IPR) = 4,069 AF. Anaheims adjusted GPCD (excluding IRP) = 69.4. ",356762,84.9,,,-99999,NULL,1623065958,1691494758,84.9,0.56,No Correction,South Coast,88.5
14-Nov,11/01/2014 00:00,Elsinore Valley Municipal Water District,II,Yes,1766.3,1718.6,AF,"This monthly report has been updated to reflect changes in R-GPCD values due to changes to the Percent Residential Use (PRU) factor and updated population values.  For all monthly submissions until December 2015, Elsinore Valley Municipal Water District (EVMWD) assumed that all water (residential and commercial) utilized for landscape irrigation would be considered in the estimation of the PRU.  Based on discussions with SWRCB, it became clear to EVMWD that commercial customers with irrigation demands should not be included in the estimation of the PRU. EVMWD also submitted a memorandum to Eric Oppenheimer documenting these changes.  For all the monthly submissions, EVMWD was using an old population value  from prior Electronic Annual Reports (EAR). However, during the review process, it was found out that EVMWD could use updated population values by applying SWRCB suggested methodology to estimate population (Simplified California Urban Water Service Area Population Methodology).  EVMWD submitted an email to Mark Emmerson documenting these changes. SWRCB staff advised EVMWD to send updated R-GPCD numbers. ",147755,94.6,,,569,AF,575551376,560008262,94.8,0.73,No Correction,South Coast,92.2
14-Nov,11/01/2014 00:00,Coachella Valley Water District,2,Yes,9409.2,9918.6,AF,"Data obtained from city planning departments within the Coachella Valley Water District service area indicated a ""snowbird"" or seasonal population of approximately 32.8%.  Total population for this report was adjusted from the original census data to include these residents who own homes and use potable water for landscape purposes in all months of the year.",301633,235.5,,,-99999,NULL,3066001247,3231989964,235.5,0.695,No Correction,Colorado River,248.2
14-Nov,11/01/2014 00:00,Lake Hemet Municipal Water District,3,Yes,806.7,884.0,AF,,52914,113.5,,,-99999,NULL,262864346,288052661,113.4,0.685,No Correction,South Coast,124.3
14-Nov,11/01/2014 00:00,Carmichael Water District,2,Yes,153.63,212.49,MG,Carmichael Water District collects meter data on a bimonthly basis.  The above percentage is based on previous year data.,38354,107.0,,,-99999,NULL,153630000,212490000,116.2,0.87,No Correction,Sacramento River,160.7
14-Nov,11/01/2014 00:00,Monte Vista Water District,1,Yes,640.09,748.48,AF,"Service Area Population: The State Boards recommended methodology determines a non-municipal service area population by obtaining 2010 U.S. Census data and adjusting based on growth in combined single-family and multi-family residential connections. Using this method, the District has seen no population growth over the past five years. However, our records show that at least three multi-family residential complexes with 453 additional residential units have been developed in the District since 2010. Additionally, the Department of Finance estimates that the population of the city of Montclair, which is served entirely by the District and comprises two-thirds of the Districts retail service area, grew by 1.9% between 2010 and 2014. It is, therefore, more appropriate to calculate the Districts retail service area population based on known, proven, and documented growth rather than by changes in the number of residential connections. Calculation: 2010 US Census population = 53425 + 1.9% = 54460. Calculation can be cross-checked by multiplying added multi-family residential units from 2010 to 2014 (all in Montclair) by average persons per household and occupancy rate for Montclair in 2014 (Department of Finance estimates). Calculation: 453 x 3.86 = 1749 x 96.1% = 1680. Added to 2010 population of 53425 provides a 2014 est. population of 55105. As a result, 54460 appears to be a conservative estimate for District's service area population. This number is also consistent with the District's latest monitoring reports.         Percent Residential Use: The State Boards recommended methodology is to use billing data for the volume of water provided to residential customers from the previous year as a percentage of total monthly potable water production. The District originally interpreted this recommendation as taking the percentage of residential billing usage based on total billed usage and then applying this percentage to total production. However, the District has reviewed statewide reporting data and finds that other agencies have developed their residential use percentage based on total production rather than total billed usage. This method more accurately reflects the percentage of residential demand compared to all other demands in the given period, including non-revenue water uses. As we bill bimonthly, we are using discretion per the guidance in comparing total annual production to total residential consumption for Fiscal Year 2013-14. Calculation: 6628 Total Residential Consumption / 10304 Total Production = 64% Percent Residential Use. ",54460,82.0,,,-99999,NULL,208574240,243893276,81.7,0.64,No Correction,South Coast,95.5
14-Nov,11/01/2014 00:00,Pleasanton  City of,Stage 3,Yes,276.765,367.471,MG,"Commercial: 12.2% Irrigation: 25.2 % Multi-Family Residential: 7.6% Single Family Residential: 55.0%  City of Pleasanton bills bi-monthly in arrears so this data reflects most recent consumption data per all accounts, broken into percentage by revenue class. ",71871,80.4,,,4.903,MG,276765000,367471000,80.4,0.626,No Correction,San Francisco Bay,106.7
14-Nov,11/01/2014 00:00,Santa Monica  City of,2,Yes,344.7,370.4,MG,,92185,87.3,,,3.5,MG,344700000,370400000,87.2,0.7,No Correction,South Coast,93.8
14-Nov,11/01/2014 00:00,Riverside  City of,Stage 2,Yes,5069.0,4953.0,AF,"Through a more thorough evaluating of the population data for our service area, it has come to our attention that the students, which live on campus (or adjacent to), attending University of California Riverside, Cal Baptist University, and La Sierra University were not included in the original population estimates.  Between these three universities, about 35,000 students were not accounted for.  Therefore, we are resubmitting revised monthly reports that more accurately reflect the population served by Riverside Public Utilities.",333033,91.0,na,na,17,AF,1651740883,1613942118,90.9,0.55,No Correction,South Coast,88.8
14-Nov,11/01/2014 00:00,Contra Costa Water District,2,Yes,2509.0,2815.0,AF,Reported values are based on consumption data.,197536,112.0,,,-99999,NULL,817561230,917271767,111.7,0.81,No Correction,San Francisco Bay,125.4
14-Nov,11/01/2014 00:00,"Imperial, City of",1,Yes,65380000.0,65648000.0,G,The original report submitted indicated our residential use was 100% and no Non-revenue Water was previously reported.  We are correcting this months report to reflect actual residential use.,17354,91.78,,,-99999,NULL,65380000,65648000,91.8,0.7308,No Correction,Colorado River,92.2
14-Nov,11/01/2014 00:00,California Water Service Company Antelope Valley,2,Yes,45.4,55.6,AF,2013 production resubmitted  due to faulty meter. Production provided is based on metered sales amount.,3385,132.0,,,-99999,NULL,14793655,18117339,131.5,0.903,No Correction,South Lahontan,161.1
14-Nov,11/01/2014 00:00,Irvine Ranch Water District,1,No,4481.7,4586.6,AF,"IRWD is implementing an approved Alternate Plan.  November 2014:   103502 total connections, 91383 residential connections.  Novemberr 2013: 100012 total connections,   88593 residential connections. 3% growth over last year. ",381880,73.0,"Prohibitions in effect at all times regardless of whether shortage declared: Gutter flooding, leaks, washing down hard surface areas, waste, and run-off. ",,2391.2,AF,1460368340,1494550155,73.9,0.58,No Correction,South Coast,75.7
14-Nov,11/01/2014 00:00,Watsonville  City of,Statewide Emergency Conservation,Yes,158331748.0,205814012.0,G,"7.1% of this month's water was delivered to one agricultural customer. The other 92.9% was delivered to a combination of Residential, Commercial/Institutional, Industrial, and Other accounts. PRU was determined using 2013 data. Usage by Residential and Multi-residential accounts equaled 68.3% of total water usage.",65739,55.0,"City staff will follow up once a problem of water waste has been reported. We offer information about how to reduce water waste and schedule a free, one-time Water Conservation Consultation to help fix the problem. If water waste continues beyond the educational warning and Water Conservation Consultation, the City will begin fines to address further ongoing water waste violations.",,-99999,NULL,158331748,205814012,74.6,0.929,No Correction,Central Coast,96.9
14-Nov,11/01/2014 00:00,San Jose  City of,1,Yes,403.0,493.0,MG,"Muni Water bills bimonthly, so % Residential Use is based on billing data for the volume of water provided to residential customers as a percentage of total potable water consumption for the reporting month and prior month of the previous year (November and October of 2013). Recycled water information (reported in #11) is customer usage data, which is also billed bimonthly. Population is based on the population estimated in our 2010 UWMP and projected annually consistent with the States simplified method for estimating service area population, but 2000 Census data was used when we estimated population for the 2010 UWMP. We are obtaining 2010 Census data for our service area and are working on updating the calculation to use the 2010 Census data.",116697,69.0,Muni Water continued all efforts described in previous months.,"Muni Water continued efforts to reduce by 20% and continued implementing its Stage 1 actions and outreach efforts described in previous reporting. In addition, Muni Water conducted a direct mail targeting its Top Irrigation Users in the North San Jose service area to request they reduce their irrigation by at least 20%.",54,MG,403000000,493000000,69.1,0.6,No Correction,San Francisco Bay,84.5
14-Nov,11/01/2014 00:00,Dinuba  City of,2,Yes,108.73,139.94,MG,,23666,153.15,,,-99999,NULL,108730000,139940000,110.3,0.72,No Correction,Tulare Lake,141.9
14-Nov,11/01/2014 00:00,Casitas Municipal Water District,Stage 1,Yes,733.83,932.6,AF,Usage now includes agriculture water.,9603,104.62,,,-99999,NULL,239119553,303889041,104.7,0.1261,No Correction,South Coast,133.0
