Reporting_Month,Timestamp,Supplier_Name,Stage_Invoked,Mandatory_Restrictions,Total_Monthly_Potable_Water_Production_2014_2015,Total_Monthly_Potable_Water_Production_2013,Units,Qualification,Total_Population_Served,REPORTED_Residential_Gallons_per_Capita_Day,Optional_Enforcement_Actions,Optional_Implementation,Optional_Recycled_Water,Recycled_Water_Units,CALCULATED_Production_Monthly_Gallons_Month_2014_2015,CALCULATED_R_GPCD_2014_2015,Percent_Residential_Use,Comments_Corrections,Hydrologic_Region,CALCULATED_R_GPCD_2013
15-Nov,11/01/2015  00:00:00,East Bay Municipal Utilities District,Stage 4,Yes,3875.9,5148.6,MG,"1. To provide context as EBMUD continues to face the second drought period since 2007the average R-GPCD for Nov. from 2005-2007 is 81 gpcd using metered consumption data. The R-GPCD for Nov., 2013 is 77 gpcd. 2. For the PRU and R-GPCD, applied SWRCBs recommended methodology of using billing data for the volume of water provided to residential customers in Nov., 2013 as a percentage of Total Monthly Potable Production (TMPP) for Nov., 2013 and applying that ratio to TMPP of Nov., 2015 to get the approximate volume of residential water use for Nov., 2015. The population for 2015 was calculated using 2013 ABAG projections. 3. For Commercial, Industrial, and Institutional (CII) water use, EBMUD used a methodology similar to that for calculating R-GPCD. Billing data for the volume of water provided to CII customers in Nov., 2013 as a percentage of Total Monthly Potable Production (TMPP) for Nov., 2013 was calculated, and that ratio was applied to the TMPP for Nov., 2015 to get the approximate volume of CII water use for Nov., 2015.  4. The number of Contact Follow-Ups includes the following actions: email to customer; field visit  contact with customer; field visit  door hanger; incoming call  contact with customer; outgoing call  contact with customer; outgoing call  voice message; warning letter sent.  ",1390000,57,"EBMUDs Board adopted a revised Section 28 of the Districts Regulations Governing Service to Customers on April 14, 2015. The revised Section 28 includes the States prohibitions as well as liming outside watering to before 9am and after 6pm. Section 28 also defines the exceptions and enforcement provisions should customers fail to comply with the prohibitions including a misdemeanor punishable by a fine of up to $1000 and the Districts authority to enforce civil and criminal action if needed.  On April 28th, EBMUD Board adopted two new ordinances 1. Excessive Water Use Penalty Ordinance  purpose is to prohibit excessive water use when EBMUDs Board has declared a Stage 3 or Stage 4 drought and to authorize EBMUD to impose a financial penalty on customers who disregard the mandate to conserve water during the drought water shortage conditions. Any applicable penalty charges will be reflected in customer bills beginning Sept 1, 2015 and will apply to water use in July and August 2015. 2. Water Theft Penalty Ordinance  purpose is to provide EBMUD the authority to impose administrative penalties on any person who engages in water theft, including the unauthorized use of water from a public fire hydrant or other facilities. ","EBMUDs Board adopted a preliminary water shortage action plan on February 11, 2014 and updated it on May 13, 2014. The Board adopted a new water shortage emergency action plan on August 12, 2014 that includes initiatives to comply with the states emergency water conservation regulation (State Water Board Resolution 2014-0038). EBMUDs Board adopted on December 9, 2014 a declaration to increase customer water use reductions to 15% starting Jan, 2015. The Board has adopted, on April 14th, a revised Drought Management Program and declared that EBMUD has entered the critical stage in their water supply. EBMUDs Board on April 14, 2015 adopted a mandatory 20% districtwide reduction in water use with 2013 as the baseline year. ",,MG,"847,000,000", 56.7 ,61,No Correction,San Francisco Bay,
15-Nov,11/01/2015  00:00:00,Morro Bay  City of,Severly Resticted,Yes,28815483,33485435,G,,10234,60.68,,,0,G,"8,188,096", 60.7 ,64.65,No Correction,Central Coast,
15-Nov,11/01/2015  00:00:00,Yorba Linda Water District,Stage 3,Yes,1173.51,1584.3,AF,,73990,130.1,"On the first violation, YLWD will hand deliver a door hanger to the location of the violation and mail a notice to the current billing address. A second violation within 12 calendar months is punishable by a penalty of $100. A third violation within 12 calendar months of the first or second violations is punishable by a penalty of $250. A fourth and any subsequent violations within 12 calendar months of the first violation are punishable by a fine of $500. In addition, the District may opt to install a water flow restrictor device.   Additionally, a Penalty Block structure was put into place on customer usage, based on customer class, in May 2015. Beginning with the billing period primarily of June 2015 usage, YLWD will assess penalties of $10 to $160 based on usage blocks above 18 units per billing period for the Residential Class. The Commercial Class will receive penalties from $25 to $400 based on usage blocks above 50 units per billing period, and the Irrigation Class will receive penalties from $65 to $1,000 per billing period based on usage blocks above 115 units.  These blocks are based on the average monthly usage of each customer class in 2013, minus the SWRCBs mandatory 36% reduction.  ","Watering is prohibited between the hours of 9am and 6pm. Watering is limited to 15 minutes per station per day. Water is prohibited when it is raining, or there is a forecasted chance of rain of 50 percent or higher. No runoff. No washing down of hard or paved surfaces. Re-circulation of water is required for water fountains. Washing of vehicles is limited to use of a hand-held house with an automatic shut-off nozzle. Stage 3 restrictions include irrigation limited to one time per week, with no irrigation on Sunday. Education and communication regarding these restrictions have been communicated to our customers in the following ways:  6 Water Waster Hotline and 10 Website Applications for customers to notify the District of water waste they observe in the community. Additionally, the City of Yorba Linda forwarded 1 call they received from residents of water waste at locations throughout the City.  Regular specialized training regarding Conservation and the Conservation Restrictions for Operations Field staff and Customer Service Staff.  Field staff assigned to Conservation Education and Investigation of Water Waste in the Community.   53 Water Conservation Ordinance First Violations have been issued. 9 Water Conservation Ordinance Second Violations have been issued- resulting in potentially $900 in fines.   Participation in MWDOCs Turf Removal Rebate Program   Partnered with the City of Yorba Linda to identify and educate customers with a history of irrigation runoff to decrease usage and pollutants entered into the stormwater system.   Implementation of a Leak Detection Program within the District. Approximately 5 leaks found this month in YLWD-maintained pipe, which have been repaired.  Additionally, due to the loss of revenue related to the Emergency Mandate of 36%, the District has raised its base fee effective on October 1, 2015 to cover the cost of providing water service. For a 1 inch meter, this amounts to approximately a $25 increase per billing period. We are encouraging customers to continue to decrease their usage to offset the increased base fee, and to help in meeting the State Emergency Mandate. ",,AF,"33,077,178", 127.5 ,74,No Correction,South Coast,
15-Nov,11/01/2015  00:00:00,Long Beach  City of,3rd level,Yes,4169,4715,AF,,474587,53,,"Launched major conservation initiative Mission H2O Long Beach, that uses traditional and social media to promote conservation, and includes additions to our website: http://missionh2olb.com/",,AF,"361,369,233", 53.4 ,56,No Correction,South Coast,
15-Nov,11/01/2015  00:00:00,"Los Banos, City of",3,Yes,129662000,180075000,G,,37168,,,,,G,Null, 96.5 ,83,No Correction,San Joaquin River,
15-Nov,11/01/2015  00:00:00,Turlock  City of,2,Yes,349.32,521.89,MG,,71181,82.58,,,,MG,"127,240,000", 82.6 ,50.48,No Correction,San Joaquin River,
15-Nov,11/01/2015  00:00:00,Jurupa Community Service District,Level 3,Yes,1697.973,1849.761,AF,,118731,115,,"Additional measures are being considered in January including, but not limited to, penalties and additional irrigation restrictions. ",0,AF,"143,851,349", 114.9 ,74,No Correction,South Coast,
15-Nov,11/01/2015  00:00:00,Coastside County Water District,Stage 2,Yes,41.24,57.99,MG,,16668,39,,,,MG,"19,720,000", 38.8 ,47,No Correction,San Francisco Bay,
15-Nov,11/01/2015  00:00:00,Citrus Heights Water District,Stage 4 Water Crisis,Yes,537,889,AF,,67333,89,,In March 2015 CHWD implemented a 3 Tier Drought Rate Structure,0,AF,"8,472,137", 82.3 ,95,No Correction,Sacramento River,
15-Nov,11/01/2015  00:00:00,Burlingame  City of,2,Yes,79356116,116065060,G,"The estimated volume of CII and percent residential use is based upon bi-monthly billing data. The CII and percent residential calculations are the average value over October and November billing cycles. Total monthly production is based upon SFPUC meter data. Because the meter readings do not necessarily occur at the beginning and end of the month and because the readings from 2013 do not necessarily correspond with the same days as during 2015, the monthly production values have been interpolated to account for the variation in water meter reading days from SFPUC.  For the same reason, the percent residential is the ratio of the average volume of billed residential water used over two months divided by the average total produced water over two months.",30282,56,,,,G,"29,302,050", 55.7 ,63.8,No Correction,San Francisco Bay,
15-Nov,11/01/2015  00:00:00,Orange Vale Water Company,4,Yes,163.43,295.93,AF,,14283,108,,,,AF,"8,374,382", 106.9 ,86,No Correction,Sacramento River,
15-Nov,11/01/2015  00:00:00,Dublin San Ramon Services District,Stage 1,Yes,182.189,266.545,MG,,80175,69.2,,,0.142,MG,"46,411,000", 69.2 ,91.3,No Correction,San Francisco Bay,
15-Nov,11/01/2015  00:00:00,Los Angeles Department of Water and Power,2,Yes,39271,43694,AF,"LADWP continues with the implementation of water conservation efforts to meet its 16% cumulative reduction mandate according to SWRCB Emergency Drought Regulations. Despite hotter and dryer conditions than recorded long term averages in November, LADWP was able to meet its required 16% cumulative reduction for the month.  ",4023175,72.1,"To date, our Water Conservation Response Unit (WCRU), a.k.a. Water Cops, has issued over 10,000 letters and citations since January 2014. WCRU actively patrol Los Angeles communities and enforce the Citys Emergency Water Conservation Ordinance. The WCRU investigates reports of wasteful water use and educates violators on the importance of complying with the Water Conservation Ordinance. The WCRU also catches additional violations that were not reported while patrolling neighborhoods. The first official penalty is a citation (warning) letter. Repeat violators are issued monetary fines ranging from $100-$600. Because LADWP has had an emergency water conservation ordinance with outdoor watering restrictions in effect since 2009, LADWPs customers have been well educated for some time now on ordinance requirements. Therefore, most customers who receive a contact from the WCRU and/or a warning letter respond very well and change their habits immediately. This explains why LADWP has not issued many fines in recent years. ","The LA Mayor and City Council approved amendments to the Citys Emergency Water Conservation Ordinance Plan on June 17, 2015 to include the following new and/or stricter restrictions: no irrigation 48 hours after a rain event; 2 days per week watering schedule; requirements for the use of pool covers and restrictions on filling residential pools; and restrictions on filling decorative fountains or ponds used solely for aesthetic purposes.  In December 2014, LADWP started its WaterSmart Pilot Study, which is a behavior efficiency program that aims to educate customers on their water use and the need to conserve through focused outreach through bi-monthly Home Water Reports.  LADWP started an AMI pilot program in April 2015 which will ultimately include the installation of around 600 smart meters on targeted customers within the next 18 months.  LADWP started a Water Loss Task Force recently to evaluate various options for improving water loss control and reducing water losses in LADWPs water distribution system. LADWP also has an annual pipe replacement program to reduce leaks in LADWPs water distribution system.  Staffing for both our WCRU enforcement unit and conservation group has increased in recent months. LADWP has also doubled funding for public outreach and education on the drought.   In addition, LADWP recognizes the importance of reaching out to high water users and has implemented multiple strategies to encourage them to reduce water use. LADWP is developing short-term and long-term conservation strategies to develop better tools for targeting these customers.   In May 2015, LADWP sent water conservation letters to the top 1 percent high water users of LADWPs single-family customers (approximately 4,600 customers). These letters stressed the importance of complying with the Ordinance restrictions and provided water saving tips and rebate information to the customers.  Additionally, LADWP enrolled 2,000 of its high water using single family customers in its Home Water Use Report Pilot Program (Pilot).   On November 20, 2015, a second water conservation letter was sent to the top 1 percent water users. The letters remind these customers on the importance of reducing their water use during this drought.   LADWP will continue planning and implementing strategies to encourage water savings among high water use customers.  ",1035,AF,"3,573,286,748", 72.1 ,68,No Correction,South Coast,
15-Nov,11/01/2015  00:00:00,Camrosa Water District,stage three,Yes,642,703,AF,,35783,129,,,,AF,"35,843,657", 129.0 ,66.22,No Correction,South Coast,
15-Nov,11/01/2015  00:00:00,El Dorado Irrigation District,2,Yes,1434,2372,AF,Monthly production includes estimated agricultural use of 26%. The estimated percentages for residential and agricultural use vary from month to month due to the Districts bi-monthly meter reading cycles. Monthly production includes wholesale deliveries to the City of Placerville because they are not an urban water supplier. The District has elected not to exclude commercial agriculture deliveries from total potable water production at this time. The District's population has been updated based on an annual review and update of all customer accounts.,118500,79,,"El Dorado Irrigation District participated in a regional effort to collect $150,000 in additional funding to expand the regions public outreach program, which includes television, radio, online and social media water conservation messaging. The program, managed by the Regional Water Authority, represents a collaboration of 20 water agencies in the Sacramento region and will be active from September 2015 through February 2016.",86,AF,"71,035,611", 78.9 ,60,No Correction,Sacramento River,
15-Nov,11/01/2015  00:00:00,El Centro  City of,2,Yes,174840000,186629000,G,,44311,92,,,,G,"52,452,000", 92.1 ,70,No Correction,Colorado River,
15-Nov,11/01/2015  00:00:00,Milpitas  City of,2,Yes,267278,345879,CCF,,70817,,,,,CCF,"92,871,397", 58.3 ,62,No Correction,San Francisco Bay,
15-Nov,11/01/2015  00:00:00,Santa Rosa  City of,1 - mandatory,Yes,353462006,486628234,G,"Santa Rosa obtains its production data on a billing cycle basis (Santa Rosa has no control over this) which fluctuates between 27-35 days each month. Consequently, the State's method of reporting using a calendar month basis skews the data for agencies such as Santa Rosa that have a billing period cycle that fluctuates. For example, the City had 27 days in the November 2015 billing cycle vs. 28 days in November 2013. Using the State's calendar month method resulted in a calculated savings of 27.4% (comparing Nov 2015 to Nov 2013), whereas using the actual number of billing cycle days results in a normalized calculated savings of 24.7% for that same period.",170974,49,,"The City of Santa Rosa is continuing to provide leadership in the conservation arena by maintaining strong outreach to the community via bill insert messaging, multiple rebate programs and media presence on the web including facebook.",,G,Null, 48.2 ,70,No Correction,North Coast,
15-Nov,11/01/2015  00:00:00,Westminster  City of,Level 2,Yes,805.8,974.3,AF,"805.8 A/F *325,851= 262,570,736 (Gallons) *81%=212682296 /93,322 (Population) = 2279/ 30 days= 75.9 R-GPCD   805.8 A/F-351.6 (Allocated GWRS) = 454.2 A/F *325,851(Gallons) *81% =119,881,234.6 (Gallons) /93,322 (Population) = 1284.6/ 30 days= 42.8 R-GPCD IPR",93322,75.92,"The Westminster Water Division issued warnings on 395 violations, followed up with 40 last chance before a fine letters in an effort to make multiple points of contact to stop water wasting and sent fines to 2 residents, via written notification, as well as in person follow-ups at sites to help address water wasting issues.","The Westminster Water Division reallocated one personnel to be a Water Conservation Assistant in September as well as adding a part-time administrative aide in November who is helping organize the violation database. The Conservation Assistant made exceptional progress, especially with the Westminster Mall, one of our largest commercial areas managed by Simmons Group, to fix hundreds of broken sprinklers and move toward California friendly landscaping.   Community outreach: The Water Superintendent made a presentation at the Local Kiwanis Group, explaining the severity of the drought, conservation tips and giving out our popular conservation buckets. We also sponsored a Girl Scout Gold Award project, holding an educational conservation meeting for over 50 Westminster students and parents. We educated attendees on our water restrictions, the drought, water sources and how they can save water.",0,AF,"50,018,194", 76.0 ,81,No Correction,South Coast,
15-Nov,11/01/2015  00:00:00,Mid-Peninsula Water District,2,Yes,77733,106535,CCF,,26030,62,,,0,CCF,"14,675,283", 63.3 ,85,No Correction,San Francisco Bay,
15-Nov,11/01/2015  00:00:00,Olivenhain Municipal Water District,2,Yes,1222.2,1349.6,AF,Wholesale invoices are used for production data. Population is based on figures calculated by California Department of Finance. % Residential-Usage by code (customer sector) is not available at the time of reporting so a three-year average of water used by residential customers in this month is used. Usage data not available at time of reporting so three-year averages are used. ,84351,115,"Meter readers investigate accounts with increase in usage of 200%, or any pattern of usage that is out of the ordinary.  Customers are called in an effort to prevent water waste from potential leaks.   Budget increased to hire contractor dedicated to enforcement and water conservation monitoring, who patrols service area.  Contractor assisted by drought intern from wholesaler.   Enforcement of mandatory water use restrictions is a responsibility of each employee and mandatory training has been implemented.  Waste complaints via hotline, wholesaler mobile application, state reporting tool, and online form increase monthly.  Warning letters offer free water use evaluation, restrictions and drought information, and tips to reduce usage by 32%.  OMWD allows a 21-day grace period to allow customer to remedy violation.  Customer is not issued another violation if a report is received for the same violation during this time.  If a report of a repeat violation is received during the 21-day grace period, the customer is called rather than issued another written violation. ","Revised Water Supply Shortage Ordinance to include new mandates and move to a 2-day watering week as of June 1. Implement drought Level 2 rates effective July 1.  www.olivenhain.com/shortage.  Customers have been responsive to outreach and enforcement actions, taking advantage of water audits to irrigate more efficiently, and researching high-efficiency watering devices as well as sustainable landscape techniques. Restrictions announced on each hardcopy bill and eBill notification, in each hardcopy and electronic newsletter, on website, in social media, in lobby displays, in handouts and poster boards at community events, and in target marketing to top 200+ residential users and Top 20 + commercial users. OMWD is transitioning to AMI technologies. Partnered with California State University San Marcos on behavioral study whereby interns walk neighborhoods educating customers on good water habits and water use restrictions. Target marketing campaigns to top 20 potable commercial users, and top 200+ residential customers. ",72,AF,"61,911,771", 114.9 ,73,No Correction,South Coast,
15-Nov,11/01/2015  00:00:00,Daly City  City of,II,Yes,247967,265484,CCF,,105810,55,,,0,CCF,"36,529,621", 54.9 ,94,No Correction,San Francisco Bay,
15-Nov,11/01/2015  00:00:00,Delano  City of,2,Yes,165.789,199.964,MG,The population was taken from the 2010 UWMP and residential numbers were taken from 2013-2015 history data supplied by our Finance Department.,54318,50,The city has hired an additional employee to patrol and issue warnings or citations as needed. The city is still concentrating on education as the primary enforcement. Meters are being installed on all non- metered customers that do not comply and all un-metered accounts in high use areas. ,The city has implemented the required regulations and is monitoring all usages to assist in staying in compliance.,0,MG,"73,700,000", 49.9 ,49,No Correction,Tulare Lake,
15-Nov,11/01/2015  00:00:00,Anaheim  City of,III,Yes,4403,4850,AF,"The monthly productions represent the water demand in the 30 days of November 2013 and 2015. The production includes groundwater, imported water, and water from storage less untreated water delivery to Anaheim Hills Golf Course. The Residential Use Percentage excludes system water losses. Anaheims share of Indirect Potable Reuse (IPR) or GWRS water in November = 1,430 AF. Anaheims adjusted Total Potable Water Production (excluding IPR) = 2,973 AF. Anaheims adjusted GPCD (excluding IRP) = 52.1.",360142,77.1,"The complaints of 316 included 132 Anaheim Anytime +156 Water Savers Log + 2 Customer Log + 26 CSRs. The follow-ups of 316 included 132 Anaheim Anytime +156 Water Savers Follow-ups + 2 Customer Log + 26 CSRs. Warnings of 303 included 132 door hangers, 156 Water Savers Log, and 15 Code Enforcement notices.",Added 2 water conservation specialists.,5,AF,"560,138,603", 77.2 ,58.1,No Correction,South Coast,
15-Nov,11/01/2015  00:00:00,Elsinore Valley Municipal Water District,Stage 4a,Yes,1390.2,1718.6,AF,,149774,76.01,,"In response to the State Water Boards Notice of Violation for failure to meet water conservation standards on August 10, 2015, EVMWD has provided the requested information. To comply with the State Mandate, EVMWD implementated a comprehensive Drought Action Plan, at a cost of nearly $1.4 million. The Drought Action Plan includes enforcement fines, drought water and surcharge rates, and a variety of conservation programs. The letter included several attached documents, which demonstrate EVMWDs commitment to water conservation and to achieving the water conservation target: Water Waste Warning Door Hanger, Water Budget/Drought Bill Stuffer, Water Commodity Rates, Special Edition Water Log Customer Newsletter, Ordinance No. 225 (Water Shortage Contingency Plan), Resolution No. 15-05-05 (Water Efficient Landscape Standards), Resolution No. 15-07-03 (Revising Various Water, Recycled Water, and Wastewater Rates, Fees, and Charges), Resolution No. 5-05-06 (Water Shortage Contingency Plan).",468.8,AF,"115,318,820", 75.6 ,75,No Correction,South Coast,
15-Nov,11/01/2015  00:00:00,Coachella Valley Water District,3,Yes,7709.4,9918.6,AF,Data obtained from city planning departments within the CVWD service area indicated a snowbird or seasonal population of approximately 32.8%. Total population for this report was adjusted from the original census data to include these residents who own homes and use potable water for landscape purposes in all months of the year. ,318217,182.9,,"The Coachella Valley Water District is utilizing a water budget-based tiered rates system to help achieve its conservation goal. Outdoor water budgets have been reduced 36%, and a drought penalty has been added for customers exceeding the reduced outdoor water budget. We also recently restricted days per week by not allowing watering Monday or Thursday.",,AF,"766,207,045", 183.4 ,69.7,No Correction,Colorado River,
15-Nov,11/01/2015  00:00:00,Lake Hemet Municipal Water District,3,Yes,581.6,863.3,AF,Added,52914,93,,,,AF,"20,033,346", 93.0 ,77.9,No Correction,South Coast,
15-Nov,11/01/2015  00:00:00,Carmichael Water District,2,Yes,128.89,212.49,MG,Carmichael Water District collects meter data on a bi-monthly basis.  residential use is based on previous years data.  CII is based on best estimate. ,38354,99.6,,CWD is a partner with Save our water CWD is a member of the Regional Water Authority CWD has implemented one day a week watering schedule,,MG,"10,190,000", 99.7 ,89,No Correction,Sacramento River,
