Reporting_Month,Timestamp,Supplier_Name,Stage_Invoked,Mandatory_Restrictions,Total_Monthly_Potable_Water_Production_2014_2015,Total_Monthly_Potable_Water_Production_2013,Units,Qualification,Total_Population_Served,REPORTED_Residential_Gallons_per_Capita_Day,Optional_Enforcement_Actions,Optional_Implementation,Optional_Recycled_Water,Recycled_Water_Units,CALCULATED_Production_Monthly_Gallons_Month_2014_2015,CALCULATED_Production_Monthly_Gallons_Month_2013,CALCULATED_R_GPCD_2014_2015,Percent_Residential_Use,Comments_Corrections,Hydrologic_Region,CALCULATED_R_GPCD_2013
14-Nov,11/01/2014 00:00,Rancho California Water District,3a,Yes,4626.0,4480.0,AF,"RCWD service area includes about 18,000 acres of agricultural and ranch lands, primarily vineyards, avocado, and citrus trees. Agricultural water use from July through November 2014 represents 24%, 32%, 27%, 32%, and 33% respectively, of the District's potable water use. Additionally, the District maintains Ag/Domestic meters where one meter serves both a home and agricultural land on a parcel. Currently, this water use is all included in ""residential"" use for the purposes of the R-GPCD, which overstates the R-GPCD. For June through November 2014, Ag/Domestic averaged 16% of total residential use. In 2011, we analyzed the amount that agriculture represent in Ag/Domestic accounts, excluded that amount, and it lowered the GPCD by approximately 12%, a substantial change. Also, for non-revenue water, we are not currently tracking ""unaccounted-for water"" on a monthly basis; however, our 2010 UWMP shows that our historical average has been about 5% of potable water. Recently, the District has been implementing an AMR system that is lowering the percentage of unaccounted-for water, which we will track more frequently.    UPDATE: As was indicated in all of the original monthly reports submitted to SWB, the District included a significant amount of agricultural demand in its calculation of total residential demand. After further consideration, RCWD has determined that it is not appropriate to include this agricultural demand in the calculation of residential demand since the demand represents water that is produced for commercial agricultural uses and not for urban uses. Furthermore, the District has looked more closely at the population of its service area by compiling data that is more up-to-date than that which was used for the original reports, and has arrived at a more accurate determination of population. ",166465,132.26,"RCWD maintains a Water Conservation Policy that includes fines of up to $300 per violation for water wasting. From July 2014 through November 2014, the District has sent out 107 violation written notices, which includes 8 second notices and 1 third notice. The District continues to inform its customers, personnel, and local agencies on reporting and responding to water waste. ","On August 15, 2014, the District's Board adopted a resolution of declaration of Stage 3, and approval of an updated Water Shortage Contingency Plan (WSCP) and Water Conservation Policy that, among other things, responds to the SWB Emergency Regulation. The District is now updating the WSCP to refine water budgets within shortage stages. ",114,AF,1507388701,1459814393,132.8,0.44,No Correction,South Coast,128.6
14-Nov,11/01/2014 00:00,Rainbow Municipal Water District,Level,Yes,1879.2,1753.3,AF,The average lot size in our District is 3-4 acres. 66% of the 1879.2 AF was agricultural usage. Some of our AG customers pay Domestic rate to pay the fees of  storage infrastructure to avoid being the first to be shut-off.,19495,353.9,,,-99999,NULL,612340002,571315307,356.0,0.34,No Correction,South Coast,332.1
14-Nov,11/01/2014 00:00,Oceanside  City of,Level 2,Yes,2012.7,1980.3,AF,,171183,78.9,,,-99999,NULL,655841167,645283581,78.9,0.618,No Correction,South Coast,77.7
14-Nov,11/01/2014 00:00,Western Municipal Water District of Riverside,Stage 1,Yes,1595.0,1655.0,AF,Average ET for Western's retail service area:   November 2013: 3.32; November 2014: 3.18.    Western is not able to calculate the percentage of residential use until four weeks after the end of the month.  The above percentage (65) is for October 2014. We will provide the number for November in next month's report. The residential use is typically 66-69 percent of total production. ,96139,114.94,Western Municipal Water District partners with local code enforcement teams to monitor water saving progress in the community we serve. In partnership with 311 dispatch we reach out to residential or business customers that may have a problem with water waste. The first warning letter offers assistance through free efficiency evaluations for all customers. The second letter for the same issue reminds them of assistance and warns of monetary penalties. The third notice imposes daily penalties.,,-99999,NULL,519733026,539284112,117.1,0.65,No Correction,South Coast,121.5
14-Nov,11/01/2014 00:00,Tahoe City Public Utilities District,2,Yes,12740161.0,13115882.0,G,"This is a revised report with updated population and percent residential use data as the primary revisions.  The Tahoe City Public Utility District is a resort community with a very high transient and second home population. It is not equitable to use traditional methods to estimate population within our service area, as our population that uses water fluctuates monthly, weekly and daily in some cases. Instead of simply using the average population as determined by our 2010 UWMP, TCPUD has estimated monthly population relative to changes in sewer flows within our service area.  This provides a more accurate estimate of the population density using water during a given month and we have applied this data to our estimated base full time population which occurs in the month of November. The result is a more equitable distribution of monthly water use among all types of residential users, not just the relatively low full time population. The revised percent residential use data is due to our Accounting department providing a much more detailed report of residential only water use data that was not available during the initial reporting timeframes. We appreciates the States understanding that GPCD data cannot be equally compared among all urban water suppliers unless all relevant factors are taken into account.  In our case, we feel strongly that seasonal population is a very relevant factor and we have attempted to provide population data representative and telling of our seasonal population changes.  One last note, our GPCD calculation may vary slightly from the States calculated GPCD due to differences in the number of days in our meter read period versus the calendar month.  In some cases, we have normalized Total Monthly Production data due to significantly higher or lower meter read days as compared to calendar days in a month.  ",4389,62.7,,"TCPUD Board of Directors adopted Drought Response Stage 2 from TCPUD Ordinance 264 on July 25, 2014.",-99999,NULL,12740161,13115882,62.7,0.648,No Correction,North Lahontan,64.5
14-Nov,11/01/2014 00:00,Calexico  City of,2,Yes,147.01,134.44,MG,,40516,87.58,,,-99999,NULL,147010000,134440000,84.7,0.7,No Correction,Colorado River,77.4
14-Nov,11/01/2014 00:00,Lompoc  City of,Stage 1,Yes,111.2,138.0,MG,Utility and Sales report ; ending 10/20/14,39661,64.5,,,-99999,NULL,111200000,138000000,64.5,0.69,No Correction,Central Coast,80.0
14-Nov,11/01/2014 00:00,California Water Service Company Bakersfield,2,Yes,3934.0,4991.0,AF,,276904,97.0,,,-99999,NULL,1281899514,1626324472,97.2,0.63,No Correction,Tulare Lake,123.3
14-Nov,11/01/2014 00:00,Amador Water Agency,2,Yes,55.29,69.69,MG,,23347,52.0,"Violations: 1- Verbal warning, 2. Written warning, 3. Water restrictor for 1 week, 4. Water restrictor for remainder of drought",,-99999,NULL,55290000,69690000,52.1,0.66,No Correction,San Joaquin River,65.7
14-Nov,11/01/2014 00:00,California Water Service Company Oroville,2,Yes,126.0,180.0,AF,,11196,48.0,,,-99999,NULL,41057280,58653257,47.7,0.39,No Correction,Sacramento River,68.1
14-Nov,11/01/2014 00:00,Trabuco Canyon Water District,1,Yes,231.0,215.0,AF,Commercial Ag used 20 AF,13175,126.0,,,81,AF,75271680,70058057,125.7,0.66,No Correction,South Coast,117.0
14-Nov,11/01/2014 00:00,Otay Water District,2,Yes,2434.4,2377.2,AF,The residential GPCD changed because the original usage number failed to include a classification of customers called Master-Meter.  This classification includes condos and apartments.,217600,81.6,,,-99999,NULL,793252714,774614012,81.4,0.67,No Correction,South Coast,79.5
14-Nov,11/01/2014 00:00,San Diego  City of,Level 2 Mandatory and Permanent Mandatory Restrict,Yes,14298.0,14391.0,AF,"Residential use was estimated by looking at metered consumption of single-family residential accounts, multi-family residential accounts, and residential irrigation accounts for FY 2014, and dividing it by total water produced in FY 2014.",1292496,64.5,"The City of City Diego implemented Drought Response Level 2 (Drought Alert) beginning November 1, 2014.  On top of permanent water use restrictions already in place, Level 2 assigned mandatory watering days and length of sprinkler run times among other restrictions.  In November, the City received a total of 773 initial water waste complaints, down slightly from 831 initial complaints in October but still higher than the 300 average in prior months.  Of that total amount, 277 were reported through the new smartphone app.  Runoff complaints (131) were handled by the Citys Storm Water Program handled.  No fines or citations have been issued so far, citizens are cooperating.","November 2014 is the citys second warmest November on record, as reported by the San Diego Union-Tribune on December 3, 2014. The average temperature for the month was 65.6 degrees which was 4.3 degrees warmer than normal.  November 2014 was San Diegos 13th straight warmer-than-normal month.  Also, in anticipation of any rain, messages are sent out to turn off irrigation systems and let the rain do the watering.",1438,AF,4659023703,4689327886,64.5,0.537,No Correction,South Coast,64.9
14-Nov,11/01/2014 00:00,Truckee-Donner Public Utilities District,2,Yes,70046200.0,71190400.0,G,Total Population Served has been calculated using the California Department of Finance published numbers and the 2010 Census data for the Town of Truckee: number of housing units multiplied by the persons per household.,32776,59.0,,,-99999,NULL,70046200,71190400,59.1,0.83,No Correction,North Lahontan,60.1
14-Nov,11/01/2014 00:00,"Modesto, City of",Stage 1,Yes,1055075403.0,1302876190.0,G,,217269,105.0,,,-99999,NULL,1055075403,1302876190,108.5,0.67,No Correction,San Joaquin River,133.9
14-Nov,11/01/2014 00:00,Joshua Basin Water District,Stage 1 (Ordinance No. 14-8) ,Yes,91.517,100.258,AF,"Total Population Served: This was determined by the Districts consultant Kennedy/Jenks in the 2010 Urban Water Management Plan.  Percent of Residential Use: This was determined by taking billing data as a percentage of total monthly production.  Note: Previous methodology took residential billing data as a percentage of total deliveries.     Metered Deliveries:  Approximately 80 accounts were improperly categorized in the billing software, many of which were designated as residential users. ",9514,99.794,,,-99999,NULL,29820945,32669212,99.8,0.95514,No Correction,Colorado River,109.3
14-Nov,11/01/2014 00:00,Santa Barbara  City of,Stage 2,Yes,861.94,1093.27,AF,"Approximately 15 AF for the City's November 2014 monthly production was sold to agricultural customers.  The City has updated its Total Monthly Potable Production (TMPP) numbers, both for the baseline year of 2013 and the reporting years 2014 and 2015 to include potable water blended with recycled water to improve water quality for recycled water customers. This change has been made in response to the conference call on May 12, 2015, regarding the Emergency Conservation Regulations in which it was explained this use of potable water should be included in the TMPP calculation. While these changes may drop the City from Tier 4 to Tier 3 and reduce our State mandated conservation standard, Stage 3 Drought Regulations adopted by Santa Barbara City Council on May 5, 2015, established a conservation target of 25% based on the Citys water supply needs. The City has maintained an average reduction of 21% since the enactment of Stage 2 Drought Regulations and plans to meet the 25% target under Stage 3.",92756,72.6,"The City enacted a Stage 2 Drought on May 20, 2014. Details, including the mandatory water conservation regulations, can be found here: http://www.santabarbaraca.gov/gov/depts/pw/resources/system/docs/stage2restrictions.asp ",,-99999,NULL,280864379,356243590,72.7,0.72,No Correction,Central Coast,92.2
14-Nov,11/01/2014 00:00,Tuolumne Utilities District,Phase II of IV,Yes,267.3,358.3,AF,,28997,81.0,,,-99999,NULL,87100086,116752566,81.7,0.816,No Correction,San Joaquin River,109.5
14-Nov,11/01/2014 00:00,Sacramento County Water Agency,2,Yes,1994.0,2689.0,AF,The average of October and November numbers were used in calculating percent residential use for Nov 2013 due to an imbalance related to our bimonthly billing during this time in 2013.,162301,93.0,,,-99999,NULL,649747745,876214487,93.4,0.7,No Correction,Sacramento River,126.0
14-Nov,11/01/2014 00:00,San Buenaventura  City of,stage 3,Yes,1200.0,1396.0,AF,,113478,72.52,,,108.55,AF,391021712,454888592,72.5,0.6314,No Correction,South Coast,84.4
14-Nov,11/01/2014 00:00,Elk Grove Water Service,1,Yes,130707345.0,178691519.0,G,,44099,82.0,,,-99999,NULL,130707345,178691519,82.0,0.83,No Correction,Sacramento River,112.1
14-Nov,11/01/2014 00:00,Newhall County Water District,1b,Yes,675.15,710.5,AF,Our prior submission had 2 main errors: 1.  Residential % was calculated incorrectly.  Residential sales was compared to total production instead of total sales. 2.  Our population was incorrect.  We recently commissioned Maddaus Water Management Inc to conduct a demand study and included a revised population calculation.,45036,119.0,,,-99999,NULL,219998591,231517439,118.9,0.73,No Correction,South Coast,125.1
14-Nov,11/01/2014 00:00,Valencia Water Company,Stage 1B,Yes,1879.75,2055.56,AF,,117251,81.59,,,23.41,AF,612519220,669807159,81.6,0.4686,No Correction,South Coast,89.2
14-Nov,11/01/2014 00:00,Castaic Lake Water Agency Santa Clarita Water Division,1B,Yes,1773.0,1987.0,AF,,119650,111.0,"In November 2014, we issued 35 warning/violation notices for the proohibited activities stated in the SWRCB Resolution 2014-0038.",,-99999,NULL,577734580,647466785,111.1,0.69,No Correction,South Coast,124.5
14-Nov,11/01/2014 00:00,California Water Service Company East Los Angeles,2,Yes,1207.0,1290.0,AF,,159649,43.0,,,-99999,NULL,393302672,420348341,42.7,0.52,No Correction,South Coast,45.6
14-Nov,11/01/2014 00:00,Exeter  City of,2,Yes,39342100.0,48889900.0,G,,10334,122.8082059,,,-99999,NULL,39342100,48889900,107.9,0.85,No Correction,Tulare Lake,134.0
14-Nov,11/01/2014 00:00,"Rio Vista, city of",Stage 1,Yes,50935000.0,60047000.0,G,,8324,204.0,,,-99999,NULL,50935000,60047000,142.8,0.7,No Correction,Sacramento River,168.3
14-Nov,11/01/2014 00:00,Sweetwater Springs Water District,1,Yes,49.1,59.0,AF,The message is getting more difficult with the flooding we are experiencing.  ,7702,57.4,,,-99999,NULL,15999305,19225234,57.5,0.83,No Correction,North Coast,69.1
14-Nov,11/01/2014 00:00,California Water Service Company Visalia,2,Yes,1779.0,2195.0,AF,,136875,98.0,,,-99999,NULL,579689689,715243882,97.4,0.69,No Correction,Tulare Lake,120.2
14-Nov,11/01/2014 00:00,California Water Service Company Selma,2,Yes,286.0,372.0,AF,,24590,91.0,,,-99999,NULL,93193508,121216731,91.0,0.72,No Correction,Tulare Lake,118.3
14-Nov,11/01/2014 00:00,California Water Service Company Chico District,2,Yes,1212.0,1725.0,AF,,100926,94.0,,,-99999,NULL,394931930,562093712,93.9,0.72,No Correction,Sacramento River,133.7
14-Nov,11/01/2014 00:00,Soquel Creek Water District,3,Yes,75.601,99.957,MG,"Percent residential use and R-GPCD is calculated assuming an unmetered water use and water loss rate (non-revenue water) of 8.4%.  5/27/15 changes include increasing the population based on SWRCB guidance, increasing the residential consumption by adding residential irrigation accounts, and decreasing residential consumption by removing fire service accounts. ",39034,48.4,,,-99999,NULL,75601000,99957000,48.4,0.75,No Correction,Central Coast,64.0
14-Nov,11/01/2014 00:00,East Valley Water District,stage 2,No,83222.57,88600.0,CCF,corrected data from billiing/meter/Scada systems,29143,62.0,,,0,CCF,62254806,66277403,64.1,0.9,No Correction,South Coast,68.2
14-Nov,11/01/2014 00:00,California Water Service Company Bear Gulch,2,Yes,729.0,968.0,AF,,58707,119.0,,,-99999,NULL,237545690,315424181,118.7,0.88,No Correction,San Francisco Bay,157.6
14-Nov,11/01/2014 00:00,Buena Park  City of,Phase 1,Yes,1007.0,1148.0,AF,"In response to the Governor Browns emergency drought declaration Buena Park evaluated the city wide water usage. In keeping with the Governors focus on reducing water usage on outdoor irrigation we decided to include water usage from institutional irrigation metering in the R-GPD calculation.   Buena Park reported residential usage at 65%, which included the institutional irrigation usage. Buena Parks actual residential water use percentage as reported on the Department of Water Resources Form 38, for calendar year 2014, was 58.5%. Monthly drought reporting is being amended to reflect residential usage at 58.5%.  ",82364,78.0,,,-99999,NULL,328132387,374077438,77.7,0.585,No Correction,South Coast,88.6
14-Nov,11/01/2014 00:00,South Gate  City of,Permanent,Yes,677.77,670.96,AF,,102832,64.0,,,-99999,NULL,220852322,218633273,64.4,0.9,No Correction,South Coast,63.8
14-Nov,11/01/2014 00:00,Hillsborough  Town of,1,No,44495.0,95392.0,CCF,See June 2014 Notes,10825,93.0,"The Town continued enforcement, including verbal and written warnings",Continued Implementation,-99999,NULL,33284571,71358171,90.2,0.88,No Correction,San Francisco Bay,193.4
14-Nov,11/01/2014 00:00,"California Water Service Company Dixon, City of",2,Yes,92.0,112.0,AF,,9803,84.0,,,-99999,NULL,29978331,36495360,83.6,0.82,No Correction,Sacramento River,101.8
14-Nov,11/01/2014 00:00,Redlands  City of,Stage 2,Yes,2128.9,1934.8,AF,,77852,222.76,,,-99999,NULL,693705103,630457341,222.8,0.75,No Correction,South Coast,202.5
14-Nov,11/01/2014 00:00,San Juan Water District,Stage 3,Yes,509.0,850.0,AF,,32593,161.0,"As reported to SWRCB staff, the incorrect multiplier was used and has been corrected.",,-99999,NULL,165858376,276973713,161.1,0.95,No Correction,Sacramento River,269.1
14-Nov,11/01/2014 00:00,California Water Service Company Dominguez,2,Yes,2489.0,2732.0,AF,,142272,75.0,,,-99999,NULL,811044202,890226099,76.0,0.4,No Correction,South Coast,83.4
14-Nov,11/01/2014 00:00,Hayward  City of,Stage 1,Yes,543049.0,561230.0,CCF,,151037,52.0,,,-99999,NULL,406228862,419829195,52.0,0.58,No Correction,San Francisco Bay,53.7
14-Nov,11/01/2014 00:00,California Water Service Company Hermosa/Redondo,2,Yes,984.0,993.0,AF,,95612,82.0,,,-99999,NULL,320637804,323570467,82.7,0.74,No Correction,South Coast,83.5
14-Nov,11/01/2014 00:00,California Water Service Company King City,2,Yes,113.0,143.0,AF,,14750,42.0,,,-99999,NULL,36821211,46596754,41.6,0.5,No Correction,Central Coast,52.7
14-Nov,11/01/2014 00:00,Yucaipa Valley Water District,Mandatory Stage,Yes,282.4,251.6,MG,"During the last half of October 2014 and the entire month of November 2014, the Yucaipa Valley Water District provided water for irrigation use from groundwater sources due to a planned outage of the recycled water system.  The recycled water system was placed back into service with recycled water on December 15, 2014.  The Percentage of Residential Use is calculated based on the amount of residential consumption and not the number of active service connections.",44896,173.0,,,-99999,NULL,282400000,251600000,182.4,0.87,No Correction,South Coast,162.5
14-Nov,11/01/2014 00:00,San Bernardino  City of,2,Yes,3106.513,3091.886,AF,"Revised to include wholesale delivery to another agency and to update population estimate to match Urban Water Master Plan submitted in 2012.  Does not revise conservation tier.  City of San Bernardino still required to achieve 28% reduction per approved emergency regulations.  Revised average July, August and September 2014 R-GPCD is 131.05.",196704,114.09,,,-99999,NULL,1012261694,1007495465,114.1,0.6651,No Correction,South Coast,113.6
14-Nov,11/01/2014 00:00,Sacramento  City of,2,Yes,1912.0,2409.0,MG,"The City of Sacramento is only partially metered (approx 51%). Therefore, the residential consumption percentage is an estimation derived from calculations and assumptions of actual metered residential use. ",466488,73.0,"Ongoing enforcement continues with weekly patrols to enforce outdoor watering restrictions, which at present are limited to one day per week.",,-99999,NULL,1912000000,2409000000,73.8,0.54,No Correction,Sacramento River,93.0
14-Nov,11/01/2014 00:00,California Water Service Company Kern River Valley,2,Yes,54.0,54.0,AF,,5424,95.0,,,-99999,NULL,17595977,17595977,95.2,0.88,No Correction,Tulare Lake,95.2
14-Nov,11/01/2014 00:00,California Water Service Company Los Altos/Suburban,2,Yes,784.0,1027.0,AF,,68163,98.0,,,-99999,NULL,255467519,334649416,97.4,0.78,No Correction,San Francisco Bay,127.6
14-Nov,11/01/2014 00:00,Hanford  City of,,Yes,225915600.0,266556300.0,G,This change reflects the actual population served and corrected residential consumption percentages. ,57050,110.0,,,-99999,NULL,225915600,266556300,110.4,0.8367,No Correction,Tulare Lake,130.3
14-Nov,11/01/2014 00:00,California Water Service Company Livermore,2,Yes,557.0,732.0,AF,,57088,79.0,,,-99999,NULL,181499245,238523245,79.5,0.75,No Correction,San Francisco Bay,104.5
14-Nov,11/01/2014 00:00,West Kern Water District,2,Yes,1147.81,1333.54,AF,,21181,75.43,,,-99999,NULL,374015526,434535912,75.3,0.128,No Correction,Tulare Lake,87.5
14-Nov,11/01/2014 00:00,Paso Robles  City of,2,Yes,127.803,157.126,MG,,30450,89.1,,We implemented mandatory restrictions in 2009 due to water shortage issues. Consideration was given to cancel these restrictions; however we have left them in place to answer the Governor's call for conservation. It should be noted that we have already achieved a 22% reduction from Nov 2008 vs. Nov 2014,-99999,NULL,127803000,157126000,92.1,0.6579999999999999,No Correction,Central Coast,113.2
14-Nov,11/01/2014 00:00,Pismo Beach  City of,3rd,Yes,136.57,164.85,AF,This takes into account short term rentals ie day or weekly rentals,7705,88.6,Certified letter for first time offenders,,-99999,NULL,44501529,53716608,88.6,0.46,No Correction,Central Coast,106.9
14-Nov,11/01/2014 00:00,California Water Service Company Marysville,2,Yes,116.0,152.0,AF,,12099,68.0,,,-99999,NULL,37798766,49529417,67.7,0.65,No Correction,Sacramento River,88.7
14-Nov,11/01/2014 00:00,Madera  City of,3,Yes,207.217,252.689,MG,This Report has been revised to reflect updated production totals with water sold to Madera county MD19A&MD19B removed.  It also includes updated population data from the Department of Finance,63008,93.0,,,-99999,NULL,207217000,252689000,93.2,0.85,No Correction,San Joaquin River,113.6
14-Nov,11/01/2014 00:00,Hemet  City of,Voluntary 20%,No,300.88,296.68,AF,,23537,104.0,,,-99999,AF,98042177,96673601,138.8,1.0,No Correction,South Coast,136.9
14-Nov,11/01/2014 00:00,California Water Service Company Mid Peninsula,2,Yes,999.0,1214.0,AF,,135308,59.0,,,-99999,NULL,325525576,395583632,58.5,0.73,No Correction,San Francisco Bay,71.1
14-Nov,11/01/2014 00:00,California Water Service Company Palos Verdes,2,Yes,1544.0,1586.0,AF,,69857,199.0,,,-99999,NULL,503114603,516800363,199.3,0.83,No Correction,South Coast,204.7
14-Nov,11/01/2014 00:00,"Colton, City of",2,Yes,724.4,721.5,AF,"When annual productions numbers are reported, the percent of residential customers is reported, not the actual percent of residential use. Upon reviewing actual figures for this month, it was determined that actual residential usage was 53.9%. Also, more accurate population figures were obtained. ",47612,89.24,,,-99999,NULL,236046774,235101805,89.2,0.54,No Correction,South Coast,88.9
14-Nov,11/01/2014 00:00,California Water Service Company Redwood Valley,2,Yes,22.0,26.0,AF,,3576,60.0,,,-99999,NULL,7168731,8472137,59.5,0.89,No Correction,North Coast,70.3
14-Nov,11/01/2014 00:00,Brea  City of,1,Yes,752.0,803.0,AF,,42397,123.0,Education and Administrative citations when non compliant with Phase 1 regulations of Water Ordinance 1123,Rebates Leak Surveys Educational Literature Participate in Public Outreach Events,0,AF,245040273,261658696,123.3,0.64,No Correction,South Coast,131.7
14-Nov,11/01/2014 00:00,California Water Service Company Salinas District,2,Yes,1119.0,1264.0,AF,,120583,70.0,,,-99999,NULL,364627747,411876204,69.5,0.69,No Correction,Central Coast,78.6
14-Nov,11/01/2014 00:00,Wasco  City of,2,Yes,80.39,90.75,MG,,19511,130.16,,,-99999,G,80390000,90750000,130.5,0.95,No Correction,Tulare Lake,147.3
14-Nov,11/01/2014 00:00,California Water Service Company South San Francisco,2,Yes,555.0,661.0,AF,,60679,40.0,,,-99999,NULL,180847542,215387793,40.7,0.41,No Correction,San Francisco Bay,48.5
14-Nov,11/01/2014 00:00,"Tulare, City of",Stage 2,,358.4,442.8,MG,,59535,100.0,,,-99999,NULL,358400000,442800000,100.3,0.5,No Correction,Tulare Lake,124.0
14-Nov,11/01/2014 00:00,California Water Service Company Stockton,2,Yes,1728.0,1895.0,AF,,170167,61.0,,,-99999,NULL,563071266,617488454,60.7,0.55,No Correction,San Joaquin River,66.5
14-Nov,11/01/2014 00:00,California Water Service Company Willows,2,Yes,73.0,92.0,AF,,7071,82.0,,,-99999,NULL,23787154,29978331,81.9,0.73,No Correction,Sacramento River,103.2
