Reporting_Month,Timestamp,Supplier_Name,Stage_Invoked,Mandatory_Restrictions,Total_Monthly_Potable_Water_Production_2014_2015,Total_Monthly_Potable_Water_Production_2013,Units,Qualification,Total_Population_Served,REPORTED_Residential_Gallons_per_Capita_Day,Optional_Enforcement_Actions,Optional_Implementation,Optional_Recycled_Water,Recycled_Water_Units,CALCULATED_Production_Monthly_Gallons_Month_2014_2015,CALCULATED_R_GPCD_2014_2015,Percent_Residential_Use,Comments_Corrections,Hydrologic_Region,CALCULATED_R_GPCD_2013
15-Nov,11/01/2015  00:00:00,Benicia  City of,Stage 3 (Modified),Yes,245.7,438.5,AF,,28086,51,,,,AF,"16,325,156", 51.3 ,54,No Correction,San Francisco Bay,
15-Nov,11/01/2015  00:00:00,Westborough Water District,Stage 2,Yes,27091,35909,CCF,,14050,47.36,,,0,CCF,"300,717", 47.4 ,98.51,No Correction,San Francisco Bay,
15-Nov,11/01/2015  00:00:00,Woodland  City of,Stage 2 - Water Warning,Yes,179828548,235960100,G,"Percentage residential use includes single-family indoor and landscape use as well as multi-family indoor use.  However, we are unable to include multi-family landscape use in this calculation. All landscape meters in Woodland are on the same fee schedule. Because of this, multi-family landscape use is not distinguished from commercial landscape use in our data collection. Therefore, multi-family landscape use currently cannot be separated from commercial landscape use.",57223,72.4,,,0,G,"68,462,304", 72.8 ,69.48,No Correction,Sacramento River,
15-Nov,11/01/2015  00:00:00,Mountain View  City of,2,Yes,533,848,AF,"Clarification-While we increased staff in May 2015 by .5 FTE, in November an existing conservation staff member has transferred to a different unit.  The new staff hired in May 2015 has replaced the FTE  but there is a temporary  net .50 FTE reduction dedicated to conservation.",76210,41.8,,,,AF,Null, 41.8 ,55,No Correction,San Francisco Bay,
15-Nov,11/01/2015  00:00:00,Mammoth Community Water District,3,Yes,28.409,27.982,MG,"Population is reported as Effective Population from MCWD - 2010 Urban Water Management Plan (UWMP). Effective Population accounts for the visitor base and resulting effect on water usage. Basis of calculation is reported in the 2010 UWMP. Maximum People At One Time (PAOT) in the service area is estimated by the Town of Mammoth Lakes to be 36,578 people. Permanent resident population is 8,073.  ",16739,34,,,,MG,Null, 33.9 ,60,No Correction,South Lahontan,
15-Nov,11/01/2015  00:00:00,Antioch  City of,Stage 3,Yes,289.364,420.137,MG,,108298,80,,,,MG,"41,371,000", 80.2 ,90,No Correction,San Joaquin River,
15-Nov,11/01/2015  00:00:00,Estero Municipal Improvement District,1,Yes,108628,137795,CCF,,37165,45.3,,,0,CCF,"52,474,348", 42.3 ,58,No Correction,San Francisco Bay,
15-Nov,11/01/2015  00:00:00,East Orange County Water District,Level 2,Yes,56.9,71.3,AF,"EOCWD's monthly water production for November was 56.9 acre feet.   1.3 acre feet was non-residential use (restaurant, school, park) which is determined by taking monthly reads of these specific meters.   Approximately 0.1 acre feet was from IPR.  Therefore, our adjusted Total Monthly Production - IPR is 56.8 acre feet.  Our adjusted GPCD - IPR is 190.   Our agency had minimal IPR due to the purchase of treated import water.",3247,190.3,"Our agency reads customer meters bi-monthly and in the prior month (October), we issued 10 fines and 64 warnings.  During November, we continued to follow-up with non-responsive customers by reaching out through phone calls, door tags, and letters.",Our agency sent out billing stuffers to all of our customers notifying them that watering days were reduced to once per week.  We also installed 4 large drought signs at key locations in our distribution system which display our target conservation goal of 36% as well as an arrow indicator of our current conservation percentage achieved.  Our staff also set door hangers notifying all of our customers of the once per week watering day.  The door hangers also had helpful tips on ways to reduce water use.   ,0,AF,"423,607", 186.5 ,98,No Correction,South Coast,
15-Nov,11/01/2015  00:00:00,Triunfo Sanitation District / Oak Park Water Service,2,Yes,155,204.2,AF,,12200,122.8,4 water audits 40 conservation phone calls,"Wholesale supplier, Calleguas Municipal Water District (CMWD) institutes Res. No. 1865, which declares a Stage 4 shortage and implements a water supply allocation program (reporting watch began July 2015).  Member agencies to Metropolitan Water District of Southern CA (e.g. CMWD) are under an April 14, 2015 declaration of a regional shortage, level 3 [effective July 1, 2015] which may include surcharges for exceeded water supply allocations.",57.8,AF,"1,010,139", 122.8 ,89,No Correction,South Coast,
15-Nov,11/01/2015  00:00:00,Vallecitos Water District,Level II,Yes,916.4,1187.5,AF,,96020,63.4,,,,AF,"29,131,118", 65.5 ,63.2,No Correction,South Coast,
15-Nov,11/01/2015  00:00:00,Indio  City of,II,Yes,455.5,572.6,MG,,88411,123.6,,,,MG,Null, 123.6 ,72,No Correction,Colorado River,
15-Nov,11/01/2015  00:00:00,Sunnyvale  City of,"Stage 1, 30% Reduction",Yes,1103,1557,AF,,148028,50.26,$250 Third Violation $500 Four or more violations,,12.25,AF,"122,194,285", 50.3 ,62.11,No Correction,San Francisco Bay,
15-Nov,11/01/2015  00:00:00,Santa Cruz  City of,Stage 3 Water Shortage Emergency,No,183.7,259.2,MG,"The reported R-GPCD excludes an estimated 8,500 people from the estimated total population served because they reside at the UC Santa Cruz campus, which is classified as a CII (non-residential) customer. Percent residential use includes consumption on dedicated irrigation accounts which are classified separately from residential customers but are associated with and serve large residential complexes, such as apartments and home-owner associations.    ",95224,37.8,"The City of Santa Cruz lifted water rationing for residential and irrigation customers effective November 1, 2015. Certain outdoor water restrictions remain in effect at all times. The Water Department has shifted away from most mandatory curtailment measures and has moved towards requesting voluntary water use curtailment. Utility bills continue to show rationing allotments as an informational tool, but penalties have been lifted. The Water Department will continue to respond appropriately and follow up on reports of water waste. ",,,MG,"69,000,000", 34.5 ,53.6,No Correction,Central Coast,
15-Nov,11/01/2015  00:00:00,Fortuna  City of,2,Yes,29.2,32.3,MG,,12032,64.7,,,,MG,Null, 64.7 ,80,No Correction,North Coast,
15-Nov,11/01/2015  00:00:00,Clovis  City of,2,Yes,349.215,546.3077,MG,Residential and industrial/commercial percentages are estimated because customers are only billed every two months.,108227,91.54,,"The City implemented the emergency regulations in May 2015, one month early and saved an additional 347.17 million gallons.",,MG,"52,000,000", 91.5 ,85.1,No Correction,Tulare Lake,
15-Nov,11/01/2015  00:00:00,East Niles Community Service District,3,Yes,437,619,AF,,31772,131,,,,AF,"26,068,114", 131.5 ,88,No Correction,Tulare Lake,
15-Nov,11/01/2015  00:00:00,Loma Linda  City of *,2,Yes,334.19,391.18,AF,,23614,109,,,0,AF,"18,208,578", 109.1 ,71,No Correction,South Coast,
15-Nov,11/01/2015  00:00:00,Eastern Municipal Water District,4B,Yes,5483,5969,AF,Month by month comparisons do not adequately reflect changes in weather or account for new connections.  November 2015 received less precipitation than November 2013.,544588,85,"EMWD relies on allocation based tiered rates as its primary tool to discourage water waste and encourage efficiency.  Outdoor demand has decreased 30% since the allocation based rate structure was implemented.  In November of 2015, 21,429 customers exceeded their water budgets and paid for water at the excessive or wasteful rate.  Stage 4 of our Water Shortage Contingency Plan eliminates the excessive rate and reduces the outdoor water allocations.  Customers using water over their revised budget will pay the highest wasteful rate for water. EMWD also imposes fines for runoff.  Residential fines start at $25 and commercial start at $100.  ",EMWD is currently in Stage 4b of its  Water Shortage Contingency Plan.  Outreach has focused on reducing outdoor water use by 50%.  EMWD added a dedicated phone extension to report water waste.  Hundreds of complaints of water waste have been investigated this year.  Violators receive a warning letter and then fines are assessed for runoff.,,AF,"267,849,873", 85.3 ,78,No Correction,South Coast,
15-Nov,11/01/2015  00:00:00,Martinez  City of,2,Yes,111871,157556,CCF,,35375,61,,,0,CCF,"11,329,247", 52.8 ,67,No Correction,San Francisco Bay,
15-Nov,11/01/2015  00:00:00,El Monte  City of,IV,Yes,51.871,58.306,MG,CII Use and Percent Residential Use are estimated until actual numbers are available at the end of January due to bi-monthly billing. ,22968,46,,,,MG,"18,000,000", 45.9 ,61,No Correction,South Coast,
15-Nov,11/01/2015  00:00:00,Marina Coast Water District,Stage 3,Yes,217.52,330.21,AF,Revised report: Corrected % residential use.,32375,55.44,,,,AF,"12,864,614", 55.4 ,75.97,No Correction,Central Coast,
15-Nov,11/01/2015  00:00:00,Vacaville  City of,3,Yes,844,1206,AF,,86893,98.11,The number of actions for the month were low due to both getting our staffing replaced as well as  significantly reduced activity and reports received.,,0,AF,"19,225,234", 92.8 ,88,No Correction,Sacramento River,
15-Nov,11/01/2015  00:00:00,Pittsburg  City of,II,Yes,189.89,235.8,MG,,66183,65.3,,,,MG,"62,200,000", 64.1 ,67,No Correction,San Francisco Bay,
15-Nov,11/01/2015  00:00:00,San Bruno  City of,2,Yes,110710,151675,CCF,,44409,45,,,0,CCF,"15,049,309", 46.0 ,74,No Correction,San Francisco Bay,
15-Nov,11/01/2015  00:00:00,"American Canyon, City of",stage 2 ,Yes,175,259,AF,,20080,45,,,5,AF,"19,551,086", 54.9 ,58,No Correction,San Francisco Bay,
15-Nov,11/01/2015  00:00:00,Oildale Mutual Water Company,stage 2,Yes,465,641,AF,,33163,115.23,,,,AF,"36,821,211", 115.3 ,75.7,No Correction,Tulare Lake,
15-Nov,11/01/2015  00:00:00,Livermore  City of Division of Water Resources,Stage 2,Yes,91.502,144.768,MG,,27588,62,,,,MG,"47,902,000", 61.9 ,56,No Correction,San Francisco Bay,
15-Nov,11/01/2015  00:00:00,Gilroy  City of,2,Yes,145.013,205.91,MG,,53626,59,,,,MG,"29,283,000", 58.6 ,65,No Correction,Central Coast,
15-Nov,11/01/2015  00:00:00,Crescenta Valley Water District,Orangw,Yes,289.1,367.76,AF,The estimate of the percentage of water use by any classification is based on a annual average as the District bills bi-monthly.,31966,98.23,,most program changes were completed prior to April  of 2015.,0,AF,"11,303,786", 86.4 ,88,No Correction,South Coast,
15-Nov,11/01/2015  00:00:00,Downey  City of,Restrict Use,Yes,1088.65,1376.55,AF,,111931,78.91,,,44.4,AF,"89,749,259", 78.9 ,74.7,No Correction,South Coast,
15-Nov,11/01/2015  00:00:00,San Gabriel Valley Water Company,CPUC 14.1 Stage 2,Yes,2376,2760,AF,,271817,57.4,,,158.75,AF,"250,631,884", 57.3 ,60.4,No Correction,South Coast,
15-Nov,11/01/2015  00:00:00,Santa Clara  City of,3,Yes,368,524.7,MG,R-GPCD: Residential Sales / Population / Days in month. Based on sales data Residential sales: 203.6 MG Population: 120973(updated with Dept. of Finance data) Days in November: 30   ,120973,56.1,,,78.4,MG,"226,300,000", 48.0 ,47.3,No Correction,San Francisco Bay,
15-Nov,11/01/2015  00:00:00,Paradise Irrigation District,2,Yes,95600000,117400000,G,,26032,106,,,,G,"7,648,000", 106.5 ,87,No Correction,Sacramento River,
15-Nov,11/01/2015  00:00:00,Scotts Valley Water District,2,Yes,24110286,34868300,G,"24,110,286 x.70= 16,877'200 res. gal used ÷10509 people= 1606 gal.per person ÷ 30 days= 53GPCD for November 2015.  Single family 58%, Multi family 6%, Residential irrigation 6% = 70% of production demand. Commercial 22%, Comm. landscape 1% Unaccounted WL 7% ",10509,53,N/A,,2817778,G,"5,304,262", 53.5 ,70,No Correction,Central Coast,
15-Nov,11/01/2015  00:00:00,Lincoln  City of,Stage Two,Yes,145.292,224.6,MG,The City of Lincoln is actively involved in the Regional Water Authority's outreach and marketing program for water conservation. The region also recently teamed up with Save our Water for increased programming and outreach materials.  ,45837,84.315,,,0.014,MG,"21,604,000", 84.3 ,79.8,No Correction,Sacramento River,
15-Nov,11/01/2015  00:00:00,Vaughn Water Company,2,Yes,200549053,267169479,G,"Our (R-GPCD) for the month of November 2015 is calculated as follows. 10,298 total connections in Nov. 2015 x 3.01people per connection= a population of 30,997. 96% of the 200,549,053 gallons produced = 192,527,091 gallons used by residential customers. 192,527,091 gallons used by residential customers in Nov. 2015/30,997/30 days = 207.00 (R-GPCD).",30997,207,"All (54) complaints were investigated as they came in the same day. Some of those complaints were possible leaks or broken sprinklers. Of those (54) complaints (51) wasting water notifications were issued to the residences. Those notifications were due to overwatering, watering on Mondays or watering on the wrong days.",,,G,"8,021,962", 207.0 ,96,No Correction,Tulare Lake,
15-Nov,11/01/2015  00:00:00,McKinleyville Community Service District,2,Yes,28.939,34.879,MG,Our customers are metered. Residential info is gathered using 30 day billing cycle.  Recycled water is water used by customers and sent down the drains to the sewer system. Water is then treated and used to irrigate fields for hay crop instead of farmers using wells to irrigate.,16900,52,,,9.653,MG,"2,933,000", 52.5 ,92,No Correction,North Coast,
15-Nov,11/01/2015  00:00:00,Cambria Community Services District,stage 3,Yes,37.31,54.22,AF,estimate ,6032,36.95,0,,,AF,"4,281,688", 37.0 ,55,No Correction,Central Coast,
15-Nov,11/01/2015  00:00:00,Montebello Land and Water Company,2,Yes,240.79,274.56,AF,,32219,64.95,,,,AF,Null, 64.9 ,80,No Correction,South Coast,
15-Nov,11/01/2015  00:00:00,Humboldt Community Service District,1,Yes,58986000,61434000,G,,20032,58.9,,,,G,"6,488,460", 58.9 ,60,No Correction,North Coast,
15-Nov,11/01/2015  00:00:00,Rohnert Park  City of,One,Yes,105.9,115,MG,,43398,71.9,,,5.1,MG,"17,900,000", 71.9 ,88.4,No Correction,North Coast,
15-Nov,11/01/2015  00:00:00,Valley of the Moon Water District,2,Yes,153,227.1,AF,,23478,71,,,0,AF,"4,496,750", 70.8 ,100,No Correction,San Francisco Bay,
15-Nov,11/01/2015  00:00:00,Bellflower-Somerset Mutual Water Company,stage 1,Yes,365.24,426.79,AF,,46300,85.68,,,,AF,"16,660,783", 73.7 ,86,No Correction,South Coast,
15-Nov,11/01/2015  00:00:00,Port Hueneme  City of,2,Yes,150.75,176.35,AF,,21555,64,,,,AF,"4,177,415", 63.9 ,84.18,No Correction,South Coast,
15-Nov,11/01/2015  00:00:00,Petaluma  City of,Stage 2,Yes,237779,319290,CCF,,61798,57.89,,,,CCF,"85,675,138", 57.9 ,60.34,No Correction,San Francisco Bay,
15-Nov,11/01/2015  00:00:00,Eureka  City of,3,Yes,74.23,81.865,MG,,26066,53,,,,MG,"31,180,000", 55.1 ,58,No Correction,North Coast,
15-Nov,11/01/2015  00:00:00,Diablo Water District,B,Yes,85.48,131.579,MG,,38194,60.4,"During our daily leak reporting from our smart meter reading system, we notice leaks, over irrigating, excessive use, irrigating more than the 3 days allowed, etc; which we make phone calls on daily and follow up to see if repairs or corrections are made. When we receive outside complaints from residents, we follow up with a phone call or doorhanger since the customer may not be aware of the problem. We have issued several warnings and are keeping track of who has received formal warnings for possible future violation penalties. We have started fining those who have not complied with formal written notices.",,,MG,"6,562,000", 60.4 ,81,No Correction,San Joaquin River,
15-Nov,11/01/2015  00:00:00,El Toro Water District,Level 1,Yes,528.9,684.2,AF,,48628,76.74,"Effective July 1, 2015 imposed an Administrative Penalty of $2.00/ccf on customer's water bill for exceeding their combined indoor and outdoor efficient water budgets.  For the November billing period the District collected $56,248 from imposition of the Penalty.  Since imposition of the Penalty the District has collected $220,090 in Penalty Revenue.  Effective August 1, 2015 the District reduced the indoor GPCD from 60 to 55 and the outdoor water budget by 50%.",The District's recycled water conversion project continues to be implemented aggressively.   Potable water conversions for irrigation account for about 5% of our cumulative potable water reduction when compared to 2013.  Implementation of targeted drought and water conservation messaging continues.,58.3,AF,"24,315,033", 76.8 ,64.97,No Correction,South Coast,
15-Nov,11/01/2015  00:00:00,Brentwood  City of,Stage III,Yes,157.59,260.5,MG,,56493,68.41,,"Additional staff of 3 has allowed the increase in water use evaluations. In November 92 water use evaluations were performed. 903 bill penalties were applied for customers exceeding their goal. Consumption rebates were issued to 11,222 customers who reduced by more than 36% from 2013.",5.007,MG,"23,980,000", 68.4 ,73.57,No Correction,San Joaquin River,
15-Nov,11/01/2015  00:00:00,Fountain Valley  City of,2,Yes,639,770.3,AF,"Since we bill on a two month cycle, the percent of residential use is more accurate over a two month period. We completed the installation of an Advanced Metering Infrastructure system that will provide more accurate monthly billing information on August 25th. The City continues to support the turf removal program along with spray to drip and drought tolerant landscapes. On August 11th, the City launched a Water Portal on our website which allows residents to proactively monitor their usage and make necessary adjustments. Our Indirect Potable Reuse for this month was 190 AF and has not been backed out of our total monthly production amount. ",59227,51,,"Our City Council adopted a water conservation resolution that went into effect June 1, 2015 and includes the following; new outdoor watering restrictions that limit the days and duration of irrigation, does not allow outdoor watering during and within 48 hours of rainfall or any watering that causes runoff. Recommends all new plantings be drought tolerant and forbids washing down paved surfaces; All leaks to be repaired within 3 days; Hotels and motels are required to notify guests they have the option to not launder towels and linens, and restaurants are prohibited from providng drinking water unless requested. The use of temporary fire hydrant meters is prohibited meters is prohibited as is the filling or refilling of pools and spas. The City has turned off the irrigation to 220,000 square feet of median turf. In addition, the City sent out  postcards asking for voluntary cutbacks to 1 day per week watering for winter months. ",190,AF,"24,113,006", 50.4 ,43,No Correction,South Coast,
15-Nov,11/01/2015  00:00:00,Tracy  City of,IV,Yes,877.7006,1230.622,AF,,85296,80.37,,,0,AF,"107,856,822", 80.5 ,72,No Correction,San Joaquin River,
15-Nov,11/01/2015  00:00:00,Menlo Park  City of,2,Yes,77735,120729,CCF,,16066,44.1,,,0,CCF,"26,418,203", 77.7 ,64.4,No Correction,San Francisco Bay,
15-Nov,11/01/2015  00:00:00,Patterson  City of,Stage II,Yes,56945312,94421016,G,"For CII water use, it only includes water use from commercial accounts but the majority of its use comes from our non-potable water distribution system, which is not included in the total production. This again is the reason why total consumption is over total production. This has occurred the last three months as well.",21094,88,,,,G,"8,408,268", 65.7 ,73,No Correction,San Joaquin River,
15-Nov,11/01/2015  00:00:00,Garden Grove  City of,Stage 2,Yes,1820.1,1823.4,AF,"Garden Grove bills bimonthly, therefore, the percent of residential and CII use is more accurate over a two month period. A revised November 2015 report will be submitted once December 2015 billing data is available. ",177020,71.38,"The City received 19 reports for water wasting during the month of November. The City mailed 18 notification letters to each violator describing their water wasting activity. The reason only 18 letters were mailed, instead of 19, is because one house was reported twice during a short window. ","Since April 1, the City has implemented a Stage 2 in its water conservation ordinance, which limits outdoor watering to 3-4 days per week. Effective August 14, outdoor watering will be restricted to 2 days per week. Due to limited field staff, an Environmental Services Specialist and a Water Quality Technician has assisted in reporting and confirmed water wasting activities. ",,AF,"258,152,535", 71.5 ,64,No Correction,South Coast,
15-Nov,11/01/2015  00:00:00,Merced  City of,Stage 2,Yes,344.13,547.27,MG,C.I.I water use is metered and is 20% of total demand on average,83400,99.03,,,0.25,MG,"68,830,000", 99.0 ,72,No Correction,San Joaquin River,
15-Nov,11/01/2015  00:00:00,San Gabriel Valley Fontana Water Company,CPUC 14.1 Stage 2,Yes,2569,3219,AF,,209035,87.3,,,,AF,"245,535,567", 87.3 ,65.4,No Correction,South Coast,
15-Nov,11/01/2015  00:00:00,Hesperia Water District City of,2,Yes,836,984,AF,"Due to billing on a bi-monthly basis, the percentage for residential use is inflated. Any bills that were dated on November 1st would include usage for the months of September and October.",91627,114,The District is continuing to monitor the City on its chosen non-watering days of Tuesdays and Thursdays. 2 employees have been added to monitor theses days along with checking for excessive water run off.,Outdoor irrigation days were reduced in June of this year to only allow for 5 days a week of irrigation. These changes are being monitored by 3 employees assigned to the Water Conservation division.,,AF,"58,979,108", 114.0 ,115,No Correction,South Lahontan,
15-Nov,11/01/2015  00:00:00,Moulton Niguel Water District,2,Yes,1954.2,2129.3,AF,"The ET in November of 2013 was 2.52 inches while the ET in November 2015 was 3.17.  Additionally, there was 1.31 inches of rain in November of 2013 and 0.44 inches of rain in November or 2015.  ",172068,86.2,"The District implemented penalties for water use above the individually calculated water budget starting in July 2015. Additionally, all customers who have recycled water readily available can no longer use potable water.  November 2015 saw the highest percentage of customers staying within their individually calculated water budget of any previous November since the inception of the water budget rate structure in 2011.","The District contacted 90 potable landscape customers who are over their budget representing over 25% of all dedicated landscape accounts in November.  Additionally, the District has a robust marketing strategy by targeting customers with irrigable area greater than 1,000 square feet with relevant conservation action oriented messages.    Messages have focused on only irrigating less than 4 minutes total per week and not irrigating for weeks after a rain event.  The District expanded social media marketing with paid advertisements for conservation actions and rebates in Facebook, Google, and Linkedin.  At the end of November 2015, the District finished running full page advertorials in the Sunday edition of the OC Register for 10 weeks with relevant conservation messages and the promotion of our landscape workshops. The District put conservation messages on hand sanitizer stations in supermarkets throughout the District.  The District is planning an event with its Home Owners Associations in January to provide customer water use reports and information on rebate opportunities to remove grass an install California native plants.  Effective December 1, 2015, all customers will receive a monthly bill.  Multi-Family, commercial and potable landscape accounts were billed bi-monthly previously.  ",479.3,AF,"201,376,182", 86.4 ,70,No Correction,South Coast,
15-Nov,11/01/2015  00:00:00,Oxnard  City of,2,Yes,1837.75,2101.63,AF,,196720,61.47,,,60.76,AF,"199,802,319", 61.5 ,60.59,No Correction,South Coast,
15-Nov,11/01/2015  00:00:00,"Tehachapi, City of",3,Yes,100.141,131.05,AF,,8923,57.921,,,0,AF,"6,849,397", 70.9 ,58.18,No Correction,Tulare Lake,
15-Nov,11/01/2015  00:00:00,La Habra  City of Public Works,Stage 2,Yes,646.47,704.26,AF,,63118,81.78,,,0,AF,"51,484,525", 83.4 ,75,No Correction,South Coast,
15-Nov,11/01/2015  00:00:00,Lake Arrowhead Community Services District,"Stage 3 + Lvl 1: 0 irr 7.5 mos, 2 days/wk 4.5 mos",Yes,72.41,84.68,AF,"60% of the homes in our water service area are occupied part-time and are not accounted for in the census.  The actual population is calculated using wastewater flows which also provide seasonality.  Additional analysis using billing information confirms a seasonal population that ranges from 15,000 to 33,000.",22718,30.2,"The District has AMI on 100% of its meters and monitors and responds to all meters with high or constant usage.  Ordinances provide specific warning and penalty levels:  1st violation receives a written warning.  2nd violation in a calendar year receives a $250/day penalty, 3rd violation $500/day.  After that a water flow restricting device can be installed or water service turned off. ","Irrigation is restricted to specific hours two days per week.  No irrigation is allowed 7.5 months of the year.  The District does not allow any new turf grass to be installed and when replacing existing turf, it must be reduced by 50%.  New connection permits are limited to 5 per month.  No hardscape can be hose washed and when washing a car, a bucket and shut-off nozzle must be used.  Penalties are issued.  Other restrictions are in place.  All of the restrictions issued by the current SWRCB resolution have been adopted by ordinance.",0,AF,"3,010,867", 30.2 ,87.24,No Correction,South Lahontan,
