Reporting_Month,Timestamp,Supplier_Name,Stage_Invoked,Mandatory_Restrictions,Total_Monthly_Potable_Water_Production_2014_2015,Total_Monthly_Potable_Water_Production_2013,Units,Qualification,Total_Population_Served,REPORTED_Residential_Gallons_per_Capita_Day,Optional_Enforcement_Actions,Optional_Implementation,Optional_Recycled_Water,Recycled_Water_Units,CALCULATED_Production_Monthly_Gallons_Month_2014_2015,CALCULATED_Production_Monthly_Gallons_Month_2013,CALCULATED_R_GPCD_2014_2015,Percent_Residential_Use,Comments_Corrections,Hydrologic_Region,CALCULATED_R_GPCD_2013
14-Nov,11/01/2014 00:00,Golden State Water Company Placentia,Stage 2,Yes,551.0,571.1,AF,"Percent Residential Use based on 2013 billing data for the volume of water provided to residential customers for the same reporting month.  Total Population Served: Used simplified California Urban Water Service Area Population methodology  Indirect Potable Reuse (IPR) allocated to Golden State Water Company for October 2014 by OCWD is 340.7 AF of which 95.1 AF has been prorated to the Placentia System. For November 2014, the Total Monthly production was 551.0 AF of which approximately 95.1 AF was from IPR. Therefore, the adjusted Total Monthly Water Production for November 2014 is 455.9 AF and the adjusted GPCD is 75 ",46543,90.0,,NULL,-99999,NULL,179544136,186093750,90.5,0.7040000000000001,No Correction,South Coast,93.8
14-Nov,11/01/2014 00:00,Huntington Park  City of,Phase 3,Yes,356.0,381.0,AF,"Upon review of data previously submitted, the calculation of % of residential use and R-GPCD were incorrect. Previous billing data was not used as one of components of the calculation. The back-up calculation information will be submitted (emailed) directly to the State Water Board c/o Jessica Bean.",64219,46.0,,,-99999,NULL,116003108,124149394,45.9,0.7619,No Correction,South Coast,49.1
14-Nov,11/01/2014 00:00,Helix Water District,Level 2 Drought Alert,Yes,2578.0,2566.0,AF,Residential water use estimate is based on a three year average as Helix reads meters on rolling two-month billing cycles and sales numbers by individual month are not available.,268802,83.6,,,-99999,NULL,840044979,836134762,83.3,0.8,No Correction,South Coast,82.9
14-Nov,11/01/2014 00:00,Manhattan Beach  City of,,,404.0,436.0,AF,% residential recalculated based on actual billing data. ,35996,85.9,,Population recalculated based on US Census data.,-99999,NULL,131643977,142071222,85.9,0.705,No Correction,South Coast,92.8
14-Nov,11/01/2014 00:00,Lakeside Water District,2,Yes,299.4,299.35,AF,New population based on UWMP updated projection,35500,82.44,,,-99999,NULL,97559917,97543625,82.4,0.9,No Correction,South Coast,82.4
14-Nov,11/01/2014 00:00,Carpinteria Valley Water District,Stage 1 (modified),Yes,310.9,384.5,AF,Potable water production preliminary estimate (12/12/2014). Non-revenue Water based on Total Produced and Delivered less Monthly Metered Sales. Percentage Residential use based on Monthly Metered Sales.,14616,77.6,,,-99999,NULL,101307209,125289874,77.6,0.336,No Correction,Central Coast,96.0
14-Nov,11/01/2014 00:00,Lakewood  City of,PHASE 2,Yes,573.4,636.12,AF,"TOTAL LAKEWOOD POPULATION = 80,048.  CITY OF LAKEWOOD SERVICE AREA POPULATION = 59,081.  GOLDEN STATE WATER COMPANY SERVICE AREA = 20,967.  LIKE MANY WATER UTILITIES, THE CITY OF LAKEWOOD BILLS BI-MONTHLY; THEREFORE, WATER PRODUCTION DOES NOT CORRESPOND WITH METERED WATER SALES.  PER CAPITA DATA IS CALCULATED BY USING A TWO MONTH RESIDENTIAL WATER USE PERCENTAGE DIVIDED BY 2.  ",59081,96.0,,,-99999,NULL,186843208,207280610,95.9,0.91,No Correction,South Coast,106.4
14-Nov,11/01/2014 00:00,Lynwood  City of,Permanent Water Conservation,Yes,449.12,423.51,AF,,65965,73.95,,,-99999,NULL,146346393,138001338,74.0,1.0,No Correction,South Coast,69.7
14-Nov,11/01/2014 00:00,Las Virgenes Municipal Water District,Stage 3,Yes,1494.0,1655.0,AF,1) Report revised to include potable water supplement to recycled water system in total monthly production figures.  2) Percentage residential use reflects sales data included in published 2014/2015 fiscal year budget document.,75384,184.0,n/a,,330,AF,486822032,539284112,184.1,0.855,No Correction,South Coast,203.9
14-Nov,11/01/2014 00:00,Chino Hills  City of,II,Yes,508636.0,542713.0,CCF,"The remaining 30% is non-residential, government, fire line, and dedicated landscape.",74738,118.78,,,52808,CCF,380486151,405977517,118.8,0.7,No Correction,South Coast,126.7
14-Nov,11/01/2014 00:00,Lodi  City of Public Works Department,1,Yes,264.8,315.8,MG,"Revised calculation (by Reed Group, Inc.) based on 2014 metered residential use indicates percent residential be revised to 64.7%.  Approved via email (E. Oppenheimer, SWRCB, 5/28/15) Non-revenue per 2010 Urban Water Management Plan, RMC, 2011",63651,89.8,,,-99999,NULL,264800000,315800000,89.7,0.647,No Correction,San Joaquin River,107.0
14-Nov,11/01/2014 00:00,Golden State Water Company S Arcadia,Stage 2,Yes,260.0,279.1,AF,Percent Residential Use based on 2013 billing data for the volume of water provided to residential customers for the same reporting month.  Total Population Served: Used simplified California Urban Water Service Area Population methodology ,26827,89.0,,NULL,-99999,NULL,84721371,90945133,89.7,0.852,No Correction,South Coast,96.3
14-Nov,11/01/2014 00:00,Lomita  City of,,,177.93,192.22,AF,,20463,85.0,,,-99999,NULL,57978744,62635161,85.0,0.9,No Correction,South Coast,91.8
14-Nov,11/01/2014 00:00,Golden State Water Company San Dimas,Stage 2,Yes,856.3,854.4,AF,Percent Residential Use based on 2013 billing data for the volume of water provided to residential customers for the same reporting month.  Total Population Served: Used simplified California Urban Water Service Area Population methodology ,54872,111.0,,NULL,-99999,NULL,279026577,278407459,111.4,0.657,No Correction,South Coast,111.1
14-Nov,11/01/2014 00:00,Ramona Municipal Water District,Stage Two,Yes,369.0,357.0,AF,,33600,119.0,,,-99999,NULL,120239177,116328959,119.3,1.0,No Correction,South Coast,115.4
14-Nov,11/01/2014 00:00,Monrovia  City of,Phase 1,Yes,179.0,197.0,MG,,39147,114.0,21 Work Orders were opened and investigated related to water conservation measures,,-99999,NULL,179000000,197000000,114.3,0.75,No Correction,South Coast,125.8
14-Nov,11/01/2014 00:00,North Coast County Water District,2,Yes,81895.0,101034.0,CCF,,39000,44.08,,, ,NULL,61261714,75578681,44.1,0.8420000000000001,No Correction,San Francisco Bay,54.4
14-Nov,11/01/2014 00:00,North Tahoe Public Utility District,2,Yes,24.437,23.09,MG,Using the monthly meter read for November 2014 (10/15/14 - 11/13/14) Commercial Use is 3.506 MG.,7500,96.23,,,-99999,NULL,24437000,23090000,93.0,0.856,No Correction,North Lahontan,87.8
14-Nov,11/01/2014 00:00,San Dieguito Water District,Drought Response Level 2 Condition,Yes,483.1,470.3,AF,,36959,118.7,,,44,AF,157418824,153247926,118.7,0.836,No Correction,South Coast,115.5
14-Nov,11/01/2014 00:00,Palmdale Water District,1,Yes,1319.3,1364.0,AF,,109395,156.0,,,-99999,NULL,429895788,444461346,104.8,0.8,No Correction,South Lahontan,108.3
14-Nov,11/01/2014 00:00,Olivehurst Public Utility District,2,Yes,56.0,117.0,MG,"11% used for parks, streetscape, schools and commercial",19509,85.2,,,-99999,NULL,56000000,117000000,85.2,0.89,No Correction,Sacramento River,177.9
14-Nov,11/01/2014 00:00,Twentynine Palms Water District,Stage 1,Yes,178.271,187.098,AF,,18795,87.6,,,-99999,NULL,58089860,60966150,87.6,0.85,No Correction,Colorado River,91.9
14-Nov,11/01/2014 00:00,Orchard Dale Water District,state,Yes,169.0,217.0,AF,pulled all internal information from office calculated all commercial and figured exact percentage per month plus updated population numbers using www.city-data.com/zip/90604.html,25605,57.0,,,-99999,NULL,55068891,70709760,57.4,0.8,No Correction,South Coast,73.6
14-Nov,11/01/2014 00:00,Phelan Pinon Hills Community Services District,,No,203.81,184.19,AF,,25160,85.15,,,-99999,NULL,66411779,60018574,88.0,1.0,No Correction,South Lahontan,79.5
14-Nov,11/01/2014 00:00,"Yreka, City of",2,Yes,29.87,33.5,MG,,7840,74.0,,,-99999,NULL,29870000,33500000,53.3,0.42,No Correction,North Coast,59.8
14-Nov,11/01/2014 00:00,Rubidoux Community Service District,Stage 2,No,133.47,136.04,MG,,29900,119.04,,,-99999,NULL,133470000,136040000,119.0,0.8,No Correction,South Coast,121.3
14-Nov,11/01/2014 00:00,Quartz Hill Water District,Stage I,Yes,346.83,330.87,AF,We are updating the report due to us using the wrong Population data... The data I was using was old and once I updated the data it changed it significantly. ,20352,181.4,,,-99999,NULL,113015050,107814462,181.4,0.98,No Correction,South Lahontan,173.1
14-Nov,11/01/2014 00:00,Pico Rivera  City of,1,Yes,369.0,383.0,AF,Previous submittal was revised to reflect residential % of water consumption based on the actual meter data for this month.  RGPCD was recalculated based on this new percentage for residential use.,39002,75.0,,,-99999,NULL,120239177,124801097,75.0,0.73,No Correction,South Coast,77.9
14-Nov,11/01/2014 00:00,Rincon Del Diablo Municipal Water District,Level 2,Yes,447.0,461.0,AF,"Commercial Water Use = 17%, Landscape Water Use = 8%, Ag Water Use = 1%, Construction Water Use = 3%",29955,115.0,,,333,AF,145655588,150217508,115.1,0.71,No Correction,South Coast,118.7
14-Nov,11/01/2014 00:00,San Fernando  City of,Stage 1,Yes,245.0,255.0,AF,,23728,94.0,,,-99999,NULL,79833600,83092114,94.2,0.84,No Correction,South Coast,98.1
14-Nov,11/01/2014 00:00,Riverside Highland Water Company,Stage 2,Yes,263.4,262.4,AF,,14500,159.82,,,-99999,NULL,85829266,85503414,159.8,0.81,No Correction,South Coast,159.2
14-Nov,11/01/2014 00:00,Rubio Canyon Land and Water Association,,Yes,157.0,173.0,AF,,9600,177.0,,,-99999,NULL,51158674,56372297,142.1,0.8,No Correction,South Coast,156.6
14-Nov,11/01/2014 00:00,Santa Fe Springs  City of,Phase 1,Yes,464.7,483.93,AF,Santa Fe Springs is comprised of 85% commercial / 15% residential properties,18199,74.88,,,36847,CCF,151423158,157689281,74.9,0.27,No Correction,South Coast,78.0
14-Nov,11/01/2014 00:00,San Bernardino County Service Area 64,3,Yes,198.8,201.3,AF,This report was revised based on actual data and on the 3.7 persons/household.,14031,124.05,,,-99999,NULL,64779264,65593892,124.1,0.8061,No Correction,South Lahontan,125.6
14-Nov,11/01/2014 00:00,Valley County Water District,Stage 1,Yes,553.18,597.11,AF,,70271,57.92,"First Violation - Educate and provide information about water use practices and conservation measures. Second Violation - Written warning outlining the need for action to implement appropriate corrective measures. Additional Violations - Monetary penalties:  Third Violation - $25.00 penalty, Fourth Violation - $50.00 penalty, Fifth Violation - $100.00 penalty","We adopted Ordinance 04-14-126 in May 2014, which outlined our general water conservation and water use efficiency practices. In July 2014, we adopted Resolution 07-14-752 declaring a Stage 1 Water Supply Emergency in accordance with Ordinance 04-14-126. Field employees were trained on the ordinance, the appropriate education and enforcement.  Tickets are actively being given to customers who are in violation of our ordinance.  ",-99999,AF,180254492,194569146,59.9,0.7,No Correction,South Coast,64.6
14-Nov,11/01/2014 00:00,San Jacinto  City of,Voluntary,Yes,80695.0,97250.0,CCF,n/a,15200,119.0,n/a,n/a,-99999,NULL,60364052,72748052,119.1,0.9,No Correction,South Coast,143.6
14-Nov,11/01/2014 00:00,San Gabriel County Water District,1,Yes,464.91,505.44,AF,,45000,84.0,,,-99999,NULL,151491587,164698345,84.2,0.75,No Correction,South Coast,91.5
14-Nov,11/01/2014 00:00,Santa Ana  City of,Level 1 Water Shortage,Yes,2938.9,3046.2,AF,"Indirect Potable Reuse allocation for Monthly State Water Usage Report Groundwater Replenishment System (GWRS) Indirect Potable Reuse = 566.4 (November 2014) Adjusted Total Monthly Water Production-IPR = 2,372.5 AF Adjusted GPCD-IPR=  52.0 ",332005,52.0,,,-99999,NULL,957644759,992608617,64.4,0.67,No Correction,South Coast,66.8
14-Nov,11/01/2014 00:00,San Juan Capistrano  City of,Stage 2,Yes,620.3,605.2,AF,"Per-capita residential use has decreased almost 30% for the month of November 2014 compared to November 2013.  Per-capita residential use has decreased 25% from June 2014 to November 2014.  Two large new non-residential uses began this year. A golf course in the Citys service area used 5 acre feet in November 2014, and 0 acre feet in November 2013.  This is new demand, and accounts for some of the increased production.  Two large CALTRANS freeway construction projects plus a major road extension project also account for additional demand, with construction water overall using (~3 AF).  Agriculture used 14.2 AF in November. ",38491,109.0,"In November 2014, staff received and responded to 10 calls reporting leaks and water waste.  Additionally, staff has continued a cycle of patrols for overspray and runoff, and has contacted 4 additional sites this month where runoff occurred, or broken or stuck sprinklers were discovered.    An extensive site walk of a large Homeowners Association was undertaken, identifying broken and misaligned sprinklers, which were repaired that day.   Letters were sent to customers with usage in tier 3 and 4, alerting them that their usage was high. ","Per-capita residential use has decreased almost 30% for the month of November 2014 compared to November 2013.  Per-capita residential use has decreased 25% from June 2014 to November 2014.  A California Friendly gardening workshop was held for residents this month.  A flyer describing available rebates was included with monthly bills, and response has increased.  City staff responded to numerous email and telephone inquiries about the drought from members of the public, staff also met with Homeowner Association representatives.   ",-99999,NULL,202125640,197205284,104.0,0.594,No Correction,South Coast,101.4
14-Nov,11/01/2014 00:00,Serrano Water District,1,Yes,238.0,250.0,AF,6 percent of water used is CII and approximately 21 percent of Serrano's groundwater is indirect potable reuse which will not be included in the R-GPCD  ,6641,310.0,,,-99999,NULL,77552640,81462857,365.9,0.94,No Correction,South Coast,384.4
14-Nov,11/01/2014 00:00,Sunny Slope Water Company,1,No,129993.0,141173.0,CCF,,30611,103.13,Water Conservation Reminder door hangers ; message about water conservation on customer bills ; free toilet tank leak detecting tablets and water-efficient shower-heads available at office ; pamphlets about water conservation outside office door ; e-mail customers about upcoming water conservation workshops,,-99999,NULL,97241517,105604738,101.7,0.96,No Correction,South Coast,110.4
14-Nov,11/01/2014 00:00,Sonoma  City of,Stage 2,Yes,105.2,150.4,AF,,11426,100.1,,,-99999,NULL,34279570,49008055,70.0,0.7,No Correction,San Francisco Bay,100.1
14-Nov,11/01/2014 00:00,Sweetwater Authority,Stage 2,Yes,1529.22,1616.38,AF,,189970,61.77,,,-99999,NULL,498298519,526699730,61.8,0.7064,No Correction,South Coast,65.3
14-Nov,11/01/2014 00:00,Suburban Water Systems San Jose Hills,Stage 1,No,2093.9,1931.95,AF,,178500,90.92,,,60.37,AF,682300303,629528664,90.9,0.7136,No Correction,South Coast,83.9
14-Nov,11/01/2014 00:00,Ukiah  City of,2,Yes,47.666,69.337,MG,,16075,99.0,,,-99999,NULL,47666000,69337000,54.4,0.55,No Correction,North Coast,79.1
14-Nov,11/01/2014 00:00,Arcadia  City of,Phase I,Yes,1240.8,1267.0,AF,,57639,234.0,,,-99999,NULL,404316451,412853758,180.0,0.77,No Correction,South Coast,183.8
14-Nov,11/01/2014 00:00,Suburban Water Systems Whittier/La Mirada,Stage 1,No,1577.13,1694.81,AF,,115000,105.05,,,-99999,NULL,513910061,552256257,105.1,0.7053,No Correction,South Coast,112.9
14-Nov,11/01/2014 00:00,Golden State Water Company Artesia,Stage 2,Yes,432.9,447.8,AF,Percent Residential Use based on 2013 billing data for the volume of water provided to residential customers for the same reporting month.  Total Population Served: Used simplified California Urban Water Service Area Population methodology ,47978,70.0,,NULL,6,AF,141061083,145916269,70.6,0.72,No Correction,South Coast,73.0
14-Nov,11/01/2014 00:00,Golden State Water Company Claremont,Stage,Yes,728.2,748.9,AF,Percent Residential Use based on 2013 billing data for the volume of water provided to residential customers for the same reporting month.  Total Population Served: Used simplified California Urban Water Service Area Population methodology ,37160,137.0,,NULL,-99999,NULL,237285009,244030134,137.3,0.645,No Correction,South Coast,141.2
14-Nov,11/01/2014 00:00,Golden State Water Company Bell-Bell Gardens,Stage 2,Yes,381.9,407.8,AF,Percent Residential Use based on 2013 billing data for the volume of water provided to residential customers for the same reporting month.  Total Population Served: Used simplified California Urban Water Service Area Population methodology ,57934,54.0,,NULL,13.9,AF,124442660,132882212,54.3,0.758,No Correction,South Coast,58.0
14-Nov,11/01/2014 00:00,Golden State Water Company Florence Graham,Stage 2,Yes,398.1,389.4,AF,Percent Residential Use based on 2013 billing data for the volume of water provided to residential customers for the same reporting month.  Total Population Served: Used simplified California Urban Water Service Area Population methodology ,65492,52.0,,NULL,-99999,NULL,129721453,126886546,52.1,0.789,No Correction,South Coast,51.0
14-Nov,11/01/2014 00:00,Golden State Water Company Barstow,Stage 2,Yes,385.4,403.9,AF,Percent Residential Use based on 2013 billing data for the volume of water provided to residential customers for the same reporting month.  Total Population Served: Used simplified California Urban Water Service Area Population methodology ,31209,69.0,,NULL,-99999,NULL,125583140,131611391,70.6,0.526,No Correction,South Lahontan,73.9
14-Nov,11/01/2014 00:00,Golden State Water Company Norwalk,Stage 2,Yes,368.5,386.6,AF,Percent Residential Use based on 2013 billing data for the volume of water provided to residential customers for the same reporting month.  Total Population Served: Used simplified California Urban Water Service Area Population methodology ,44466,60.0,,NULL,19.8,AF,120076251,125974162,60.5,0.672,No Correction,South Coast,63.5
14-Nov,11/01/2014 00:00,Upland  City of,Year Round,Yes,641840.0,634395.0,CCF,Percent residential use is based on billing data for the previous year.  Upland's billing schedule is every 2-months.  The population estimate was obtained from the Department of Finance estimate 1/1/2014.,75147,153.0,,,17004,AF,480129662,474560416,153.3,0.72,No Correction,South Coast,151.6
14-Nov,11/01/2014 00:00,Golden State Water Company Ojai,Stage 2,Yes,138.8,164.2,AF,Percent Residential Use based on 2013 billing data for the volume of water provided to residential customers for the same reporting month.  Total Population Served: Used simplified California Urban Water Service Area Population methodology ,7188,155.0,,NULL,-99999,NULL,45228178,53504804,154.8,0.738,No Correction,South Coast,183.1
14-Nov,11/01/2014 00:00,Golden State Water Company Simi Valley,Stage 2,Yes,509.1,569.2,AF,Percent Residential Use based on 2013 billing data for the volume of water provided to residential customers for the same reporting month.  Total Population Served: Used simplified California Urban Water Service Area Population methodology ,43351,94.0,,NULL,-99999,NULL,165890961,185474632,94.4,0.74,No Correction,South Coast,105.5
14-Nov,11/01/2014 00:00,Golden State Water Company Southwest,Stage 2,Yes,2231.1,2343.5,AF,Percent Residential Use based on 2013 billing data for the volume of water provided to residential customers for the same reporting month.  Total Population Served: Used simplified California Urban Water Service Area Population methodology ,271677,61.0,,NULL,49.5,AF,727007119,763632819,61.1,0.685,No Correction,South Coast,64.2
14-Nov,11/01/2014 00:00,Golden State Water Company West Orange,Stage 2,Yes,1178.4,1247.1,AF,"Percent Residential Use based on 2013 billing data for the volume of water provided to residential customers for the same reporting month.  Total Population Served: Used simplified California Urban Water Service Area Population methodology  Indirect Potable Reuse (IPR) allocated to Golden State Water Company for October 2014 by OCWD is 340.7 AF of which 203.3 AF has been prorated to the West Orange System. For November 2014, the Total Monthly production was 1,178.4 AF of which approximately 203.3 AF was from IPR. Therefore, the adjusted Total Monthly Water Production for November 2014 is 975.0 AF and the adjusted GPCD is 58 ",111904,68.0,,NULL,-99999,NULL,383983322,406369315,69.5,0.608,No Correction,South Coast,73.6
14-Nov,11/01/2014 00:00,Grover Beach  City of,Phase 3 ,Yes,76.31,139.63,AF,,13156,66.03,,,-99999,NULL,24865722,45498635,51.7,0.82,No Correction,Central Coast,94.5
14-Nov,11/01/2014 00:00,Coachella  City of,Stage 2,Yes,180.25,184.0,MG,percentage based on last years residential customers use.,45591,96.39,,,-99999,NULL,180250000,184000000,92.3,0.7,No Correction,Colorado River,94.2
14-Nov,11/01/2014 00:00,Compton  City of,1,Yes,592.0,620.0,AF,,81963,54.0,,,-99999,NULL,192904045,202027885,54.1,0.69,No Correction,South Coast,56.7
14-Nov,11/01/2014 00:00,Valley Water Company,Extraordinary,Yes,276.4,287.0,AF,,9900,285.0,,,-99999,NULL,90065334,93519360,285.1,0.94,No Correction,South Coast,296.0
14-Nov,11/01/2014 00:00,Cucamonga Valley Water District,Stage 2,Yes,3516.491,3644.68,AF,,199927,124.9,,,-99999,NULL,1145853610,1187624179,124.9,0.654,No Correction,South Coast,129.5
14-Nov,11/01/2014 00:00,Desert Water Agency,2,Yes,1190369.0,1341146.0,CCF,"The Agencys service area is highly seasonal making population analysis a complex task.  The State Water Resources Control Board (State Board) analyzes data on a per capita basis.  Historically, DWA has submitted data based on the permanent population of the service area; however that data does not accurately reflect water use  in DWAs service area which has a highly seasonal population.  Based on local data, the correct population is higher than previously reported.  The Residential Gallons Per Capita Per Day (R-GPCD) is being resubmitted to reflect the corrected population. ",119824,168.71,,,-99999,NULL,890457849,1003246878,168.9,0.6817,No Correction,Colorado River,190.2
14-Nov,11/01/2014 00:00,La Verne  City of,5,Yes,522.22,568.22,AF,"La Verne bills its customers bimonthly.  Therefore, not all residential customers are billed during a given month.  As such, each monthly production report will have a varying percentage of water use going to residential.  R-GPCD number below will appear low this reporting period due to the above condition.  Running average for June 2014 through reporting period is 88.30 gpd. ",32228,50.58,,,-99999,NULL,170166132,185155298,101.2,0.5748,No Correction,South Coast,110.1
14-Nov,11/01/2014 00:00,Fullerton  City of,One,Yes,2158.37,2195.73,AF,Actual residential percentage.,138000,96.44,Door hangers were given out and some water wasters were contacted. Some complaints did not provide sufficient information for a follow-up.,Subtracted system loss from total production to calculate R-GPCD. Indirect Potable Reuse through GWRS 293.0 AF.,293,AF,703307944,715481754,107.7,0.6341,No Correction,South Coast,109.6
14-Nov,11/01/2014 00:00,Sierra Madre  City of,3,Yes,169.0,189.5,AF,"Remaining use is commercial, industrial, and institutional",10971,162.47,,In 2013 the City of Sierra Madre established a base use for each meter service using the last 3 billing periods of 2012 and the first 3 billing periods of 2013. In 2013 the City of Sierra Madre implemented mandatory 20% reduction of base year use.  In 2014 the City of Sierra Madre implemented an additional 10% reduction of use from residents base year use. In total Sierra Madre residents are required to reduce 30% from base year use.,-99999,NULL,55068891,61748845,162.3,0.97,No Correction,South Coast,182.0
14-Nov,11/01/2014 00:00,Georgetown Divide Public Utilities District,2,Yes,29.07,35.964,MG,"District also provides seasonal, non treated irrigation water",9499,157.0,,,-99999,NULL,29070000,35964000,102.0,1.0,No Correction,Sacramento River,126.2
14-Nov,11/01/2014 00:00,Norwalk City of,1,Yes,54.62,58.17,MG,,18361,89.2,,,-99999,NULL,54620000,58170000,89.2,0.9,No Correction,South Coast,95.0
14-Nov,11/01/2014 00:00,Glendora  City of,1,Yes,829.77,913.23,AF,"The City of Glendora has been very proactive with our conservation efforts. In 2009 our Council adopted mandatory Stage-1 restrictions. Which included 2.5 full time employees which included 2 Conservation Officers and a Managment Analyst, dedicated to conservation. The success of our program is measured against a 3 years base average of 2006, 2007 & 2008. ",48200,164.0,"No watering between 8am and 5pm. Excessive runoff is prohibited. Hoses must have shut off nozzles. Leaks must be repaired within 24 hrs. Restaurants provide water glasses only upon request. We green tag violators and issue fines for repeat offenders.  2.5 full time employees which included 2 Conservation Officers and a Management Analyst, dedicated to conservation. Two additional conservation officers have just been hired to patrol after hours for runoff. ","Water Use Efficiency surveys.  Presentations at 3dr, 5th and 6th grade classes. Poster Slogan Contests. Presentations at local clubs such as Rotary and Kiwanis. Large rebate program. $4 per sq/ft turf removal program ($2 MWD & $2 Glendora). Conservation booths and give aways at local events. ",-99999,NULL,270381739,297577299,158.9,0.85,No Correction,South Coast,174.9
14-Nov,11/01/2014 00:00,Santa Fe Irrigation District,Level 2,Yes,801.3,701.9,AF,,19386,376.3,,,-99999,NULL,261104748,228715117,377.1,0.84,No Correction,South Coast,330.3
